Birth Control	D11, 19-24 Female  on Treatment for 1 to 6 months (Patient) 	5	5	1	Female	19-24	9/3/2012 10:16:21 PM	I am on my second shot, and it will most definitely be my last. I have bled the entire time that I have been on the shot, with just a couple of days free of bleeding. I have headaches every single day. Lately I started having body aches and stomach pains. Please seriously consider all other options before taking this shot. 
Other	35-44 Female  on Treatment for 6 months to less than 1 year (Patient) 	1	5	1	Female	35-44	8/30/2012 11:41:42 PM	I have had severe bleeding for several years during my peri-menopausal time. My MD suggested this med. I have had two shots. My side effects: headaches, fatigue, bleeding for 2 months of the 3, weight gain, bone pain, hair loss, and acne. Acne at 40? Please don't take this medication. From a Labor and Delivery Nurse, don't take it!!
Birth Control	19-24 Female  on Treatment for 6 months to less than 1 year (Patient) 	1	1	1	Female	19-24	8/29/2012 11:03:34 AM	I have take the shot twice, but refused to get a third because of the non-stop bleeding. I have been on my period every single day for the last 8 months!!! DO NOT TAKE THIS DRUG. very awful side effects. still waiting for my period to stop... it is absolutely miserable. 
Birth Control	tobeme, 19-24 Female  on Treatment for 1 to 6 months (Patient) 	5	5	2	Female	19-24	8/23/2012 1:38:30 PM	I used to get the depo shot when I was 15. I got 4 injections. I had no side effects. The only thing was I wouldnt have a period for 2 months, then for the entire last month i would have a period. The bleeding wouldnt stop until the day I got my shot.Now 21 I decided to get one depo injection to be protected until I got an Iud. I got the shot on my period, had a regular period. A month later got my period again and have been on it for over a month. Its very light, but still very annoying. Ive also gained 3 pounds. 
Birth Control	Lola Lola , 19-24 Female  on Treatment for 1 to 6 months (Patient) 	5	1	1	Female	19-24	8/16/2012 12:21:48 AM	I am a 21 year old female. I took the shot September of 2011 and I never took it again. ACNE AND LAZINESS WAS WHAT I GOT FROM USING THIS. And I have not had a regular period since....it is now August 2012. I may spot for a week and experience cramping but no regular periods. I DO NOT RECOMMEND THIS.
Birth Control	HeyyJessie22, 19-24 Female  on Treatment for 1 to less than 2 years (Patient) 	4	5	2	Female	19-24	8/13/2012 10:48:18 PM	I got the shot 4 times. After the 4th shot I decided to get off of the shot because I gained about 5 lbs. with every shot. With the first 3 shots I got my period about 2 weeks before I was supposed to get the shot again. It's now been a month since I was supposed to get the 5th shot and I still haven't had my period.  I also realized after the fourth shot that I was having headaches every day that I did not have when I was on the pill. I would not recommend to anyone to go on depo. the weight gain, headaches, bone loss, and uncertainty that go along with it aren't worth not having to take a pill every day.
Birth Control	19-24 Female  on Treatment for 2 to less than 5 years (Patient) 	5	5	5	Female	19-24	7/23/2012 5:06:14 AM	I enjoyed being on the shot but wished there was a listing of side effects of coming of the shot.
Birth Control	lisa aguirre , 35-44 Female  on Treatment for 1 to 6 months (Patient) 	1	1	1	Female	35-44	5/22/2012 11:20:13 PM	this could be my worst night mere but i am not dreaming , i got this shot on 2 /15/2012 a a home town clinic because they happen to be out of my pill as chose of bc and not knowing how wrong it would be for me , i woke up at 3:00 am the next morning just 9 hours after getting this shot , and it was like a horror film i started shaking uncontolibly and hard chest pain , shortness of breath and felt like my heart rate was a 100 hbm, and i was lying down ,soon depression and anxiety set in and hair loss soon i could not be near my family , i felt lost and in a deep dark hole i could not get out of , i even cry out in front of my children scared to death of every thing , weak and to unstable to even get out of bed every day as a fight to live . by the Grace of God i am still here to tell you not to get this shot, thankfully i had friends who cared and love me and a suporting husband i live to see today.... hope this gives you hope to keep on ... LA  
Birth Control	HeatherHugz, 13-18 Female  on Treatment for 1 to 6 months (Caregiver) 	4	5	1	Female	13-18	5/11/2012 10:07:04 AM	DO NOT GET THIS SHOT!I got my first depo in march of 2012. And i just turned 18 and i am a certified nurse assistant. Before the shot i was 130, 5'2&quot; . I am now 115, and still loosing. Which that part im happy about BUT.Ever since i have had increased anxiety and depression, hormonal, and the bleeding still has not stopped. I feel weak all the time and i don't feel like getting out of bed. If i fall or something i feel old because it hurts to get up and my body seems to take it way harder than it use to. I have lots of chest pains and i overall just dont feel good. This drug has a black box warning...I wish i would have done my research.Im due for my second shot in july. I'm not getting it, ever ever again.
Birth Control	Chelsea, 19-24 Female  on Treatment for 1 to less than 2 years	2	5	2	Female	19-24	5/8/2012 2:40:13 PM	I started the shot when I was 15 and continued till I was almost 19 and I loved it! Never had any side effects (weight gain, acne, break through bleeding) but then I went off birth control entirely and then experimented with a few different kinds only to come back to Depo Provera last May. It's awful this go around! I bleed and spot for two months at a time and have absolutely no sex drive.. I finally switched to the patch four days ago and my month long period seems to be subsiding.. I wouldn't recommend the shot, but some people do have a good experience with it. Overall, not satisfied. Although I didn't get pregnant so that's good!
Birth Control	leahbean, 19-24 Female  on Treatment for 5 to less than 10 years (Patient) 	5	5	5	Female	19-24	4/30/2012 6:08:17 PM	I Have been on Depo for 7 years as my birth control. i haven't had any trouble with it at all its very effective and i only have to get my shot every 3 months... easiest birth control out there in my opinion.v
Birth Control	Greatb.c., 19-24 Female  on Treatment for 5 to less than 10 years (Patient) 	5	5	5	Female	19-24	4/20/2012 11:30:23 PM	I have been on the depo since I was 17, I am now 24. I did experience MINOR spotting at the beginning which slowly decreased TO ABSOLUTELY NONE after short period of time. This usually was close to the time I was due for my shot. I choose this birth control for the ease of not having to remember to take a pill...Rest assure I was in a relationship for 6 years living together...so needless to say IT WORKS...I was concerned of the fact that they say not to be on this for a long period of time due to bone loss..but as a precautionary i asked my doctor to issue me a bone density test...which was perfectly normal about 2 years ago...I hear from alot of people that they got so fat on this ...personally i gained weight not from a drug...from eating at mcdonalds being comfortable in a relationship ...after gaining this weight i have recently in the past lost 54 lbs and kept it off for almost 2 years...so ladies don't blame the drug ...blame your eating habits! Definitely recommend this for everyone...I understand everyone is different and some people spot longer than most but it will stop in time...The fact that i hear all my friends complaining about periods ..just makes me smile and everytime i say &quot;I am so thankful i dont have to deal with that!&quot;
Birth Control	45-54 Female  on Treatment for 10 years or more (Patient) 	5	5	5	Female	45-54	3/16/2012 9:46:17 PM	
Other	45-54 Female  on Treatment for 5 to less than 10 years (Patient) 	5	5	5	Female	45-54	2/28/2012 12:14:58 AM	Depo has been great.  I haven't had a period, and likewise no cramps, for several years.  My cramps were so bad, I would have to take a day off from work every month.  I stopped getting the Depo shot only because the price charged by the providers went up by 150%!  I was due on 02/02/12, but didn't get it.  I'm curious to know what other women have experienced since quitting Depo.  My breasts, especially my nipples, have been very sensitive and painful since I didn't get my shot as due on 02/02/12.  Is this a normal withdrawal effect? 
Birth Control	JGreenstone, 35-44 Female  on Treatment for 1 to 6 months (Patient) 	1	3	1	Female	35-44	2/24/2012 9:27:01 AM	I received the depo-provera shot 1 month after giving birth to my 4th child and have not stopped bleeding in 4 months. The most frustrating is that I am a smoker over 35 so the dr keeps telling me to buck it up.  The extreme bleeding, mood instability and severe headaches have taken it's toll on my relationship.  I would NEVER suggest someone take a shot that lasts 3 months ever again and would not have taken it if the dr wouldn't have told me I didn't have a choice. When deciding whether or not to get this shot, DEFINITELY talk to your dr about side affects and what percentage of risk you are taking. Now that I am 4 1/2 months postpartum, the dr wants to run all kinds of tests and see what is really going on. This has been the most horrible experience I have ever had with medication.
Birth Control	Jessica, 13-18 Female  on Treatment for 1 to 6 months (Patient) 	2	1	1	Female	13-18	2/16/2012 4:31:59 PM	I started taking Depo-Provera because there was a possibility my boyfriend and I would become sexually active. I knew I would forget to take a pill everyday, and when I talked to my gynecologist, getting a shot once every three months sounded easy and convenient. I was told it would take a month or so for the drug to fully get into my system, and so for the first few weeks everything was normal. But after a month, I started having a period that has lasted for the past 2 months. My once clear face is now covered with acne, I have frequent migraines, and my doctor says there's a chance I may be anemic due to so much blood loss. If there's anything helpful I can say to you, it's simply to not use Depo-Provera. I know there are people who have used it and had a positive experience, but if ahead of time I would've known the possibility of these horrible side effects, I never would have risked using it. All the negative reviews on this website and others are not bored people making something up, they are people just like you who are trying to prevent their negative experience with this drug from happening to others. All I'm saying is know what you may be getting yourself into ahead of time, because once Depo-Provera is in your system, you're gonna have to wait a while before it's out.
Birth Control	Mt-mom, 25-34 Female  on Treatment for 1 to 6 months (Patient) 	5	5	5	Female	25-34	2/1/2012 1:55:10 PM	It was suggestedby my dr that I try depo as a form of bc as my endometriosis has gotten worse after the birth of my two kiddos.  I love it! No weght gain, no bad side effects except some mild discomfort at the injection site for a few hours after the shot.  No period and I'm able to function normally as opposed to the severe bleeding and anemia I was experiencing while on  the pill alone.  Our family is complete so the issue of pregnancy after getting off depo is not a factor for me.  My husband would get a vascetomy, but that wouldn't help my severe bleeding issues.  I will continue to get my bone denisty tested.  I take calcium and d3 and lift weights on a 6 day split. So far, so good.  I am also a bodybuilding (figure) competitor and this has been fantastic as I've had no cravings so sticking to my cutting diet for competition is super easy. Overall, this has been a fantastic option for myself and family planning.
Birth Control	Rummyk, 19-24 Female  on Treatment for 1 to 6 months (Patient) 	3	1	1	Female	19-24	1/31/2012 8:26:03 AM	I started taking the shot because I had a hard time remembering to take the pill. WORST DECISION EVER! The first couple of weeks were fine, and then for the next 2 months I've been on my period! I have migranes EVERY DAY! Unless it's medically necessary, I would choose something else!
Birth Control	Melissa, 35-44 Female  on Treatment for 5 to less than 10 years (Patient) 	5	4	1	Female	35-44	1/28/2012 9:32:48 PM	I started taking depo provera over 6 years ago (back before they had the warning label on it) I spotted a bit here and there for the first two months then it went away.  I kept taking the depo because my daily migraines were gone, no periods. no pregnancy.....what more could a woman want right? Wrong!!! My doctors were checking me for bone density. At first I had no bone loss (was taking calcium and magnesium supplements too) after the 5th year I went for my bone density test and docs suggested I do not take depo anymore cause I suffered a fair amount of my bone density (I am 39 now) I quit getting the depo shot.  I started to have alot of aches and pains in my body.  I am now on fibromyalgia medication.  Depo did more harm than it did good.  Please consider the negatives before the positives.  I wish I did :(
Birth Control	25-34 Female  on Treatment for 1 to 6 months (Patient) 	3	1	1	Female	25-34	1/23/2012 5:53:42 PM	I am 25 years old and my husband and I just had our first child. We both agreed that we want to put some time beteween our children. So I chose this method, because I always forget to take the pill. I was excited to read that I may NOT have a period at all while on the Depo. A dream come true, so I thought. Unfortunately I have had my period for 2 months and 17 days, with NO break. Seriously consider if you are willing to go 3 months... I'm not, it was my first injection, and it will be my last! I didn't read any reviews until after getting the Depo Injection, I'm regretting that decision now! 
Endometriosis	25-34 Female  on Treatment for 5 to less than 10 years (Patient) 	5	5	5	Female	25-34	1/11/2012 5:07:20 PM	I started on depo almost 8 years ago after a few months of treatment with Lupron.  The depo has completely taken care of the Endometriosis problem (I had two surgeries in 4 years - none since I started the depo).I loved not having a period.  I can't say I had any mood swings like others reported, and no real hair loss either.  I did gain about 40 pounds, but as that occurred during the same time I was switching from an active college lifestyle to my sedentary desk job, I'm not willing to completely blame the depo for that.I finally got off the depo because I'm thinking about getting pregnant in the near future.  I'm now on Seasonique and I hate, hate, hate the spotting, which I never had with the depo.
Endometriosis	tag, 35-44 Female  on Treatment for 10 years or more (Patient) 	5	5	4	Female	35-44	12/11/2011 7:09:02 AM	I was on the shot for ten years due to debilitating cramps and excessive bleeding associated with my menstrual cycle. I loved this drug because I got my life back. I started it while on my first combat tour to Afghanistan because I could not do my job with the excessive bleeding and cramps. The shot essentially shut down my reproductive system - no cramps, no bleeding, no horrible mood swings. I had no major negative side effects from the drug until probably the seventh year into the shots. I noticed that I had no real emotions and was sort of numb. I did not cry more than once a year and did not experience real happiness. That is the main reason I went off the drug. I did not note any weight gain nor did any of my friends, but this is probably because as members of the military  we were accustomed to having discipline in our exercise and eating habits. I could see a woman easily gain weight while on the drug because it does seem to increase your appetite. Thus, you need to have a lot of discipline when you are on this drug. Otherwise you will be unhappy with it in the long-term. I chose to stop the drug when I came into the window for my next shot on October 14, 2011 (two months ago). I bled for approximately ten days and that was the end of the major withdrawal effect other than my breast increasing a full cup size thanks to the estrogen. I noticed my moods return to normal very quickly (probably two weeks after the bleeding stopped) so I would cry again and otherwise have a positive outlook on life. I ovulated a month after being off the shot and have had what is probably normal period (albeit light with no major cramps) two weeks later. I should mention that I had the Mirena IUD inserted in early November, which may be part of the reason the period was light. In essence, I returned to normal very quickly and the IUD probably staved off a return to painful periods. I should note that I run approx 10 miles a day, which probably helped to quickly metabolize it.
Birth Control	Bee, 19-24 Female  on Treatment for 6 months to less than 1 year (Patient) 	4	5	1	Female	19-24	12/10/2011 2:23:37 AM	No pregnancy for a shot every three months seemed like a good deal, but the array of side effects had me switching b/c methods after nine months. I was moody, suffering from light bleeding for weeks-to-months at a time. Sex drive depleted and difficulty producing vaginal fluids, so sex was uncomfortable regardless. Was hungry frequently too. Overall I am glad I made the switch off. My advice:If it isn't working for you, switch sooner than later.
Birth Control	Luna, 25-34 Female  on Treatment for 2 to less than 5 years (Patient) 	1	1	1	Female	25-34	12/7/2011 11:06:18 PM	I used this for birth control and had been getting it for 3 years. I ended up bleeding &amp; spotting for the whole time (except the first two months) and now the lining of my uterus is paper thin. Also the side effects were killing me: NO sex drive At All,Extreme anxiety/depression,iron deficiency,diarrhea,nausea,weight gain (30pds)-lost too much weight because of the nausea recently and am very sickly. And the fact that my hair (which was long) fell out the entire time was not a plus either! I know that people want to take this to not have a period/seems &quot;simple/easy&quot;-- but beware, mostly it doesn't work like that and you're better off taking something else. I was so close to being put into a psych hospital it's not even funny! Now my doctor put me on a low estrogen bc: Jolivette...well see how That works out. Ah...the joys of being a woman.:) Good Luck
Birth Control	staweeze, 45-54 Female  on Treatment for 2 to less than 5 years (Caregiver) 	5	5	1	Female	45-54	11/14/2011 2:05:50 PM	My daughter has had no period since she gave birth 3 years ago.
Birth Control	25-34 Female  on Treatment for 1 to less than 2 years (Patient) 	5	5	1	Female	25-34	11/13/2011 9:05:54 PM	I was on this shot after i had my daughter in may of 07. I received my last shot in sept of 08. I weighed about 150 lbs(which is healthy weight for me) while on this shot however the longer i was on it the more the weight would creep up. I had also had a few very close friends gain enormous amounts of weight. I weigh an average of 200 after done with the shot. I eat the same and exercise the same as i did before the shot. My friends literally gained about 50 lbs while on this for a year!!! Nothing we have tried has helped us gained weight. I have tried dieting and working out everyday and still cant seem to get the weight back off!! I also read a study one time that said if you were on the shot for 2 years and gained weight it would be 10 times harder to lose weight after you quit the shot. I also had very bad mood swings and once i stopped the shot it took me about 9 months to get a period and over 2 years to get pregnant again and I was trying to get pregnant with my boyfriend! Overall i will never again use this form of birth control. I had a boy back in aug of 11 and my dr demanded i get my tubes tied or get the shot. So i had no choice but to get the shot again. I will not be getting any more EVER!! Id rather use condoms. 
Birth Control	Moody girl, 19-24 Female  on Treatment for 1 to 6 months (Patient) 	1	5	1	Female	19-24	10/26/2011 4:31:34 PM	I got the shot a little over three months ago. I reacted very poorly to it. I was either on my period or had heavy spotting throughout the majority of the cycle. Normally I have a high sex drive, that decreased immensely. When I would have sex it was near impossible to orgasm when prior to getting the shot was never an issue. I was emotional...always crying or freaking out. Unlike others didn't have problems with weight gain or acne, but the side effects are enough for me to stop and try something different. Everyone reacts differently but I reacted terribly to the Depo shot.
Birth Control	xtrasweet52, 19-24 Female  on Treatment for 6 months to less than 1 year	3	3	1	Female	19-24	10/25/2011 7:31:18 PM	I am 20 years old and I was on this birth control for the past 7 months. Yeah it kept me from getting pregnant... but i experienced some of the worst side effects from it. I had excessive periods... like 3 weeks out of every month i was bleeding. Because of that i rarely could engage in sexual activity. My mood had changed dramatically the whole time i was on this birth control. I was constantly snapping on people for little things, things that most people would not normally stress about, and i began to show little interest in stuff i ususlly like to do.  My moodiness, anxiety, and stress was way out of whack, and i actually came to a point where i was beginning to think i was not a normal person. My sex drive became significantly low... i barely wanted to be touched. I was also experiencing hair loss, and mild acne on my face. Im glad to be off of it now! Now that im off the depo all those side effects are disappearing. I now feel great and 100 percent normal physically, mentally, and emotionally. I do not, and will not recommend depo to anyone after what has happened to me and what ive experienced with it... but as for those of you who are having a wonderful time while on the depo ill give you kudos and i hope what happened to me will not happen to you.
Birth Control	Apryl, 25-34 Female  on Treatment for 5 to less than 10 years (Patient) 	5	5	2	Female	25-34	10/23/2011 9:30:51 PM	I had been on the depo shot for 6 years. I have been off of it for 3 months now. My periods stopped right away and I did not ''spot'' at all. In 6 years I gained 10 pounds. It's very hard to control wieght on the depo. My side effects were hair loss (always shedding... hair EVERYWHERE!), complexion worsened, depression, needed A LOT of sleep, anxiety, and mood swings. I am 25 years old and had perfect health prior to getting the depo. I am now trying to get pregnant and know it could be a long wait. It's been 3 months since my last dose and still no period. I was instantly able to drop weight and did not change my eating patterns or exercise regimen. Clearly, the depo was effecting that. My skin is now clear as well. Still feeling like it's working it's way out of my system. Mood has went back to normal. I would not recommend this drug to a family member or friend. My doctor did not tell me the risks of being on it for long periods of time (not recommended for longer than 2 years.)Also, my Doctor mentioned to take calcium but didn't stress how important this is. I'm sure I will have osteoporosis later in life. I will never go back on the depo shot again.  
Birth Control	jc4605, 35-44 Female  (Patient) 	5	5	5	Female	35-44	10/3/2011 9:51:01 AM	
Birth Control	35-44 Female  on Treatment for 1 to 6 months (Patient) 	4	4	2	Female	35-44	9/28/2011 1:33:00 PM	This is day 22 and spotting almost since I got the shot. Got on it to help my sex life but so far has ruined it. If I would've known this was going to happen I probably wouldn't have done it. Hoping this stops soon. Very irritating. Cramps too. 
Birth Control	Lizzie777, 25-34 Female  on Treatment for 10 years or more (Patient) 	5	5	5	Female	25-34	9/21/2011 1:30:31 PM	Have taken depo-provera for many years. I find it to be 100% effective and easy to remember. Every 3 months I go to my gyn's office and the nurse there gives me my shot. I have experienced some mild breakout on my face but it goes away a week after I get the shot. Overall it is worth it:)
Other	merian, 19-24 Female  on Treatment for less than 1 month (Patient) 	3	4	1	Female	19-24	9/15/2011 6:30:00 PM	 i would not recommend this shot . It ruin my body physical and emotional . I had my shot 29th of aug 2011 next day i had my  period and turns heavier till now it looks like its not gonna stop . Loss of apetite . Decresae your your milk if your brestfeeding . Legs and arms asleep it kills me  twice could not handle it .being drowsy . My husband told me im hypochondriac  . the worst part is bleeding . i hope i search the side effect of this products before i took it. now im having pain in my joints while im typing this review. wait wait ... another is hair loss ! i m so glad i had a thick hair ! my doctoe didnt tell me about the side effects im so regret taking this shot!  
