Endometriosis	LollieA, 25-34 Female  on Treatment for 6 months to less than 1 year (Patient) 	4	4	2	Female	25-34	11/20/2008 10:44:39 AM	Through the last 5 years, I have been on every form of birth control alternating every 3 months due to the pain of my period from Endometriosis. I did not want the Depo shot due to it having to stay in your system for 3 months regardless. I only opted for it as a last resort before surgery &amp; my sister had been on it for 7 years with no problems what-so-ever. I have had 3 injections and will NOT be getting my 4th. The first 2 injections, I was fine. Only once had break through bleeding. The last injection a little over a month ago has wreaked havock on my body! I am 32 and have had a severe, consistent breakouts on my face, neck and upper body. I am not a vain person but I am a professional and it is not attractive to look like a 15 year old girl. I have started loosing my hair by the hand fulls and within the last week, I have started having break through bleeding with severe cramping.  Not to mention the 30 pounds I have gained in one month! I will not be going back for the 4th time!  I would gladly go back to alternating pills every 3 months if my hair would stay on my head, my face looked like me and my body would stop blowing up!  I am now alternating pain medication to keep the cramping under control at the advice of my doctor and it is now staring to affect everyday life including work. This is not normal and I would not recommend this form of birth control to any woman regardless of the extent of her problems.
Birth Control	outlawson89, 19-24 Female  on Treatment for 1 to 6 months (Patient) 	4	5	3	Female	19-24	11/17/2008 1:01:03 PM	I am 19, and this isn't my first form of BC. When I first started my period at 11 I had severe problems with way too much bleeding, cramping, nausea...it just never seemed to quit. I just recently got married a few months ago and decided to try the Depo Shot for other obvious reasons. My first shot, I experienced a little bleeding and spotting, nothing major and I LOVED it. However, towards the ending of my second and beginning of my third shot, I started spotting discolored blood and discharge irreguarly and heavly. I also started feeling nausous, dizzy, experiencing horrible headaches, weakness, frequent urination, and being exhausted. When I first started, I also experienced weight loss. However a friend of mine, has experienced no side affects at all and she has been on the shot for about a year and a half....it's just a risk you take....
Birth Control	ladybug623, 25-34 Female  on Treatment for 1 to 6 months (Patient) 	5	5	1	Female	25-34	11/6/2008 9:52:39 PM	I only had two injections however that was enough. After the first inj I had constant breakthrough bleeding through the entire three months. After the second inj the breakthrough bleeding stopped, I gained 40 lbs. But the worse part was after not receiving a third inj due to cost I did not get my period back for 7 months (after the three months) I finally did get my period four months ago, and have had it for four months straight. It has now been over a year since my last shot and my mood swings in this year have been utter he@# for me and my family. Not to mention the worst migraines ever as well as cramps bloating nausea and vomiting. I would never dream of recommending this to anyone, It is not worth it!!!!!
Birth Control	crital01, 19-24 Female  on Treatment for 5 to less than 10 years (Patient) 	5	5	4	Female	19-24	10/31/2008 9:19:43 PM	I have been on depo for 6 years now and i love it! I dont get my period! I dont have any children and i only have to go get it every three months, i do have to say thought that the first 3 to 6 months were horrible, i had mood swings, some spotting and cried a lot for no reason, but after my body got use to it, its been great. Like with every drug that we take, its not going to be perfect for everyone, but this i would recomend to everyone that doesnt want to get pregnate
Birth Control	tired, 13-18 Female  on Treatment for 6 months to less than 1 year (Patient) 	3	3	1	Female	13-18	10/31/2008 8:32:58 AM	i took the depo shot in june of this year and have had my period ever since,i do not know what to do,my doctor has put me on an alternate birth control method to try to stop my period but nothin seems to work.
Birth Control	Maineac06, 25-34 Female  on Treatment for 10 years or more (Patient) 	5	5	3	Female	25-34	10/27/2008 10:33:57 AM	I have been on depo on and off for about 13 years. I started it when I was 15 and stopped when I got married at 18 within about 1 year I was pregnant with my son. After I had him I went back on depo. I took it for two years and then when my husband and I decided to have another child i stopped taking it again. It took almost 2 1/2 years for me to get pregnant with my daughter. I was very disappointed that it took so long for it to wear off. After I had my daughter I went back on depo and that was four years ago. I recently stopped taking it because in the last 4 years i have gained almost 80 pounds, which is disappointing since i am only five feet tall. I found this drug to be very effective but the side effect of the weight gain is a little much. I also found that while I was on it I did not have one period. That was one thing I loved about this for some reason I did not have any type of menstrual cycle while i was on it. But I am glad to be off of it now I have been taking the pill and have already lost 10 lbs in two months. so let's say that while the product was effective, the weight gain is a serious side effect.
Birth Control	songbird, 19-24 Female  on Treatment for 6 months to less than 1 year (Patient) 	5	5	3	Female	19-24	10/23/2008 8:10:53 PM	As a form of birth control this is very convenient and affective. However, within weeks of my first injection I started to experience very aggressive mood swings over the most trivial of things. This has been a very unstable, scary drug interaction to have. I would blank out and find myself yelling at my 2 and 4 year old over the stupidest things. I would take a simple disagreement with my husband and turn it into a confrontational battle that would last for hours. This personality is something that I've never had to feel or deal with. I've always been an easy going, compassionate person. I get these mood swings and all I can do is fall down and apologize, and cry. I'm too young for my doctor to approve a hysterectomy or getting my tubes tied. And my husband and I know we aren't having more children. So all i can really do is be aware, identify, and try my own preventative steps to decrease this reaction. PLEASE if the other medications can work for you use this shot as your last choice. If my husband and I wouldn't have seen the connection between my sudden attitude change and the time period that I started these injections, this drug interaction could have cost me my children and my marriage.   
Birth Control	19-24 Female  on Treatment for 1 to 6 months (Patient) 	5	5	1	Female	19-24	10/23/2008 10:26:09 AM	I went on Depo 3 months ago and I have been bleeding for the last 2 months. My doctor has tried hormone pills to reverse the bleeding but nothing has work. I will not be getting my next shot. 
Birth Control	19-24 Female  on Treatment for 1 to 6 months (Patient) 	5	4	1	Female	19-24	10/20/2008 2:45:57 PM	I just got my first shot about 2 1/2 months ago and will NOT be getting another. I've had irregular bleeding(1 day on 1 day off). I never knew when I was actually going to bleed. I've had horrible cramps. Thats not even the part I can't deal with, the moodswings are driving me and everyone else around me crazy. I feel like I've had the worse case of PMS for the last 2 months. I can't wait the shot to be out of my body. I hate it.
Birth Control	bearwoman1970, 35-44 Female  on Treatment for 1 to 6 months (Patient) 	5	5	4	Female	35-44	10/18/2008 2:20:48 PM	This is the third time I have been on the shot and the first 2 times I never had my period. Unfortunately this time it seems like my period is never going to end.
Birth Control	A, 35-44 Female  on Treatment for 1 to 6 months (Patient) 	5	5	3	Female	35-44	10/18/2008 9:31:20 AM	I HAVE BEEN ON DEPO FOR A YEAR.THE FIRST COUPLE OF MONTHS WERE TOUGH,HEAVY BLEEDING,ON AND OFF SPOTTING. AFTER MY 3RD SHOT IT HAS BEEN GREAT. NO PERIODS!! ASIDE FROM BLOATING I LOVE THIS SHOT. AND PLEASE TAKE YOUR CALCIUM..
Birth Control	ENM, 25-34 Female  on Treatment for 1 to 6 months (Patient) 	3	3	1	Female	25-34	10/17/2008 10:34:45 AM	I took my first (and only) shot in Feb 2008. I started bleeding 2 weeks after the shot and it lasted for 4 weeks. Apparently this was all normal and the doctors said not to worry. I stopped bleeding for 2 weeks in March, but it started right back up again. It is now October 2008 and I am still bleeding and cramping. My doctor put me on the nuva ring to stop the bleeding and it did for a month, but it came back and didnt quit. I am 25 years old and want to start having kids. I have been to the doctor 4 times and they havent done anything to help me. DO NOT TAKE THIS SHOT! There is no way of knowing how your body will take it. Try other options!
Birth Control	25-34 Female  on Treatment for 1 to 6 months (Patient) 	5	5	1	Female	25-34	10/16/2008 8:08:36 PM	Do not take this drug! I felt fine for the first month after my first injection and then everything went downhill.  I was extremely fatigued, weak, had headaches, dizziness and anxiety.  I also had unpredictable, irregular bleeding and generalized cramps daily.  It is now 6 months later and I am continuing to experience these side effects. Had I read these reviews before getting the shot, I would never have done it.  Needless to say, I didn't get a second dose.
Birth Control	jebranscome, 25-34 Female  on Treatment for 6 months to less than 1 year (Patient) 	4	4	1	Female	25-34	10/14/2008 10:55:06 AM	I hate this stuff.  Never in my life will I ever be on this again.  I have had mood swings, depression, weight gain, and just been overall in a bad mood since I have been on this.  I have been off for 6 mo. and my periods are still eratic and I have menstral cramps every day.  I cannot wait till this wears completely off.  It is a terrible thing to be depressed all the time, especiallu with two young children around.  No one should have to live like that.
Birth Control	I need some help!, 35-44 Female  on Treatment for 2 to less than 5 years (Patient) 	4	2	1	Female	35-44	10/13/2008 9:21:23 PM	After I had my son and 20 yrs old, I thought this was a wonderful drug, no period, one simple shot every 3 months, this was going to be great, December 2008 I will be on this for 2 yrs. I HATE THIS! No pms whooo hooo, no sex dry, much dryness, mood swings, the crying the madness, it's killing me. I have heard about the periods, not getting pregent after, I want another child, so I'm coming off this month, periods, and pain have got to be better then all of the above! My husband hates it, and he hates what it has done to me, he still loves me and has stuck by me though all this madness, but..if you think you might take this drug....DON'T!!!!!! Its good at first, but in the long run, you will need some kind of pill. It will cause the sexless nights, hair lost, mood swings, dryness, panic nights, bad dreams, headaches, and it will drive you CRAZY!
Birth Control	cheer4svsu, 25-34 Female  on Treatment for 1 to less than 2 years (Patient) 	2	4	2	Female	25-34	10/13/2008 5:31:28 PM	Great for preventing pregnancy and only had periods every three months, but periods are very erractic once you get off the shot....and good luck getting pregnant with that!  i was told up to a year for my periods to regulate themselves.  No way of knowing if im pregnant other than pee test at the hospital.
Other	19-24 Female  on Treatment for 5 to less than 10 years (Patient) 	5	5	4	Female	19-24	10/8/2008 8:41:44 PM	I have been on depo for over 5 years, with no problems except weight gain. I've gained about 30 pounds in the 5 years, but that has been my only issue. I had bad migranes right before I needed another shot, but getting the shot a few days earlier eliminated that problem.
Other	19-24 Female  on Treatment for 1 to less than 2 years (Patient) 	5	5	4	Female	19-24	10/4/2008 12:16:12 PM	i've been on depo for 1 year now and its going great. At first i was really moody and became so dizzy i would have to leave work. But now everything is really good,I dont experience any side effects.The only thing i don't like about the shot is water retention but i found out taking bloating pills-i use 'beat the bloat'- helps out A LOT and since I started using the bloating pills i have been able to keep my weight under control. I love depo and I will continue to use it.
Birth Control	Not for everyone, 35-44 Female  on Treatment for 5 to less than 10 years (Patient) 	4	5	3	Female	35-44	10/2/2008 4:32:45 PM	I was somewhat satisfied with my experience on Depo. I immediately stopped having a period and only spotted a handful of times the entire time I was on it. The problem is when I stopped taking it. It was only after I started to question the side effects such as loss of sex drive (which I attributed to other things) and being on the drug for an extended amount of time (8 years) that my doctor suggested a bone density test. Needless to say, my bones were damaged and now I am in my mid 30's, taking calcium supplements and osteoporosis medication. I have also been treated for mastitis, which occurs in breast feeding women and can occur in women going through menopause, neither of which I qualify for. I don't know if this is a direct result of using the drug but it is the only thing that makes sense to me. I would suggest anyone looking into using this drug to do your homework and ask your doctor lots of questions. I made the mistake of thinking this method of BC was too convenient and because I was not having major issues there was no concern by me or my doctor to discontinue use. Only because of my bone density test am I now off this medication. Not having a period was very convenient but I would have chosen another path for the sake of being healthy.
Birth Control	carriec0990, 13-18 Female  on Treatment for 6 months to less than 1 year (Patient) 	3	4	2	Female	13-18	9/29/2008 8:08:46 PM	I experienced heavy periods for months straight and it has really been a pain for me.  I dont think my body likes hormones so i would always suggest getting in depth infor before starting birth control.
Birth Control	25-34 Female  on Treatment for 1 to 6 months (Patient) 	5	5	2	Female	25-34	9/23/2008 3:45:28 PM	After taking the shot for 6 months, I am going off of it. I read other's feedback and am starting to believe this drug affected me negatively. I enjoyed not having PMS or a period for 6 months. However, my hair is beginning to fall out in clumps and I am only 26! I did not remember this was a side effect until I read what others wrote. Also in the 6 months I went on it, I have been having panic attacks and extreme anxiety. I thought it was due to my new job but after reading everyone else's side effects, I am beginning to rethink the reason for my anxiety may be this the depo. I even began taking xanax because of the anxiety. Now I am thinking I don't need any of these drugs at all! I would rather have a baby. I couldnt remember to take my pills on time so I chose depo.  I am going off birth control all together now. Also on the webmd site it says this drug shouldnt be taken if you are a heavy drinker. Noone asked me when I started taking it if I drink. I wouldnt consider myself a heavy drinker but as a single 26 year old woman I go out quite often and drink and have never thought this should be a concern involved with this drug. I would recommend this to a woman with absolutely unbearable periods but not to anyone who has the slightest bit of depression or anxiety. Also it caused a lack of sex drive and dryness. My forehead broke out in MAJOR ACNE I NEVER HAD within a week of getting my first shot. It is going away now that I am in the final stages of this shots cycle. I am done with depo forever!
Birth Control	Frusterated, 35-44 Female  on Treatment for 1 to 6 months (Patient) 	5	5	1	Female	35-44	9/22/2008 7:23:55 AM	12 years ago, I took my one and only injection.  Gained 65 lbs in 3months, continual spotting for 42 weeks, became anemic,got Bell's Palsy because of it, still have no sex drive, lost part of my hair, Suffer w severe mood swings. DON'T TAKE IT. My husband said the reason why it was so effective while I had the one injection was because you couldn't very easily do &quot;anything&quot;, or feel like doing &quot;it&quot;.
Birth Control	Nates Ma, 35-44 Female  on Treatment for 6 months to less than 1 year (Patient) 	5	5	3	Female	35-44	9/21/2008 12:17:22 PM	Everyone is different, and for me, each shot was different... The first was great! No period, no weight gain, no cramps... near the end I got a bit of PMS but that was it. The second shot brought some weight loss, clearer skin and still no period. Near the end I started having hot flashes, spotting, dizziness, severe mood swings,insomnia, fatigue, major back cramps, leg swelling and minor hair loss. (hair loss was worse after the birth of my son two years ago) I called the Dr begging for the shot early hoping to resolve the issues. I have since had the shot and most issues have been resolved. I am still having hot flashes, bleeding, leg swelling and insomnia. However now I am having panic attacks on top of it all. My Dr is taking me off the shot and putting me on the pill, but I have to wait till November.
Birth Control	25-34 Female  on Treatment for 1 to less than 2 years (Patient) 	1	5	1	Female	25-34	8/27/2008 10:35:39 AM	I got pregnant on the shot 1 week after i got it and did not know and got a second shot 2 months later. 
Birth Control	LM200820, 19-24 Female  on Treatment for 2 to less than 5 years (Patient) 	1	1	1	Female	19-24	8/22/2008 9:47:05 PM	I have been using this since i was 17 (now 20 years old). At first, it was originally used for contraception, but after i split with my ex, it was used to stop my periods, as they were extremely heavy (was using up to 4-8 pads a day, the really thick, fat, long pads) and extremely sore cramping and migraines. That all stopped with the first 2 and a half years on it. When i was 19 and a half, i decided to stop, to loose weight, i have put on 4 stone with this damned injection and cant seem to loose the weight. I started back on it around May 2008 (i was 20 yrs and 4 months - im now 20 yrs and 7 months) and since being back on this injection, has been hell. I do not recommend it. I am cramping, my &quot;period&quot; seems to come and go when it feels like, the migraines are hell, i have very bad joint pain and cracking, stiffness of joints aswell (my body feels like a 50 year old woman now!) i am now experiencing this weird like dark brown/red discharge, which isnt normal, which i will now have to go back to the doctors again about. Please make sure you have done your homework before going and getting this injection. I now regret this injection so much!
Other	shadow, 25-34 Female  on Treatment for 1 to 6 months (Patient) 	4	5	1	Female	25-34	8/21/2008 1:36:13 AM	I started taking this shot on May 28,2008. The first 3 months i didn't have a period. I got my second shot on July 29,2008 and have had a spoting/medium peiod ever since, it's been 4 weeks now and i'm not happy. I go back to get my third shot in october, i  am not going to be getting another one. I don't like how long you get your periods, plus i'm starting to clot.I am not taking this for a birth control, i'm taking this so i dont have periods, I just had twins last july and dont need anymore kids right now. I am not happy with this drug.
Birth Control	MollysMamma, 19-24 Female  on Treatment for 1 to 6 months (Patient) 	5	5	4	Female	19-24	8/13/2008 4:50:41 PM	I just got my second shot a few weeks ago and I love it. I spotted lightly for the first six weeks but have not had an actual period since my first shot. This is a great method of birth control. I've gone through several different types of pills and even tried the patch all of which caused very noticable side effects for me. I even had an alergic reaction to the patch and it blistered my skin. With the shot I've had no problems. The worst part is actually getting the shot and the site was sore just like if you got a tetnus shot but that's nothing for three months of freedom from bleeding, cramping, and the hell that was my period. As far as moodiness and tiredness I had worse mood swings and tiredness on the pill. I have actually lost 15 pounds with the shot. I feel great. I plan on using this as long as they will let me. My doctor recommended a multivitamin to supplement calcium to prevent bone loss and even out any side effects. Pretty common when it comes to bc methods I feel. To all of the people complaining about not being told about the bone density loss. Where have you been? People talk about it all the time. If you read the pamphlet that comes with your prescription it lists the side effects in it. The internet has a wealth of information if you are that concerned about it now why didn't you bother to ask about the side effects or research it yourself to begin with. 
Birth Control	13-18 Female  on Treatment for 1 to 6 months (Patient) 	5	4	1	Female	13-18	8/13/2008 2:01:31 AM	I'm 18 and chose depo without having been on birth control in the past. Everything was perfect for the first month until I had my period. Instead of lasting 4 or 5 days like normal, it just never stopped. I'm on day 15 already. I've also experienced weird mood swings and periodic decreased sex drive. I talked to my doctor and she said it isn't uncommon for women to experience periods that last six months on depo. I guess it's too bad none of the information I read or the doctors I talked to before getting the shot made it clear that this was a side effect or that it was fairly common. I will not be getting my next injection.
Birth Control	jgrant110, 25-34 Female  on Treatment for 6 months to less than 1 year (Patient) 	5	5	4	Female	25-34	8/7/2008 1:18:47 PM	I have been on the depo shot for about 6 months now.  I was on the pill for 5 years and got pregnant on it.  I was on the patch for 3 years and got pregnant using that too.  So far the shot has worked for me.  I haven't gained any weight, actually lose about 3-4 pounds everytime I go in for the next shot and haven't had one period since being on it.  The only problem I've had was that I had to have my gall bladder removed 2 months ago and thought it was normal until I actually stopped and read side effects of the depo shot and noticed that gall bladder blockage, while rare, is still severe.  Other than that the shot has done perfectly for me.
Birth Control	13-18 Female  on Treatment for 1 to 6 months (Patient) 	5	5	1	Female	13-18	7/25/2008 2:05:30 AM	I'm 18 and never had birth control previously. I got the depo shot because it's very convient. The first 2 months were fine a little bit of anxiety but nothing major. I am now approaching my need for a 2nd shot (in about a week) and the last 2 weeks have been the worst ones ever. I had 3 panic attacks, am suffering from depression, spotting everyday, tired, weak, and have no desire to do my regular activities. I lost weight on this shot partially because the nausea has stopped my desire to eat anything. I will not do this again and do not recommend it. I just wish I would have read these reviews before my choice to take it.
Birth Control	sick and tired, 35-44 Female  on Treatment for 6 months to less than 1 year (Patient) 	4	5	2	Female	35-44	7/23/2008 3:40:28 PM	Started depo after the birth of my second child. After being on the pill for about 19 years, Needed a different form of BC, was reccommended that I use something without estrogen. NOT many options, so I went with depo. It has been 6 mo., still spotting every day, moderate depression and at times feel just wierd and not myself.  I have since decided to stop the depo and look at other options! It is very convieniant (sp, but I did not like the side effects. I have even had to start taking Wellbutrin XL for the depression/anxiety!  What a mess! So, for now I will go back on a low estrogen pill and hope for the best.
Birth Control	25-34 Female  on Treatment for 10 years or more (Patient) 	5	5	3	Female	25-34	7/22/2008 11:14:52 AM	I have been on  depo for 15 years. I didn't research the drug when I started and blamed the side effects (immense weight-gain depression, moodiness, and tiredness) on events in my life not the drug. over the last 2 years have come to realize that it is the depo. My last injection was in May and I have decided against getting my next injection and will discontinue permanently. It works great but the side-effects have gotten to be too much to bear anymore. I will post any side effects I feel upon discontinuing the drug.
Birth Control	asia, 19-24 Female  on Treatment for 6 months to less than 1 year (Patient) 	4	2	1	Female	19-24	7/22/2008 9:37:57 AM	ive gained 40 pounds just after two shots, ive had a mild case of depresion and my bones aren't the same now. i rather be pregnant
Birth Control	25-34 Female  on Treatment for 2 to less than 5 years (Patient) 	3	3	1	Female	25-34	7/21/2008 5:30:45 PM	I used this drug as a form of birth control for a little over 3 years. I now have major bone loss. I was not made aware of this side effect as I &quot;took&quot; the drug in the early 90's. I now cannot take any birth control due to the effects of the drug. I have also lost all sex drive due to the drug and now my fear of getting pregnant unexpectedly. I love the drug while I used it. No bleeding, no major side effects while using it, and about 10 pound weight gain. Wish that I could use it again!
