Acne	25-34 Female  on Treatment for 1 to 6 months (Patient) 	4	4	4	Female	25-34	9/26/2012 2:25:35 PM	
Acne	rkc, 19-24 Female  on Treatment for less than 1 month (Patient) 	4	4	5	Female	19-24	9/14/2012 1:35:04 PM	I have only been using Epiduo for 5 days now but have already noticed a huge improvement in my skin. The first day i maybe broke out with a few more pimples than usual but they were also smaller than usual and went away in a couple days. Now the Epiduo has almost completely cleared my cheeks where the pimples bother me the most and my forehead is coming along really well too. Its just my chin than still has quite a few but that is always my worst area. I was prescribed Epiduo when i had  sudden horrible breakout after going off birth control pill. My whole life i have only ever had mild acne until this breakout that I would classify as moderate. I did not suffer from the initial breakout really (fingers crossed it doesn't come up in a week or so). It is drying and has made my skin extremely red (but I am about the palest person alive so I think on most people it wouldnt be as bad) but if you apply moisturizer on top of it or in the morning it helps a lot. And make sure to use the smallest amount possible and avoid areas close to your eyes. 
Acne	clearskin, 13-18 Female  on Treatment for less than 1 month (Patient) 	5	5	5	Female	13-18	8/25/2012 8:30:27 PM	Went to my doctors for a yearly checkup. She noticed I was breaking out a little bit so she gave me some samples of epiduo gel. Used it the first night. In three days my pimples were noticeably smaller, less red, and dried out. I did get a burning sensation and flakiness around my eyes, nose, and mouth even while using moisturizer, but thats okay because its just a side effect. After about a week I had no flakiness/dryness and my skin was acne free!! The red marks from previous acne scars were still visible but I think only time and applying lemon juice and sunscreen will make those go away. Every morning I wash my face with Cetaphil and apply the Cetaphil moisturizer which has spf 30 and if I'm going somewhere outside, I will put on water babies noncomodegonic spf 50 sunscreen. In the evenings, I wash my face with cetaphil cleanser, wait for my face to dry, apply epiduo gel all over avoiding eye area, and apply the cetaphil moisturizer. you can use epiduo on your back too!!!
Acne	kyliek20, 13-18 Female  on Treatment for 1 to 6 months (Patient) 	4	5	4	Female	13-18	8/15/2012 10:27:48 AM	I am a sixteen year old girl who suffered from moderate acne. I would break out A LOT on my cheeks to a point where I wouldnt want to go out in public without any makeup on. It was embaressing especially during times where I wanted to go to the water park or pool, and my makeup would get washed off. I had tried a ton of DIY remedies and none of them worked, along with just about every drug store face wash or acne control system. I decided to go to the dermatologist to see if they could give me any advice. They perscribed me with epiduo and after the first week of using it i saw results. My acne had cleared up a ton. I still had some mild scarring, but that was easily covered with a small amount of concealer. After the fist week, I found myself going out without any foundation on and that was a great feeling (: It didnt dry out my skin too bad either. I still break out, but nothing close to the way I had before using epiduo. I am very happy with my results and encourage people to give epiduo a chance!
Acne	Kae8946, 13-18 Female  on Treatment for 6 months to less than 1 year (Patient) 	2	5	1	Female	13-18	7/16/2012 9:32:33 PM	I have been using this product for almost a year, however, I applied this medication to my sunburnt face, and woke up today covered in blisters. Just a word of advice that I wish I would have known, DO NOT APPLY TO A SUNBURNT FACE!!!
Acne	111,  Male  on Treatment for 1 to 6 months (Patient) 	3	2	3	Male		7/14/2012 5:13:46 AM	i am 14 and ive used this now for about three months mabey longer but to be honest it was difficult to use it made my face very dry and burn i was very disappointed to see that it had not worked in three months because my docter said it would in that time my hopes were very high for this to work cause all my friends have clear faces but i still dont 
Acne	LaLaLa, 25-34 Female  on Treatment for 1 to 6 months (Patient) 	3	4	3	Female	25-34	6/6/2012 10:09:26 PM	I'm 28 and have sensitive skin (allergic to sulfa) with (hormonal) acne on my forehead, and then developed perioral dermatitis. Have used Epiduo for 2-3 months and haven't really seen a difference. It might help prevent new acne from developing but doesn't really help resolve current acne. I used Differin in college and it worked very well, so I don't know why Epiduo doesn't work that well on me. I hope it works for you. I am know on oral Monodox and Finacea, and still use Epiduo just in case. We'll see how this combination works.
Acne	prettypink, 19-24 Female  on Treatment for less than 1 month (Patient) 	4	4	4	Female	19-24	6/1/2012 10:43:22 AM	I am 22 and I have had acne since I was 13, but it is very mild now. I have EXTREMELY sensitive skin and I am allergic to sulfa, so my skin can severe reactions to topical acne medications, ie. burning, inflamed, flaking, cracked skin. So far I have not seen any negative reactions to Epiduo. My skin is smoother and softer and it seems to be keeping my acne under control. Follow the directions - use ONLY a pea size amount each time you apply. That's really all you need!
Acne	rmd, 25-34 Female  (Patient) 	4	4	4	Female	25-34	5/17/2012 11:51:27 AM	it takes about 4 to 8wks to get my face almost 80 to 90 percent clear. pimples come out, but is easy to prick. be sure to wash hands and clean your pricking thing. im satisfied with the result. im just wondering and a little bit scared if i discontinue it, will it relapse? iv read some article that it should be at least used for 6mos to prevent relapse. my skin is getting clear and i love epiduo!
Acne	You are reading this, 7-12 Female  on Treatment for 1 to 6 months (Patient) 	5	5	5	Female	7-12	4/22/2012 2:50:30 PM	I LOVEEEEE Epiduo! I'm only 12, but i've had horrible acne since I turned 10, and I felt really self conscience around my friends because they all had perfect, beautiful skin. 2 months ago, I went to a dermatologist for the first time, and he recommended Epiduo along with the Cetaphil cleanser. Epiduo was really easy to use, just cleansing with Cetaphil, and putting on Epiduo every night. Now, My skin is beautiful, and I rarely ever get breakouts, and when I do, they're very small. I would highly recommend Epiduo to anyone.
Acne	19-24 Female  on Treatment for less than 1 month (Patient) 	4	5	5	Female	19-24	2/26/2012 12:44:30 PM	Epiduo has made my face very dry, but if you were prescribed it, the doctor should have gave you an amazing moisturizer. The only place it really bothered me was under my eyes, right above my check bones. I would recommend this product if you are patient and are dedicated to fixing your acne. There is not a product out there that will magically poof your acne away, so be patient.  
Acne	hannah :),  Female  (Patient) 	4	3	4	Female		1/13/2012 5:09:21 PM	im only 13 and i had some pretty bad acne. i tried multiple things but nothing worked. epiduo was my last hope and it works great! yes i had dry flaky skin about for about 1 month. but it really helped. i recommend it to anyone
Acne	35-44 Female  on Treatment for less than 1 month (Patient) 	4	5	4	Female	35-44	1/9/2012 10:03:13 PM	After 10 years of trying everything from drugstore treatments to natural products for my moderate cystic acne, I finally decided to see a dermatologist about 3 weeks ago. He prescribed Doxicycline (oral antibiotic) and Epiduo. After the first couple days, my acne really started clearing up. However, after a week, my skin started getting red, irritated and breaking out. Having been warned that this would happen, I kept using the product. Now, my skin has really cleared and the sensitivity has decreased significantly. It's been 3 weeks now and, I feel this product is really working. The true test will be if it continues to work.Oh, one other thing I have noticed is that some of my more minor scarring has started to fade which is wonderful!
Acne		5	5	5			1/1/2012 4:59:17 PM	I could not go out of my house, even to the grocery store, without having to use concealer for all of my blemishes. After not being able to take it anymore, I went to a dermatologist, where she prescribed Epiduo gel. I was wary at first. It said it would possibly make my skin sting, and redden, because of the Benzoyl Peroxide in it. I have extremely sensitive skin, so I definitely was scared. From my first application on, not once did my skin redden or sting. I was impressed. After 6 weeks on the product, I didn't see too much improvement, and being impatient like I am, I got a little frustrated. I continued the use however, and I started seeing a change around the 8th week. After the twelve weeks were up, my skin was almost completely clear. It's been a few months now, and I am still using it every day, and I have never felt better in my skin. I don't have to put on make-up or feel like everyone is staring at my newest blemish. Epiduo changed my life. Just wait out the 12 weeks. You'll see improvement.
Acne	adamarie, 13-18 Female  on Treatment for 1 to less than 2 years (Patient) 	5	5	5	Female	13-18	12/4/2011 10:53:29 PM	When I started Epiduo I wanted to never use it again because the first 4-5 weeks I felt like crying. I had breakouts that I've never seen before, also my face was itchy, it burned and was peeling. But after that, I started to see some results. Few months later my skin was perfect! I was finally so satisfied to be going &quot;au naturale&quot; everywhere. This really does wonders.Just be patient, the first weeks your skin is adapting to the product, you'll see results soon. I'm really thankful for Epiduo.
Other	65-74 Male  on Treatment for 1 to 6 months (Patient) 	1	5	1	Male	65-74	7/1/2011 11:45:14 PM	Cyst on nose. Inefective after 1 month treatment
Acne	Shan, 35-44 Female  on Treatment for 1 to less than 2 years (Patient) 	5	4	5	Female	35-44	6/18/2011 11:22:23 PM	It's effective with almost no side effect.  I do get one or two before my period, but even that goes away very quickly.  
Acne	epiduosucks!, 13-18 Female  on Treatment for less than 1 month (Patient) 	1	1	1	Female	13-18	6/17/2011 11:19:37 PM	Acne is a big problem in my life and I had been so excited to try epiduo because it worked well on my friend, however this drug burned my face making it red and peeling. I do not recommend this product because i think it put my face in a worse position then before I used it. If you are looking for a cheaper more effective way to treat acne I recommend Kate Somerville's Erad-i-Kate, I switched to this product after using epiduo and it works wonders!
Acne	dillydibley, 13-18 Female  on Treatment for 1 to 6 months (Patient) 	1	3	1	Female	13-18	5/28/2011 7:25:49 PM	this stuff does not get rid of ance, it drys out your skin, makes it red, itchy, and burn!  it did nothing to help zits it simply sits there, infact i think it made my skin look worse.  if you go to the store and buy a cheap store brand acne cream, it works better than this stuff, infact it works really well.
Acne	19-24 Female  on Treatment for 1 to 6 months (Patient) 	5	5	5	Female	19-24	5/13/2011 1:40:47 PM	i love this stuff. i've had acne since i was 12 or 13. at times it's been mild and others it's been severe. recently, it was moderate and sort of under control due to birth control. i still broke out almost every day though, and was desperate for something that would clear me up completely once and for all. this stuff did it and for the first time i can walk around without makeup and feel confident. i broke out pretty badly after a few weeks, which i thought was strange but most people experience an initial breakout (plus i was under a lot of stress). bottom line is this stuff works
Acne	alexandra , 19-24 Female  on Treatment for 1 to 6 months (Patient) 	1	5	1	Female	19-24	4/30/2011 2:43:41 PM	i've been on epiduo for 5 weeks, and the only difference i see in my skin is that it's red, and feels sun burnt. this goes away after moisturizing. I'm actually EXTREMELY DISAPPOINTED. i was excepting much more, and literally i dont see any visible results at all. OH EXCEPT... the break outs that i do get now are huge pimples, which i wouldn't get before. i have mild acne
Acne	kaitlin t., 19-24 Female  on Treatment for 1 to less than 2 years (Patient) 	5	5	5	Female	19-24	4/22/2011 9:06:04 PM	When I was 16 my acne was horrible and I began to get scars. After trying dozens of acne treatments i went to the dermatologist and got epidou which changed my life! I have been acne free for almost 2 years. I looked like hell for the first 2 months but it was all worth it! Thank you epiduo!!
Acne	art4KPD, 13-18 Female  on Treatment for 1 to 6 months (Patient) 	4	5	5	Female	13-18	2/6/2011 4:01:31 PM	So far, IT is working pretty well! There is no irritation and my just looks cleaner. I have also been using moisturizer in the morning and Epiduo at night. I recommend it!
Acne	BioMedEgr, 19-24 Male  on Treatment for 6 months to less than 1 year (Patient) 	4	4	5	Male	19-24	12/9/2010 2:35:32 PM	I am using Epiduo in combination with a oral medication. There was a period of time where I had not gotten a refill on my oral medication, and Epiduo was the only medication treating my acne. I tried Epiduo prior to taking Accutane, and, although Epi. helped, it could not control the rate of break outs. I took Accutane because my face eventually turned into a zit.Being a couple years older and beyond that embarrassing stage of puberty, I am back to using Epiduo and I wouldn't leave home with out using it.Epiduo definitely reduced the severity of my break outs. There is no question about that. It has dried out my skin for sure, and I have had mild peeling where my acne is located. But, this is the only side affect I have noticed, which is really not a big deal at all.My recommendation is to use the product as it tells you to. Remove the oils from your hands and face before applying the Epiduo. This way you have clear pores for the medication to get into. 
Acne	PatienceIsAVirtue, 13-18 Female  on Treatment for less than 1 month (Patient) 	4	4	4	Female	13-18	12/1/2010 7:50:41 AM	my first 3 weeks on this medication made my life a living hell. i broke out like never before (i have had acne since i was 10 yrs old). i'm on my 5th week now and i can see the difference on my skin. i still get a few breakouts, but nothing like before. my skin is calmer and clearer now. i can actually feel that if i keep on using it for a couple more weeks things would get better. so for those who are planning on using this product, get yourselves ready for the initial breakouts that it may cause you, but don't give up on it. it's worth the shot and wait. :)
Acne	Pancho, 13-18 Male  on Treatment for less than 1 month (Patient) 	5	2	5	Male	13-18	11/11/2010 11:30:15 PM	Im a 15 yr old latin boy with severe acne, my dermatologist told me that if epiduo doesnt clear my acne in a period of 6 weeks, ill have to use accutane and i didnt want that so i agreed on epiduo. its been 3 weeks now. the acne on my face has been reduced greatly, altho the side effects have been hard for me to keep up with this medication cycle. this happens every other day i use the medication. i put it on, and the next day my face is red, irritated, and flaky. it feels more like a severe sunburn. i use the medication 2 days, then the next 5 days im suffering from irritation.
Acne	Akhan, 13-18 Female  on Treatment for 1 to 6 months (Patient) 	1	4	3	Female	13-18	11/7/2010 9:43:09 AM	ive been using epiduo for about 6 days now and i my acne has got so much worseee it never use to be this bad i actually feel like crying, but i have heard that this does happen in the beginning where it has to get worse to get better, is this true?? does anyone know how long this will last before it gets better, i use it very night. 
Acne	Walker439, 25-34 Female  on Treatment for less than 1 month (Patient) 	3	5	3	Female	25-34	10/5/2010 1:38:52 PM	My dermatologist gave me a bunch of Epiduo samples about a year ago and I didn't really give it enough time to do anything. I just went back to the doc a little over a week ago and she told me to use it again. I have used this gel every night for 8 nights and have had no major problems. After about a week, my skin did start to burn a little and it is a little dry, but not enough to really bother me. I just put on my moisturizer (Aveeno) and really try not to touch my face all day. I think this product will work well, but you must stick with it! 
Acne	13-18 Female  on Treatment for less than 1 month (Patient) 	1	5	1	Female	13-18	9/14/2010 1:54:54 AM	well i started this 4 days ago and all it has done so far is make my face very red and extremely dry and peely and it stings like crazy now whenever i wash my face...   but idk because my dad used the same type of thing when he was younger and he said to give it time so thats what ill do
Acne	EpiduoPatient3000, 13-18 Female  on Treatment for 1 to 6 months (Patient) 	3	5	3	Female	13-18	9/7/2010 6:00:39 PM	Made me break out in the first couple of weeks. It's been about four to five weeks and my face isn't as clear as I'd hoped. I didn't know it would take this long for it to work. Hopefully, it wont take long to make my face completely clear. I'm dissapointed in this product. 
Acne	13-18 Female  on Treatment for 1 to 6 months (Patient) 	4	5	5	Female	13-18	7/16/2010 10:09:56 PM	I had cystic acne along with many blackheads and whiteheads which would become very enflamed. After getting Epiduo, it took about three weeks for the results to really show. I would occasionally get small whiteheads and it did not help with the blackheads, but my skin was less bumpy. At the two month mark, my acne was almost completely gone, and I've had maybe one or two pimples since then! Epiduo is great, although it does nothing to remove blackheads/post-acne scarring. It's perfect in combination with microdermabrasions! I would definitely recommend using this product.
Acne	lisa, 19-24 Female  on Treatment for 1 to 6 months (Patient) 	5	5	5	Female	19-24	6/25/2010 9:31:29 AM	I am so astounded that my skin looks the way it does.  I am a 21 year old female and I really thought I had seen it all and tried it all.   Use every night and you should see results.  It is 6 weeks into the treatment and I don't have any visible pimples.   Trust me, the first few weeks can be a little disheartening.  A few things that happened to me (on &amp; off) during the first few weeks were that my skin dried, burning (preventable if you put on JUST the right amount to cover your skin), and my acne worsened.  There were a few weeks when I seemed to break out everywhere (the research says it's because it is purging your skin of all the dirt build up and bacteria and whatnot).  I am very happy with the results and I have even been complimented about my skin!  Ah!  That has never happened in my life.  I am so much more comfortable taking picture now that I know any light will make my skin look flawless :-)
Acne	 Female  on Treatment for 6 months to less than 1 year (Patient) 	2	2	1	Female		6/13/2010 9:20:42 PM	I have been using Epiduo since January.  Basically, it goes in cycles--some weeks my face is clear, others it's not at all.  Not happy with it, and definitely wouldn't pay for it without the discount card.
Acne	25-34 Male  on Treatment for 1 to 6 months (Patient) 	4	4	4	Male	25-34	5/28/2010 7:40:43 PM	Reduced my mild / cystic adult acne by atleast 90% in about 2 weeks.  It did leave my skin dry, a bit red, and a little painful for the first few days but I got used to i and it has worked great for months now.
Acne	45-54 Female  on Treatment for less than 1 month (Patient) 	4	4	4	Female	45-54	5/13/2010 8:03:05 PM	Iam a 47 y.o. african american with oily skin and acne problems for 15 yrs. I recently tried epiduo paired with finacia and initially it burned ferociously and still do, but not as much. I also broke out a bit more and my skin became scaly. dry and irritated.  I am sticking to using it at night, because it heals new acne very quickly. Minimal sun exposure is a must, so please use a high spf sunscreen. It is vital if hyperpigmentation is a problem. I use cetaphil sunscreen, spf 50 as it is non-comedegenic, so not supposed to clog pores.  I felt like it caused some pore blockage but the two medications I'm using zapped it very quickly. the sunscreen serves as a moisturizer during the day as well. Most of all, be very gentle to your skin, because it is like royalty. Face it, we don't have normal skin like so many others, so we have to go the extra mile to pamper it more. What do you have to lose besides healthier and beautiful looking skin.
Acne	regina, 13-18 Female  on Treatment for less than 1 month (Patient) 	5	5	5	Female	13-18	4/30/2010 5:23:06 PM	I started using epiduo just 2 DAYS AGO! my dermatologist had said that this is what she uses, so how could i turn it down? she gave me the free samples, i went home that night, used it. woke up, used it again last night, and woke up this morning with LESS acne! the dermatologist said that it can take up to a month or so to see effects, but HA! try just 2 DAYS! so far i am VERY satisfied with this treatment, and i VOW that i will use epiduo every day as long as i live. GO TO YOUR DERMATOLOGIST, SAY I WANT TO TRY EPIDUO. TAKE IT HOME, AND LOVE THE FAST EFFECTS! i finally realize WHY they call it &quot;EPI-DUO&quot; 1, because its an EPIC treatment, and works VERY well, and 2, because it gets RID of old acne, PREVENTS NEW ACNE, and LEAVES YOUR SKIN SOFT! ha! it should be called epiTRIO!!! i highly recommend this, and i am only 16, so you KNOW this really works! 3 LIFE CHANGING TIPS FOR YOU-  1. GET IT, 2. TRY IT, and 3. LOVE YOUR NEW SKIN!!!!  
Acne	Guest, 7-12 Female  on Treatment for 6 months to less than 1 year (Patient) 	5	5	5	Female	7-12	4/26/2010 9:58:41 PM	I have had acne for many years and this really got rid of it! My face is clear for once! I recommend that you use this at night.
Acne	Clazies, 19-24 Female  on Treatment for less than 1 month (Patient) 	4	5	5	Female	19-24	4/20/2010 1:03:26 AM	I have been using Epiduo for around three weeks now.  My skin becomes dry around my nose and chin areas after nightly use.  HOWEVER, I find that skipping a night of application and exfoliating then deep moisturizing, the dryness is gone by morning.  So if over-drying occurs, I stop use for one day, then continue the next night.  The results are great!  My whiteheads are almost completely gone and I've only had 2 blemishes within the past two weeks (and they were gone within 2 days!)  I would definitely recommend Epiduo for anyone with mild-moderate acne! 
Acne	Nikki02, 13-18 Female  on Treatment for less than 1 month (Patient) 	2	4	1	Female	13-18	4/19/2010 8:22:59 PM	I have been using this product for about a week now, and my face is red, i have a rash by my jawline, itchy, burning, and peeling. I have been using it once a day before I go to bed. But these side effects are killing me! I am embarassed of my face and I can't put any makeup on because my face is so dry and peeling. I don't know if i should keep using it or stop. None of the reviews I have read seem to have as bad of symptoms as I am experiencing. These symptoms have been going on for about 5 days. I am going to take a break from it tonight and see if that does anything. Should I stop using the product, or will these symptoms go away soon?
Acne	mdewchick, 25-34 Female  on Treatment for less than 1 month (Patient) 	3	5	3	Female	25-34	4/11/2010 9:08:18 PM	I just started taking this medication in addition to Doxycycline orally.  So far, three days in and I have noticed more teeny white heads appearing than normal.  However, the hard deep pustle type zits I had have started to dry out and heal up.  I am very optimistic that between these two medications my acne will clear up.  I haev had acne since a teenager, but about 10 years ago I took accutane and it made a huge difference.  In the last two years I went off birth control because we are trying to have kids.  That has caused my hormones to go wild and I have been experiencing large, cystic acne on my neck, chest, and occasionally on my face.  My derm says that all of this is hormonal and not related to any type of face wash or activity that I am doing - that was refreshing!  I promise to update after a few weeks of taking both drugs.
Acne	7-12 Male  on Treatment for 1 to 6 months (Patient) 	4	4	4	Male	7-12	2/10/2010 3:34:54 PM	With this product it's very important you read the instructions. Only apply once a day. Only use about a pea sized amount on each area of your face (cheeks, forehead, chin) most importantly, do not expose yourself to sunlight when it's on your face. I found that if you just follow the directions the product works quite well. I still get an occassional pimple but for the most part it has worked well.
Acne	19-24 Female  on Treatment for 1 to 6 months (Patient) 	1	5	1	Female	19-24	1/31/2010 12:10:03 AM	I have been using this gel for 6 weeks and have yet to see results and now I am figuring that if it hasn't worked yet, it's not going to. The acne on my face has gotten worse with using this product, if anything.
