Acne	 Msmae535, 13-18 Male  on Treatment for 6 months to less than 1 year (Patient) 	5	5	5	Male	13-18	1/5/2010 10:04:07 PM	I struggled with severe acne since the time i was about 12 or thirteen. My pediatrician recommended this as an experimental treatment. Within a month, I had gone from having thirty or more pimples on my face, to having maybe fifteen, then gradually they stopped appearing. Today, I have beautifully clear skin that glows, but occasionally has a blemish, but we're all human, right?
Acne	KurlyChild, 19-24 Female  on Treatment for 1 to 6 months (Patient) 	2	3	1	Female	19-24	12/28/2009 3:05:46 PM	Worst medication ever for sensitive, combination skin.  Made me break out like I have never before, with large red cystic acne all over my face.  Do not recommend for sensitive skin.
Acne	BeLLe5255, 25-34 Female  on Treatment for 1 to 6 months (Patient) 	5	5	5	Female	25-34	12/2/2009 11:12:46 AM	I'm 25 yrs old and I have been dealing with moderate acne since I was 14.  I recently visited the philippines and started to break out ridiculously! When I got back I was prescribed epiduo I was a little sceptical because for the 1st week and a half it made me break out more. I cld my dr and he reassured me that like with everything else that works it gets worse b4 it gets better. I have been using it for 3 months now and my boyfriend and family can't stop complimenting me on how clear, radient, and smooth my face is! I LOVE THIS STUFF! What a confidence booster. . . .btw my face started to clear up after exactly 2 weeks
Acne	jyoungblood, 13-18 Male  on Treatment for less than 1 month (Patient) 	4	5	4	Male	13-18	11/30/2009 11:38:52 PM	I have been taking Minocycline for the past few months with NO change whatsoever in my acne.  I went to the dermatologist and he decided to pair the antibiotics with Epiduo. Within, the first few days i encountered redness, itching, peeling, and dryness.  These side effects were the trade off for having the extremely clear skin that I now have.  My face immediately started to clear up and the pimples, blakcheads, and cysts immediately started decreasing in size or just going away completely.  A great product!!!
Acne	brendacs, 25-34 Female  on Treatment for 1 to 6 months (Patient) 	5	5	5	Female	25-34	11/23/2009 6:16:15 AM	Epiduo has changed my life. I started having acne problems during my pregnancy 10 years ago. before that it was rare if i had any acne. for the past 10 years ive tried everything from drugstore to infomercial products,natural products etc. NOTHING has helped in the long run. With this product my face cleared up in a matter of days. Ive been using this for 2 months every night and sulfacetamide during the day. i have not had one single break out!! i used to get a new one daily, not only that but it was always large cystic acne. i love this product
Acne	ggirl, 13-18 Female  on Treatment for less than 1 month (Patient) 	5	5	5	Female	13-18	10/24/2009 10:09:09 PM	oh gosh,i wold be teased for my acne.but i went to the doctors and i was prescribed this.it didnt work the first week.this is the second,,,and no more acnee!i love it!!                   thankyouuuuuu
Acne	dhunttt, 13-18 Female  on Treatment for less than 1 month (Patient) 	4	2	3	Female	13-18	10/15/2009 9:55:45 PM	i started using this about two weeks ago, and the night before last i used it and it burned horribly, and itched, and i woke up yesterday morning, with a red itchy, bumpy face, not acne, but micro scaly bumps everywhere, and it looked liek i'd been in the sun a week.
Acne	45-54 Female  on Treatment for less than 1 month (Patient) 	5	5	5	Female	45-54	10/15/2009 12:53:50 PM	I am a 45 yr old woman who has suffered from acne for the last 10 years. This so far is the only thing that has worked.  My face is clearing up pretty fast!  Thanks to the makers of Epiduo!  LOVE IT!
Acne	rina, 19-24 Female  on Treatment for 6 months to less than 1 year (Patient) 	5	5	5	Female	19-24	10/5/2009 11:40:40 PM	This is the BEST acne medication I have ever tried. For background info, I will consider my face is relatively oily and always breakout. I have been having acne for 9 years now. I have tried everything from proactive, aczone, acnefree, murad, clearasil, exposed, ddf, etc and etc... nothing really works. They will either works well in first few weeks and then doesn't work anymore. But i have been using epiduo for few months now and my skin has been acne free ever since. My recommendation to keep acne free is that first to drink lots of water, don't wash your face in the morning just splash of water is enough and don't put too much stuffs on your face keep it clean, only wash your face at night and apply oil-free moisturizer and last step apply thin layer epiduo and you are good to go. 
Acne	13-18 Female  on Treatment for 1 to 6 months (Patient) 	5	5	5	Female	13-18	10/4/2009 5:25:41 PM	I have been using Epiduo for at least 4 months now and its the best medication i have ever used in my entire life. My skin is very sensitive and this product is the only one that doesn't irritate my skin,for me it really works. It started working since the first day and everyone can see the difference they tell me my skin is beautiful I'm really glad I found Epiduo, even in those days of the months my skin stays clean.
Acne	kbeck13, 13-18 Male  on Treatment for 1 to 6 months (Patient) 	4	5	4	Male	13-18	9/22/2009 2:13:42 AM	I was prescribed this topical plus some minocycline. Nothing happened. Then the minocycline was replaced with some sulpher thing. not any better. then i decided my doctor didn't know what he was talking about and stopped the pills alltogether and started applying epiduo morning AND night. face is almost completely clear its amazing. i have had severe acne for two years and its finally gone!
Acne	19-24 Female  on Treatment for 1 to 6 months (Patient) 	5	5	5	Female	19-24	9/18/2009 7:39:21 AM	I been using this now for four months. But the first couple weeks I already started seeing results. I was told to only use a thin coat...went home and did otherwise and had the worst experience ever! felt like i dipped my face in CLOROX! but other than that my sever acne was going away with the help of minoclyclin and OF COURSE CETAPHIL FACE WASH!! 
Acne	shelsea_722, 19-24 Female  on Treatment for less than 1 month (Patient) 	4	5	4	Female	19-24	9/8/2009 2:43:45 PM	have been using this with aczone at night for 9 days.. has been a little stinging when applying but overall my acne is drying up.i have made sure only using a pea sized amount.. not much more. there is some new acne.. but it goes away more quickly. and i know i havent been on this product to long so there will the worse before it gets better ordeal so.. i'm just waiting patiently
Acne	sorrellb, 25-34 Female  on Treatment for 1 to 6 months (Patient) 	1	5	1	Female	25-34	8/10/2009 11:21:42 PM	i havent expierenced any pain, but my face looks worse then ever and now my neck, I'm hoping it till start have been taking a month so i figure if it hasnt worked by now it probably wont.
Other	35-44 Female  on Treatment for less than 1 month (Patient) 	1	1	1	Female	35-44	8/24/2009 5:11:35 PM	After 2 days I broke out in a rash. It has been 3 days now and I am still having problems.Be careful with this one. 
Acne	13-18 Female  on Treatment for 1 to 6 months (Patient) 	3	5	3	Female	13-18	8/14/2009 11:12:21 PM	I went to the doctor for my acne and she gave me a sample of epiduo...it burned pretty bad so i stopped using it...but jus recently i bout a full tube and havent experienced any problems since i use it at night....as far as how good it works well i havent used it long enough to see some results...but this product does take a couple weeks to kick in...if it does at all...but beware im not the only person who has experienced burning from this product
Acne	ez101, 13-18 Female  on Treatment for less than 1 month (Patient) 	4	5	4	Female	13-18	8/11/2009 7:22:47 PM	i have only been using the product for one week now, and i had somewhat of an initial break out, but overall i am seeing a great improvement! the first couple nights i applied, it didn't hurt; more recently it has begun to burn a little and i am peeling. but it has improved my complexion already. HOPE THIS HELPED
Acne	elohel9dalton, 13-18 Male  on Treatment for less than 1 month (Patient) 	4	4	3	Male	13-18	8/11/2009 3:40:07 AM	the product works good, it is really the only thing that has worked this well for me! haha, the only probleme was it makes me EXTREMELY sensitive to alchohol rub, and the sun.
Other	19-24 Female  on Treatment for less than 1 month (Patient) 	1	1	1	Female	19-24	8/8/2009 3:11:58 AM	I have always been told I have great skin. Monthly I would only get ONE whitehead on my chin before my period. My old derm had me using benzaclin as a spot treatment and it worked WONDERS. I moved so I got a new derm and went to get another perscription of benzaclin. She basically told me she wouldn't write me the perscription for it and told me she saw me as someone with &quot;mild acne&quot; (i don't consider one zit mild acne, but she's the professional right?) so she tells me about epiduo and i give it a try. WORST DECISION OF MY LIFE. after one week of using this stuff i was breaking out in areas where i have never broken out before! my face was RED, sensitive, oh and PEELING like crazy. There is no way I would ever endure horrible skin for &quot;6-8 weeks&quot; for this to start &quot;working effectively&quot;. Once I stopped using it my skin went back to normal. I highly recommend NOT using this product. Do yourself a favor--if you have &quot;mild acne&quot; get yourself some benzaclin! 
Acne	abcg, 13-18 Male  on Treatment for less than 1 month (Patient) 	4	5	5	Male	13-18	8/7/2009 1:21:28 AM	when i first used it burning.. started pealing my skin which pealed off acne scars. pushed out the bacteria, also use it with doxycycline cleared mostly all my acne, works great
Acne	HannsG, 13-18 Female  on Treatment for less than 1 month (Patient) 	4	5	5	Female	13-18	8/6/2009 1:36:14 PM	Before I hit freshman year, I had great skin, and a few months ago it started getting worse than I ever imagined. My dermatologist gave me samples of this a week ago and she said it would take a while to kick in plus it would get worse before it got better. I've been taking it for the past week and it's already getting better! On the third day, my face burned a little, but I used cetaphil spf 50 moisturizer and it helped a ton. I'm going to continue using it and I can only see it going up from here! :)
Acne	charlieandstars, 13-18 Female  on Treatment for 1 to 6 months (Patient) 	4	4	5	Female	13-18	8/2/2009 6:10:48 PM	Epiduo works, but only in repetition. At first I only applied the gel to my nose and ares where I had a zit. I'm also on Bactrim DS, which kept my skin very clear, but I was getting a lot of those small little bumps that take a lot of squeezing to get rid of. I went back to my derm and talked to him, he said that every night I need to spread a layer of the gel all over my face or the the ares that I break out in. After about 3 weeks of doing this, my skin is completely clear, the gel evened out my skin tone and actually got rid of red blemishes. The only thing I don't like is that it does make my skin itchy when I apply it, but it's only in sensitive ares like around my nose and mouth, so I'm now avoiding those areas.
Acne	peacefulcounselor, 45-54 Female  on Treatment for 1 to 6 months	5	5	5	Female	45-54	7/30/2009 11:38:40 AM	This stuff is great but I wish it wasn't so expensive. I've used Retin-A liquid or cream and  glycolic acid 7% every night for over 30 years, so when I started breaking out again,my derm said I just needed a change of meds. Epiduo burns, stings &amp; causes dryness at first but wow, even my deep wrinkles are smoothing out after only a few weeks. I also take tetracycline 500mg once a day. 
Acne	jojo, 25-34 Female  on Treatment for 6 months to less than 1 year (Patient) 	2	5	2	Female	25-34	7/9/2009 3:05:30 PM	I got a free tube with a coupon from my derm, cuz i would def not pay $200 for this on the normal, unless it really worked well. and so far it hasnt made that much of an improvement. Ive been using it for 8 weeks now, and at first it made me break out far worse but they said it gets worse b4 it get better. No burning or or redness though. My face will clear up after my period but then come right back to about the same amount of acne maybe SLIGHTLY less then b4 i started using it. My doctor also paired it with clandymicin acne pads. 
Acne	justmeo, 25-34 Female  on Treatment for 1 to 6 months (Patient) 	5	5	5	Female	25-34	6/11/2009 12:46:56 AM	I went to a new  derm who prescribed Epiduo for me after  my last derm had given me Differn which had cause my occasional breakout to become a war zone of acne like never before. I've been using the product for about a month and a half-once at night just before bed and all I can say is that it works great. I have never had any irritations or discomfort. My derm paired this medicine along with Lociod which give me a lot of moisture. Overall its a great product and it works for me. 
Acne	akkricket, 25-34 Female  on Treatment for less than 1 month (Patient) 	4	5	4	Female	25-34	6/10/2009 12:20:15 AM	I have been using this for about 3 weeks. In the first week it made my forehead really bumpy, I think it was because it causes the skin cells to turnover faster and brought all the yucky stuff to the surface. No side effects for me. No red,dry, or itchy skin. My skin is clearing nicely. You should try it. =)
Acne	black lotus, 35-44 Female  on Treatment for 1 to 6 months (Patient) 	1	5	1	Female	35-44	5/30/2009 9:43:33 PM	my dermatologist put me on epiduo about a month ago and I swear my face is the worst it has ever looked!I have broken out more with it than when I started.I never had the burning or irritation,maybe a little dryness but I could handle that.I am soo embarassed by my skin now and I work with the public which makes it even worse.I have huge cysts on my neck which I NEVER had before and the amount of them have tripled since I started using this.I sure hope this is as bad as it's going to get because any worse, you might as well call me 'the elephant man!'Good luck with this stuff.I obviously was'nt one of the lucky ones!
Acne	ledulce, 25-34 Female  on Treatment for less than 1 month (Patient) 	5	4	4	Female	25-34	5/26/2009 10:35:45 AM	My doctor recently prescribed this medication to me. first she gave me samples and it was great within the first week my skin was so clear of pimples and scars look lighter. I couldnt believe that it was the cream. i kept thinking it was something else but I wasnt on anything else. I have had acne all my life. Now that my samples are finished i filled the prescription, now my skin is still clear but very dry, please note I have oily skin. The only side effect is severe dry skin. So i recommend using a good moisterizer on top of it for comfort, but it does work.
Acne	gigi28, 25-34 Female  on Treatment for 1 to 6 months (Patient) 	5	5	5	Female	25-34	5/17/2009 9:37:03 AM	The key to using this effectively is to stick with it!  In the first few weeks it was extremely irritating, but now I barely feel it going on.  You must use a good moisturizer for sensitive skin. I hardly break out now and have no more cysts. As a bonus, lines on my forehead are smoother.
Acne	13-18 Female  on Treatment for less than 1 month (Patient) 	4	5	2	Female	13-18	5/10/2009 1:56:55 PM	My dermotologist prescribed Epiduo to me a month ago.  I have only used it twice (at night) and I woke up to my skin feeling like sandpaper and burning, but was not red.  That was a week ago - my skin texture hasn't gone back to normal.  But it did clear up some troubling acne spots.  This medication is too harsh for me to use daily.  I am keeping it for spot treatment only.  
Acne	ark88, 13-18 Female  on Treatment for 1 to 6 months (Patient) 	4	5	4	Female	13-18	5/2/2009 6:01:14 PM	i have excema along with acne so its difficult to find a product that works on the acne but doesn't dry out my skin too badly. this did dry out my face for the first few weeks but if you keep it strictly to the oily areas it works beautifully. i put moisturizer on top of it, and it keeps the dryness under control. very effective on acne.
Acne	35-44 Female  on Treatment for 1 to 6 months (Patient) 	3	5	3	Female	35-44	4/27/2009 10:32:35 AM	I just finished week 7 of the product. The first couple weeks of results included an initial clearing, followed by dryness and sensitivity (hot feeling). Now the break out period has begun. I have heard it gets worse before it gets better, so hopefully I am almost through the worst of it. I started out with what my derm called Mild, but it felt Moderate to me. 
Acne	xx94, 13-18 Female  on Treatment for less than 1 month (Patient) 	3	5	3	Female	13-18	4/13/2009 3:26:04 PM	It has cleared some of my pimples, but it stingys like crazy and makes your skin really dry. I wear makeup for my modeling job and putting that on hurts very badly
Acne	worried, 25-34 Female  on Treatment for less than 1 month (Patient) 	2	5	2	Female	25-34	4/4/2009 11:46:50 PM	the first day it cleared some of my pimples on my forehead but the following days it gave me more breakouts and pimple cyst specially on my cheeks
Acne	crunk, 25-34 Female  on Treatment for 1 to 6 months (Patient) 	4	5	4	Female	25-34	3/26/2009 4:27:33 PM	Ive had acne for the past 19 years (since age 11) and its progressed from severe to mild. Ive tried almost every oral or facial medication that one can think of and I have not seen a drastic improvement except for the time when I took accutane, which has severe side effects. I started using epiduo a month ago and I have slowly seen much improvement in my acne. So far, Ive not had any of the side effects listed for this drug yet..I love it and I will continue to use it, and patiently wait for it to clear my acne. I sometimes get one or two infected acnes-especially during my period- but it goes away in a couple of days.
Acne	MARTHA05, 19-24 Female  on Treatment for less than 1 month (Patient) 	4	5	4	Female	19-24	3/24/2009 12:56:52 AM	IVE ONLY BEEN ON EPIDUO FOR LESS THAN A MONTH. I HAVE EXTREMELY SENSITIVE SKIN!! I WAS VERY VERY SCARED ABOUT TRYING SOMETHING NEW. MY ACNE IS NOT TOO TOO BAD, BUT I REFUSE NOT TO WEAR MAKEUP. I HAVE RANDOM RED SPOTS AND WHEN I DO BREAK OUT, THEYRE BIG AND PAINFUL. SO FAR I TAKE IT AT NIGHT WITH A CLEAN FACE, AND I USE A TEENY AMOUNT, SO AFTER A MONTH LOOKS LIKE I HAVENT TOUCHED THE TUBE ALMOST. RETAIL ITS LIKE IN THE $200'S BUT I GOT A DISCOUNT CARD THAT MY 1ST ONE IS FREE, AND THEN $35 OFF THE NEXT 2 OR 3.  HONESTYL, SO FAR SO GOOD, AND EVEN DURING MY PERIOD I GOT A LITTLE ONE FOR 2 DAYS, WHICH HAS NEVER EVER HAPPENED. IM ONLY 20 AND I HOPE I GROW OUT OF THIS. AND IF BY THE END OF THE TUBE I LIKE THE EFFECTS(SO FAR SO GOOD) I WILL BUY THE 2ND AND 3RD TUBE. IT WILL BE $ WELL SPENT. I JUST WANT TO IMPLICATE AGAIN THAT U CAN HAVE THE 45G TUBE FOR ABOUT 3 MONTHS, MEANING THE STUFF IS WORKING AND YOUR NOT OVER DOING IT THEREFORE CAUSING YOUR SKIN TO BREAK OUT AND HURT.GOOD LUCK TO EVERYONE!!REMEMBER. . .  LESS IS MORE!!!!!
Acne	mygoalisclearskin, 25-34 Female  on Treatment for less than 1 month (Patient) 	4	5	3	Female	25-34	3/22/2009 4:42:00 PM	It makes your face red and it does hurt the first few weeks. I have seen a change in my face. I am going to keep using it and follow up with me doctor.
Acne	19-24 Male  on Treatment for less than 1 month (Patient) 	5	5	5	Male	19-24	3/17/2009 5:30:12 AM	I started using Differin (the adapalene in this product) over a year ago, and it didn't do much for me. My doctor prescribed Epiduo for me almost a month ago, but because of the cost, I was unable to purchase it. Well, thankfully, I looked up the ingredients in Epiduo, and luckily enough, I still had some Differin left from before. The Benzoyl Peroxide in Epiduo can be picked up at any drug store, although, I've found that the only low strength Benzoyl Peroxide is the &quot;Neutrogena On the Go Spot Treatment.&quot; That combination has done WONDERS for me. My face was VERY dry after the first 2 or 3 nights, but I used some Cetaphil Moisturizer, and it cleared it right up. Right now, I wash my face in the morning and night. I apply the Cetaphil in the morning and the Differin/Benzoyl Peroxide combination in the night.
Other		3	5	1			3/7/2009 7:04:38 AM	this stuff craaaaaaaaaazy!!!!!!!!!!!!!!!!!!!!!!!!hurt my face was all patchy and stingy and red
Acne	7-12 Female  on Treatment for less than 1 month (Patient) 	3	5	1	Female	7-12	3/3/2009 9:35:16 PM	I  agree with the first review!!!!!!!!!Ouch!!!!
Acne	dsdfs, 19-24 Female  on Treatment for less than 1 month (Patient) 	1	5	1	Female	19-24	2/20/2009 1:00:16 AM	it hurt like hell and made me all red and my face got very dry and stinged. I would NOT reccomend this at ALL
