Over Excitement	cdseverance, 25-34 Male  on Treatment for 1 to 6 months (Patient) 	5	4	4	Male	25-34	7/1/2009 9:51:57 PM	For anyone out there who has SEVERE panic attacks associated with mania(s) caused by a bipolar condition....this has been a wonder med. If you are having the worst panic attack of your life this drug will stop it on a dime. Only problems I've experienced are trouble sleeping as it is virtually impossible for me at times. I'm gonna talk to my doc on the next visit to fix this issue. Overall I have been pleased with the results.
Mental Disorder with Loss of Normal Personality &amp;amp; Reality	shan, 35-44 Female  on Treatment for less than 1 month (Patient) 	1	1	1	Female	35-44	6/19/2009 3:17:30 AM	did not work for me. i had every side effect on the list. plus the doctor gave it to my with a thyroyd that is not active. so i think this had something to do with it. it made my jaw lock up and made me rock back and forth. i do not recomend this drug for my conditions. detoxing from it is even harder. 
Other	Hospice worker, 25-34 Female  on Treatment for less than 1 month (Caregiver) 	5	5	5	Female	25-34	5/17/2009 6:12:34 PM	I have given this to patients at the end stage of their life when they become restless and extremly aggitated. It's the best thing Iv'e ever used for those who need it. They can rest very peacefully and let go of their life in peace.
Tourette's	25-34 Female  on Treatment for less than 1 month (Patient) 	3	3	3	Female	25-34	4/8/2009 3:21:34 AM	Just started it for Tourette's and Chronic Insomnia. I'm not happy about it. But have had Tourette's of course all my life and Insomnia the past 8 years. Have only tried it for a few days. But wow the ticks have been very few and that's fast for only a few days. The sleep isn't the best. I still have energy. But am tired at the same time. Then again, I have only just begun. I will try to leave another reveiw after I have been on a while. But I don't want to use this drug for more than a year for fear of the long term side effects. Oh yes and I have also had no apetite at all since I started this drug.
Tourette's	Beloeil, 45-54 Female  on Treatment for 5 to less than 10 years (Patient) 	5	5	5	Female	45-54	3/2/2009 4:57:03 PM	I was finally diagnosed with Tourette's about 5 years ago (after 40 years of wondering what was wrong with me).  I take 1 mg haldol in the am and same in the pm.  It has changed my life.  Although I do battle fatigue, the tics are very much under control (not gone, but under control).  I have no other side effects other than fatigue.  The damage being done to my shoulder by a persistent tic (7 shoulder surgeries and no one figured out why) has been completely stopped and I have no shoulder pain any more.  I can't imagine going back to life without this drug.
A Rare Developmental Disorder of Infants	Becki, 35-44 Female  on Treatment for 1 to less than 2 years (Patient) 	1	5	1	Female	35-44	2/13/2009 9:37:17 AM	I have a question. At what age should this medication be given?
Other	JBEAR613, 55-64 Male  on Treatment for less than 1 month (Caregiver) 	1	1	1	Male	55-64	2/8/2009 8:14:18 AM	THIS WAS WAS THE LIKLY CAUSE THAT CAUSE MY BROTHER DEATH HE WAS LIKE IN A COMA STATE FROM FIRST DOES NOT A GOOD DRUG AT ALL 
Mental Disorder with Loss of Normal Personality &amp;amp; Reality	bipolarsucks, 35-44 Female  on Treatment for 5 to less than 10 years (Patient) 	5	5	3	Female	35-44	2/5/2009 11:53:46 AM	 Here's the worst and best of this drug as I have had both.I have to agree with the 1st reviewer. This can cause facial disconesia. Sorry if my spelling isn't right on that one. The gist of it is your face starts to lock up and twist. GO ASAP to hospital have someone go or write out that its an allergic reaction to haldol. You will be unable to speak no doubt within 45 minutes. Scary yes! Benadril liquid or caps may be taken ASAP if you have them at home. This does help.As for the good part. I was on a manic high for over several months before I hit the wall and realized in the hospital I was Bipolar. Hey cause lets admit it mania can be very very fun but .. dangerous! Here is where haldol kicks in. If you are having a manic episode or you feel one on the way. Your Dr. may have you take this drug to knock you out long enough for your brain to bounce back to normal. Before you get a chance to hurt yourself or someone else being manic. Also used in hospitals as an injection to quickly calm a manic person.So is it a good drug? Yes, and I'm sure it's saved my life more than a dozen times. However, the last time I took haldol I had the facial thing, not cool at all. If I need this kind of fast muscle and brain calming due to mania I now take benadril with it. 
Chronic Type of Schizophrenia	JAMIELYNN, 25-34 Female  on Treatment for less than 1 month (Patient) 	1	1	1	Female	25-34	1/21/2009 9:22:20 AM	ended up having a dystonic reaction face contorted and clamped shut.was given cogentin to fix it if this happens to you go to the hospital.nothing to mess around with.NOT FUN.STICK WASHCLOTH IN MOUTH TO PROTECT TEETH
Mental Disorder with Loss of Normal Personality &amp;amp; Reality	akanannpop@aol.com, 75 or over Male  on Treatment for less than 1 month (Caregiver) 	1	1	1	Male		12/28/2008 12:28:14 AM	made him extremely restless    he had dementia  dont know why it was given to him at all
Aggressive Behavior	75 or over Male  on Treatment for less than 1 month (Caregiver) 	1	4	1	Male		11/28/2008 4:19:52 PM	
Mental Disorder with Loss of Normal Personality &amp;amp; Reality	55-64 Male  on Treatment for 1 to 6 months (Caregiver) 	1	1	1	Male	55-64	11/12/2008 8:56:18 PM	My dad hasnt been the same since he started taking this.He is like a zombie,and wants to sleep all the time,
Tourette's	none, 25-34 Female  on Treatment for less than 1 month (Patient) 	4	4	3	Female	25-34	11/9/2008 12:29:18 PM	When I was 16 I was diagnosed with Tourette Syndrome-i had symptoms since about 5- and was put on Haldol.I took it for a month and was zombie like so i stopped.Now, over 15 yrs later, i have also been dx with bipolar,severe anxiety,etc. I was just recently rapidly detoxed from ALL meds-psych,anxiety,etc. I am looking into possibly seeing about starting this again-now that iam older i may have quite a different reaction.If i do, i will let ya know.
Other	blakecall, 25-34 Male  on Treatment for 6 months to less than 1 year (Patient) 	5	5	5	Male	25-34	8/15/2008 9:25:01 PM	I take this medication for Bipolar disorder with Manic episodes and this drug helps tremendously. When I get manic I know it is time to take this med and I return to even mood within 24hrs.  I recommend it for certain patients with certain types of bipolar disorder.
Problem Behavior	klonopinkid, 25-34 Male  on Treatment for less than 1 month (Patient) 	4	5	3	Male	25-34	7/7/2008 11:44:57 AM	works well for me but most say you are a zobie on it.  it just make it so that i can talarate most poeople rudeness and stupidity.  i feel just fine it also helps my agressness.  i just bad drymouth.
Other	35-44 Female  on Treatment for 1 to 6 months (Patient) 	5	5	5	Female	35-44	5/11/2008 12:15:40 PM	I take Haldol for BiPolar disorder and panic disorder. It has helped me tremendously. I wonder how many milligrams these other people are on?
Mental Disorder with Loss of Normal Personality &amp;amp; Reality	mikebrendah@aol.com, 65-74 Female  on Treatment for 10 years or more (Caregiver) 	5	5	5	Female	65-74	3/1/2008 6:49:27 PM	my mom's dr. took her off haldol last week because she keep's falling and now she keeps talking about the past as in years and years ago. we don't know what will happen next. she may have to go from assisted living to a nursing home.
Chronic Type of Schizophrenia	Anymouse, 35-44 Male  on Treatment for less than 1 month (Patient) 	1	5	1	Male	35-44	1/7/2008 1:29:52 AM	I do not consider turning a schizosffective but functional patient into a drooling quivering mass sitting in a corner of a Navy psych ward to be &quot;treatment.&quot;  My doc took me off it, and when I asked him what I should do with the extra he said - &quot;Give it to my wife&quot; - as she had been harassing the Naval Hospital as to the condition it left me in.  It was also instrumental in destroying my military career.  This stuff is &quot;not candy&quot; - beware.
Problem Behavior	25-34 Male  on Treatment for less than 1 month (Patient) 	3	5	3	Male	25-34	11/14/2007 7:14:09 PM	At first I was allergic and then b/c better and was fine.
Brief Episode of Schizophrenia with Rapid Onset	 Female 	1	1	1	Female		10/23/2007 9:09:34 PM	
