Birth Control	rubyred, 19-24 Female  on Treatment for 1 to less than 2 years (Patient) 	5	5	3	Female	19-24	8/2/2012 1:46:23 PM	The most noticeable side effect that my husband I have noticed is the lack of intimacy by my part. I just seem to be missing those hormones. Also the mood swings, they are terrible. 
Birth Control	AKstudent, 19-24 Female  on Treatment for 6 months to less than 1 year (Patient) 	5	4	5	Female	19-24	7/29/2012 6:11:23 PM	The first 3 months using this bc, I had a problem with irregular periods and acne break outs. These were both symptoms the doctor forewarned me about. Although the irregular periods were a pain...including only spotting one month to 1 1/2 week periods another month. I think about the 4th month of having implanon I had a mild-regular period for a month straight (which may have also been due to stress I was having), then nothing at all since. Not even spotting. I never had any weight gain or problem losing weight with the implanon despite the objections of my roommate who doesn't exercise or eat particularly healthy. Overall, I'm satisfied as a person who could never remember to take bc regularly every day and had weight gain and mood problems with other oral contraceptives.
Birth Control	19-24 Female  on Treatment for 6 months to less than 1 year (Patient) 	5	5	2	Female	19-24	7/18/2012 11:11:32 AM	I have had Implanon for nearly a year and didn't have much trouble to begin with but the longer I had it the more issues I had. I've gained 15lbs or so, even though I lead a much healthier lifestyle than when I first got it. I also have issues with spotting almost daily and severe mood swings -- both things I've never experienced before. Every person is different, but for me it hasn't been a great experience. 
Birth Control	19-24 Female  on Treatment for 2 to less than 5 years (Patient) 	5	5	1	Female	19-24	7/16/2012 6:07:10 PM	I just got my implant removed after having it in for two years. It's great that you don't have to remember to take anything and it was effective in preventing a pregnancy, but the bleeding is terrible. My periods were heavy, like a new tampon EVERY hour. Each period I had lasted a month, sometimes longer. I have developed anemia, possibly from the blood loss as well. When I had the implant removed today, my doctor told me that my skin had actually grown around the implant and it took 30 minutes to remove. I doubt this is how a normal experience with implanon is, but it didn't work for me...
Other	jjmolina70, 35-44 Female  on Treatment for 2 to less than 5 years (Patient) 	5	5	5	Female	35-44	7/15/2012 1:11:22 AM	This is my second implanon. I used to get periods so bad that I couldn't even get out of bed. I had surgery to lessen the bleeding but that didn't woek. Then I got the implanon. I love it.I didn't get my period for 3 years. I just had the old one taken out and another one put in. I couldn't ask for better results 
Birth Control	25-34 Female  on Treatment for 6 months to less than 1 year (Patient) 	5	4	1	Female	25-34	7/11/2012 11:57:36 PM	Do not get the Implanon! Had no idea the side effects of Progesterone which is the hormone is the implant. I have gained 30 pounds literally, I bleed 20 to 23 days of each month, and now have major odor issues. I also had major problems with acne (all over my body) and increased PMS symptoms initially when the Implanon was inserted. I was told the first few months I would notice some changes, but after 4 I began calling my clinic because I knew something was wrong. I finally got someone to return my calls 6 months later, and they said I should have the implant removed immediately. The convenience was nice, but the horrible side effects were not worth it. 
Birth Control	13-18 Female  on Treatment for 2 to less than 5 years (Patient) 	4	4	5	Female	13-18	6/29/2012 1:04:27 PM	I first got Implanon in March of 09. I was looking for a long term contraceptive that didn't involve me having to remember taking a pill everyday. When I came across this contraceptive I was thrilled because it seemed almost perfect. The insertion was very fast and almost painless, however I had a bruise on the insertion site and have a tiny scar but that's very minor and nothing to stress over. My periods were wonderful, something I never thouggt I'd say, I would go a month without one but when I got it it was just spotting that would last from 1-4 days. Also, I had no weight gain, if anything I lost weight. After my 3 years were up, I was so satisfied with it that I had it inserted the same day it was removed in March and let me tell you it seems to be working even better than it did the first time. 
Birth Control	LaraMarie_1993, 19-24 Female  on Treatment for 6 months to less than 1 year (Patient) 	5	4	1	Female	19-24	6/23/2012 10:24:18 PM	I have had mine for a good 11 months and i absolutly hate it!My periods have never been regular, and at first I would have a period or two in a month and then the next not any, but recently I had my period for a whole month straight, theres a oder to my periods, got a UTI and a bacterial infection from that, finally stoped bleeding and now 3 days later im bleeding again.. gained soo much weight, even when excersising all i see on the scale it more weight. appointments on juky 5th and im getting this thing taken out ASAP! i DO NOT recomend this to anyone at this point i dont have alot of money but i'd rather be pregnant again! 
Birth Control	NoteingButTheTruth, 19-24 Female  on Treatment for 1 to 6 months (Patient) 	1	5	1	Female	19-24	6/18/2012 12:37:02 AM	I have had my Implanon since January and weighed 133 pounds on the day of insertion, as of today I weigh 150 pounds for a total weight gain of nearly 20 pounds in less than six months. In addition to that, I'll miss a period for a month, get it the next month out of nowhere and because there is no regularity EVERY time I go to the doctor complaining of any aches/pains that may even loosely be similar to that of pregnancy, I'm tested. No problems with acne while on this BC, but I am not happy with the weight gain at all. I'd almost rather be pregnant! At least THEN I'd have a reason for not being able to wear anything other than leggings. Mind you, this birth control doesn't just make you gain weight on its own, it does this by increasing your appetite. I am NOT kidding you, I have eaten 2-3 servings at dinner (more than 200 lb husband), and I'll be hungry again two hours later. I'm making an appointment to get this Implanon taken out ASAP. Wouldn't recommend this to even my worst enemy.
Birth Control	manna4211, 19-24 Female  on Treatment for 6 months to less than 1 year	3	5	1	Female	19-24	6/17/2012 2:46:20 AM	I've had this birth control for 10 months. I still have pain where its at. My mood swings are unbearable. I can't stand it. I have two periods a month that last 5 days at least. My skin is oily. I lost 20 pounds. I'm not complaining about the weight loss but I can not wait to get this out.i wouldn't tell anyone to get it 
Birth Control	dgbj, 19-24 Female  on Treatment for 1 to less than 2 years (Patient) 	4	4	1	Female	19-24	6/15/2012 5:39:07 PM	I have had this for going on two years, my periods are never the same ill miss a whole month then have one for two weeks I hate it!!!! At times with my symptoms I've thought I was pregnant, major headaches, cramps, even nauseous. Im getting this removed!!
Birth Control	ForensicPsyDr14, 25-34 Female  on Treatment for 2 to less than 5 years (Patient) 	5	5	4	Female	25-34	6/12/2012 6:14:49 AM	I was a bit concerned about the effectiveness of this birth control because of my weight. Im 5'7 and was 250lbs when I had my Implanon inserted. I know from previous experience and pregnancy that being heavier reduces the effectiveness of birth control. Well that is not the case with Implanon. I've had it going on 2 years and have never even had a pregnancy scare. In face my periods stopped all together and have been gone since I had it inserted!! I've Ihly had light spotting twice in all the time I've had it in. The only drawback to this birth control is the weight gain. Within the first year I was up to 277 :-( thankfully I realized the problem and got the weight off (and a little more than i started with) but putting on that much weight in such a short time is scary. I'm quite sure my already poor diet and exercise habits played a role, but the amount of fatigue you experience the first few months after insertion surely don't help. As for the whole implant itself. Going in wasn't that bad as the local anesthesia numbs you up pretty good, but you will have a nasty bruise for about a week at the point of insertion. Once in your arm you barely notice anything there as it is not visible at all and you only feel it if you search for it (no one else will be able to feal it if they happen to touch your arm). Knowing what I know now, I definitely see myself getting another one when it's time to take this one out. 
Birth Control	angela, 25-34 Female  on Treatment for 2 to less than 5 years (Patient) 	5	5	1	Female	25-34	5/31/2012 4:58:47 PM	In Sep it would have been 3 years that I would have had this I'm but I am going in the morning to havr it taken out I have been having problems for the past year but my first year it was  great I loved it , I have been suffering for around 6 months with depression being bloated bad mood swings , I am so so tired I cant function at work . I do not feel like my self . My stomach hurts all the.time it is the worst feeling I have felt in my life I can.not. take another day feeling like this, I hate feeling sad all the.time.Ooo and I have had a headache for months now.  I am so ready to have it taken out , I will NEVER get on this both control and will not recommend it to anyone 
Birth Control	danamama, 19-24 Female  on Treatment for 2 to less than 5 years (Patient) 	5	5	4	Female	19-24	5/13/2012 10:01:35 PM	I have been on Implanon for 2 years and I have had none of the common problems with it. I do not bleed and have not since I got the stick inserted. I did bruise really bad and I have a tiny scar where it was inserted but it's been worth it for me. I am about to graduate college with a 2 year old and have no more kids because I got this. Maybe it is because I got it about 3.5 months after I had my baby instead of the normal 6 weeks but I have not had the bleeding issues. I was not skinny before but I cannot seem to lose the baby weight, that may or may not be drug related though.
Birth Control	Evie1234, 19-24 Female  on Treatment for 1 to less than 2 years (Patient) 	3	5	1	Female	19-24	5/4/2012 10:04:04 AM	Worst birth control I've ever used! Extremely long and frequent periods (I bled for more than 60 days), caused severe acne, and made me irritable, nervous, and excessively hormonal. Insertion was not bad, but during the removal it broke in half and it took the doctor 30 minutes of prodding me with a scalpel to remove it. I absolutely hated it. It also gave me bad cramps and very unpredictable periods. I used it for 11 months before having it removed and replaced with the Paragard IUD, which is 1000 times better! Implanon prevented pregnancy, but made me miserable. There are better options that are worth reviewing before decided on the implanon. I warn against it and tell everyone I know that it is not a good choice!
Birth Control	implanonisbad, 19-24 Female  on Treatment for 6 months to less than 1 year	5	5	1	Female	19-24	5/2/2012 3:12:14 PM	I'm getting this removed next week because it has changed my life so much in such a negative way. Ever since I've had Implanon, I'm tired ALL the time, I've been depressed and so angry, and I'm not like that at all. I get my period every week, and that's if it even stops from the week before. I didn't gain weight or anything like that, but pyschologically it has screwed me up so much.  I never used to cry before, but I have the urge to cry all the time now.It is taking a toll on my relationship and that's not worth it to me. It does what it is supposed to, but after getting it in, I have no sex drive, so what's the point of birth control?!I do not reccomend this to anyone.
Birth Control	barky, 19-24 Female  on Treatment for 1 to less than 2 years (Patient) 	5	4	1	Female	19-24	5/2/2012 1:54:38 AM	Short and sweet: aside from no libido I had no period for 1st year that is where they good ended. Now (18m in ) I feel like I am pregnant and going through menopause all at once. I am having it removed due to all the issues I have had. This is the worst experience with birth control I have had, so bad I opted to get tubal done. I recommend everyone to stay far away from this drug!
Birth Control	Sheila, 25-34 Female  on Treatment for 1 to 6 months (Patient) 	5	1	1	Female	25-34	4/26/2012 7:58:59 AM	I had it inserted 6 months ago. I stopped getting my period since then. I dont have mood sings etc. but I've gained weight since and I cant seem to shake it off. On top of that, I notice visible cellulites and water retention and I feel bloated everywhere. This has definitely affected my self-esteem, especially when I'm very particular about my appearance and weight. I'm thinking of having it removed, but I do like not getting my period. However, I don't feel it's worth the weight gain etc. to be honest. 
Birth Control	Chantele1985, 25-34 Female  on Treatment for 1 to less than 2 years (Patient) 	3	2	2	Female	25-34	4/23/2012 6:42:38 PM	I don't like the fact that I have an irregular cycle and never know when my cycle is coming or not. I think i'm going to have it removed.
Birth Control	Skyla, 19-24 Female  on Treatment for 6 months to less than 1 year (Patient) 	5	1	2	Female	19-24	4/21/2012 12:09:24 PM	I had it for 9 months, and it was 9 months of (Extra) irregular periods in addition to my regular period. I took it out and now I have a scare. I wouldn't recommend this to any one. I've had several doctors tell me they wouldn't either. Good Luck, Ladies!
Birth Control	happy123, 19-24 Female  on Treatment for 2 to less than 5 years (Patient) 	5	4	5	Female	19-24	4/16/2012 9:42:13 PM	I have just had my second implanon put in after 3 years of use.  I had zero bleeding or periods the whole 3 years, no mood swings, no side effects at all.  The removal was a more painful that I would have liked, but well worth it.  I guess I'm one of the lucky ones, I had an excellent experience with implanon. 
Birth Control	Anf1989, 19-24 Female  on Treatment for 6 months to less than 1 year (Patient) 	3	1	1	Female	19-24	4/12/2012 7:01:57 PM	I'm very happy I read about 20 of the reviews on here. It just reconfirmed my decision to have it removed!! I have had the Implanon since August 2011. I too had crazy mood swings then they went away, then a week after having it put in the bleeding started. I figured it was my regular period. Ha! WRONG!! Never in my life has my period lasted 5 months. I then went back to have it removed and the Dr. told me to take 600mg of Ibuprofen 3X a day. She wouldn't remove it for me until I kept it in for at least 6 months. I left in tears! I refused to take that amount of ibuprofen. I just stuck of the bleeding, it finally stopped for one week. After than on week, it started again! And hasn't stopped since! Not to mention the insane amount of pimples and blackheads that appeared. I have never had oily skin! I also have accrued back acne which again has never happened!! I Absolutely hate this thing!! I'm also 23, 5'10&quot; and was a size 2-4. Now I'm back in my size 6 clothes. Its a drastic change!! I too though this would be amazing to have! IT IS A NIGHTMARE!!!!! And I would really like my money back at this point for the million packages of tampons!!!
Birth Control	adelaid723, 25-34 Female  on Treatment for 1 to less than 2 years	5	5	1	Female	25-34	3/28/2012 9:58:49 AM	I am 14 month in on my second insertioon of the implonon. The first time i had it put in i had the 3 week periods for about 6 months and was able to make it through and had no other side effects. After having my son i had it inserted again 6 weeks after i gave birth. Since i have had 3 week periods, bad cramps, stress, no sex drive aniexty and my doctor has me on prozac for depression. I have an appoitment with my gyno monday to talk about getting my tubes tied cuase i really cant handle the side effects and i really dont think i should be on prozac just cause of birth control. I think it is a great concept and nice to not worry about a pill everyday! But ifthey could work out the bumps and side effects it would be great! I think that doctors should tell you all the side effects before inserting this drug! 
Birth Control	25-34 Female  on Treatment for 6 months to less than 1 year (Patient) 	1	1	1	Female	25-34	3/21/2012 8:42:44 PM	I just short of being on this a year. I had it removed today because of the excessive bleeding (bleeding every 2 weeks) and mood swings from the hormones.  I almost feel like I was lied to when I was talking about it w my doc bc I asked why people don't like it and the ridiculous amounts of bleeding was never brought up. ASK YOUR DOCTOR whats the most complained about aspect of this drug and why they take it out most often before you decide
Birth Control	hstabbert, 19-24 Female  on Treatment for 1 to less than 2 years (Patient) 	1	1	1	Female	19-24	3/20/2012 4:04:03 PM	Hey everyone, I posted an angry review earlier and I just wanted to tell you all that I had my Implant removed and ALL of my problems have gone away. My confidence is back to normal. My skin has DRASTICALLY healed within two weeks. I am finally stress and tension free. My sex drive is back to awesomeness. My energy level is high and I am once again productive. If your having problems PLEASE just go get it taken out. Looking back at the last year and a half makes me realize all the issues it caused me. Mental and physical. If your estrogen levels are normal don't get on this. I only think it works for women who have extra high estrogen levels. 
Birth Control	19-24 Female  on Treatment for 1 to less than 2 years	5	5	1	Female	19-24	3/15/2012 11:07:02 PM	Wow! I'm so glad I'M NOT the only one having issues. I'm moody, sometimes angry, most of the time anxious, NOOOO ZERO 000 sex drive. I've lost a dramatic amount of weight. Acne everywhere and the worst part is even when I use products such as Proactive they seem to work and then the acne comes right back or never leaves to begin with. I feel like this birth control has absolutely turned me into an opposite person compared to who I used to be.  
Birth Control	ClemonsJamie , 19-24 Female  on Treatment for less than 1 month (Patient) 	5	5	5	Female	19-24	3/15/2012 7:35:53 PM	So far Ive had no problems. I went 7years every month sick as a DOG! hydrated,  not eating 7days because of my period.. I we went pill after pill, took it daily at the same time daily. Nope not a thing worked. I went onto the depo shot in nov. HAHAHA sorry that shot is A JOKE! I got put on the implanon Feb 10th, and just LOVE IT! My Doc put it before my period to hopefuly let it help, well since then no bleeding at all(: ((which IM SUPPER HAPPY ABOUT)) I had it in, no bruising after(thankfuly) but I dont regret it one bit! I know it takes few months to fully work, but its working wonders for me, because the depo shot wore off about 7weeks after I had it and mideol doesnt work well at all.. Ive had no weight gain, mood swings, acne.. anything like that.
Birth Control	sarahsaylor06, 25-34 Female  on Treatment for 2 to less than 5 years (Patient) 	5	4	1	Female	25-34	3/3/2012 8:42:41 PM	So I thought this was going to be the perfect birth control. Boy was I wrong, It is effective but the side effects from it were out of control. Mood swings, Heavy periods for 5-7 days every 2 weeks, cramping horribly, lower back pain, sore breast, anxiety attacks, depression, acne like I have never had before and a large amount of weight gain despite all my efforts to keep it off. I hate it I am absolutely the most miserable I have ever been. I can't wait to get this removed next week I am so over it!
Birth Control	25-34 Female  on Treatment for 1 to less than 2 years (Patient) 	5	3	1	Female	25-34	2/29/2012 4:56:38 PM	I got this over a year ago. I thought it would be nice not take a pill every day. I had irregular bleeding for months. I gave it a few months thinking my body would adjust to it. I started to gain weight faster than ever before. I gained over twenty pounds in a year. I had never gain weight in my before except during my pregnancy with my daughter. I lost the weight soon after. I found myself moodier than ever before after a few months of using implanon. The bleeding continued and I rarely had a day when I stopped. After a year of dealing with this I could not take it anymore and had it removed a two months ago. I am on the pill again. I fill better and I am loosing weight. My doctor told me he had not had a patient tell him they had gained that much weight before using implannon. I found that hard to believe. I am not a complainer very often and he made me fill like I was lying. I would never use this again.
Birth Control	IHateMyImplanon, 35-44 Female  on Treatment for 1 to 6 months (Patient) 	5	1	1	Female	35-44	2/27/2012 12:44:40 AM	I have been on BC for 20 years now and I've never had an experience like this.  About 2 weeks after I had the implant placed I started breaking out with cystic acne on my neck, jawline, chest and shoulders.  Then I began to notice my anxiety going through the roof, my sex drive taking a nosedive and vaginal dryness.  None of this is normal for me.  Then I started bleeding huge blood clots on Feb. 10, 2012 and it is showing no signs of letting up.  I cramp and I'm tired all the time.  I seriously wish I had read the reviews on here before I got the implant.I got this because my OB-GYN said it was &quot;more natural&quot; and low in hormones and wouldn't raise my blood pressure the way some BC pills can.  Well, I'm here to tell you there isn't anything &quot;natural&quot; about this drug.  I'm getting it removed and getting an IUD placed.  I want my sex drive back, this bleeding to stop and rid of these pimples darnit!
Birth Control	hstabbert, 19-24 Female  on Treatment for 1 to less than 2 years (Patient) 	5	1	1	Female	19-24	2/26/2012 12:50:15 PM	I am in my early twenties and have always had clear skin. After getting this put in my arm I have never regretted anything more. Before having the implanon implanted, I had started taking fluoxotine, and Adderall. My skin problems have been so bad that I've been on antibiotics a handful of times and its turned into a never ending hormonal acne story. I've given up going to my expensive dermatologist. Given up taking antibiotics and now am dealing with the worst ingrown hairs of my life...( caused by the progesterone that makes you grow hair on your FACE! Which results in clogging pores and I'm blonde and Prussian? So noticeable hair on my face, is a lot of freaking hair!)I had BEAUTIFUL skin and was envied all throughout high school and now at twenty years old have permanent cystic acne scars all over my face,chest,PUBIC area, butt, arms,and thighs! It makes me angry just typing this review. Looking back at the past year and a half I wish i would have just gone on the pill. The money i thought I was saving just went towards tampons because my period will last 2 months straight and 1 week off. Also I have spent hundreds of dollars on blood work because I have become highly anemic and potassium deficient. Everytime my doctor says I'm getting better,SURPRISE! comes my period and I have to start over again. I can sleep fourteen to eighteen hours at a time. I feel weak constantly! I no longer have the motivation to work out or do anything physical. Also remember I HAVE 97.9 above average level ADHD! ? That.is.NOT.normal. I have had no sex drive from the start of the implant and I am a very passionate person when in a monogamous relationship. Its made my hormones so bad that I I have too much progesterone and minimal estrogen. It causes Anxiety through the roof! And i was already on prozac! SO: If you suffer from anxiety or had childhood acne DONT GET IMPLANON. Especially if your twenty or so. I'm getting it removed asap, I would have earlier if i had realized.
