Birth Control	kirstin, 35-44 Female  on Treatment for 1 to less than 2 years (Patient) 	5	5	3	Female	35-44	8/27/2009 9:58:45 AM	I have been on this for 1 1/2 years.  I have had 2 kids &amp; am unsure if I want another.  This seemed like the perfect birth control.  Insertion wasn't bad.  The device feels kinda gross under your arm.  I went without a period for over 3 months.  However, after the 3 month period I bleed alot.  It is random - sometimes light, sometimes moderate.  But I seem to bleed off &amp; on for at least 1 1/2 weeks per month.  I just went thru a period of bleeding for 2 weeks straight.  I am visiting my doctor today to discuss other options.  I had no weight gain or other side effects that I'm aware of.  It is a great method of contraception, but I'm afraid it affects everyone differently.
Birth Control	kacy, 25-34 Female  on Treatment for 1 to less than 2 years (Patient) 	5	4	2	Female	25-34	8/24/2009 5:54:22 PM	I have had Implanon in for over 1 year now. Had normal bleeding in the begining. Then 4 and a half weeks straight of bleeding then stopped or 3 days then another 4 and half weeks. Dr. Put me on a pill so i would not bleed all the time. SO why do i have the implanon in if i have to take a pill everyday anyway? I do not recommend it to anyone. It is a sex drive killer.
Birth Control	Jenn810, 25-34 Female  on Treatment for 6 months to less than 1 year (Patient) 	5	2	1	Female	25-34	8/21/2009 10:48:15 AM	I had this put in in Jan 09 the first couple of months I had a normal period, As of right now Aug 09 I have been bleeding for a month and a half straight. I have had no sex drive my husband thinks i don't want him anymore. I am shooting 6 hour energy drinks every day to keep up with my son bacause i am tired all the time. I am gaining weight and have to work my butt off or starve to loose it again. I don't recommend it and as soon as I find something else that does not require a pill everyday i will change. 
Birth Control	19-24 Female  on Treatment for 6 months to less than 1 year (Patient) 	5	5	5	Female	19-24	8/20/2009 11:34:46 PM	I got on implanon in November of 2008 and I have absolutely loved it. I bled for the first month straight and it was pretty heavy, but since then I have not had a period. I have not had the side effects people have said on here in previous posts and it was the best thing for me. I recommend it to anyone that is looking for a contraceptive because of the ease of use and the effectiveness.
Birth Control	13-18 Female  on Treatment for 6 months to less than 1 year (Patient) 	5	5	4	Female	13-18	8/14/2009 4:09:15 PM	I am 18 years and I had Implanon inserted in Dec 2008. I can't take estrogen so Implanon seemed like a good choice. It was almost painless and left a very tiny scar. At first, I spotted here and there. The blood is brown and dry looking. But I have yet to have a heavy enough flow to require tampons or pads. A panty liner if I'm wearing light colored undie. I was moody for awhile and a bit depressed, but that passed and I couldn't be happier! I have always had moderate acne and I haven't noticed it get worse. I'm fond of implanon, but it is definitely not for everyone
Birth Control	Me, 25-34 Female  on Treatment for 1 to less than 2 years (Patient) 	5	5	2	Female	25-34	8/8/2009 11:55:22 PM	For the first year, Implanon was great. I can't say anything about decreased since I don't notice anything because I work at night and with twin toddlers, yeah. I had spotting for about a month. Nothing major. I gained 5 lbs, hormones were out of whack for the first month or so but finally stabilized or maybe I am just getting use to it. However, right after I hit my first yr of use, I started spotting/bleeding for almost 2 wks. I got 3 days break then it has been non-stop since end of May til today (Aug), that would be 3 months. I had my thyroid checked, awaiting results and will have a sonogram next wk to see what is going on. But is scheduled to have it removed in 2 wks. 
Birth Control	19-24 Female  on Treatment for less than 1 month (Patient) 	5	5	4	Female	19-24	8/6/2009 2:23:31 AM	Love this because it's so convenient but I've had a pounding headache every day since I had it put in. Ibuprofen only takes it away for a few hours and then BOOM it's back!!!!
Birth Control	19-24 Female  on Treatment for 6 months to less than 1 year (Patient) 	5	4	1	Female	19-24	8/5/2009 12:43:57 PM	I have been on this thing for 7 1/2 months. I plead with anyone who is going to or already is get off implanon. Even if you have one or five or maybe even more. Do not wait it out it does not go away it just gets worse. If your doctor will not take it out make them. Implanon has worked great as a birth control because I can't have sex it hurts to bad. I have 6 out of the 9 side effects, and things are only getting worse. so I say once again please please do not take or please take out the implanon. No one should go through what I have had to go through. I have a 9 month old son and its been really hard to take care of him and deal with me. 
Birth Control	13-18 Female  on Treatment for 1 to 6 months (Patient) 	3	4	4	Female	13-18	8/3/2009 11:27:08 PM	I'm 16 yrs old, yeah i'm young to be on birth control but i get cyst that grow bigger than their suppose to be &amp; I'm irregular. And i am sexually active, sorry but yeah. And i'm on the dance team at my school and i feel weird dancing while on my menstrual, it may sound weird but that's how i fell. anyhow, the only difference is that with me is i had started like i usually do on some months for 3 days, then after that i spotted for 2 weeks. It's been about 2&amp; a half months I've been on it. I already had 5 side effects, i hope it slows down as i have it in. I'm going to see how it goes for a while longer. I think that's what everyone should do; wait &amp; see if you can handle the side effects &amp;tell your spouse &amp; family hey i might have this &amp; that but its the birth control, don't worry. ha ha i think that kinda makes some sense. But its like that saying, &quot;don't judge a book by its cover.&quot; meaning don't judge the birth control by what you hear, like bad things/good things, just try it out, like a sport or even food.ha ha don't be scared to try new things. I hope this helped anyone out there, my mom doesn't listen much to my opinions or when i try to help her out so i hope all of you ladies do:) 
Birth Control	cmsteed78, 25-34 Female  on Treatment for 1 to 6 months (Patient) 	5	5	2	Female	25-34	7/15/2009 11:06:34 PM	 can relate to the side effects, too, of Implanon. I have had it in for exactly 3 months (tomorrow) and for the first month it was wonderful. No period and no side effects at all. I haven't had a period except for minor spotting for 2 or 3 days. But the other side effects are so much that I have an appointment to have it taken out tomorrow. I have had a headache non-stop for 6 weeks, to the point of nausea and loss of apetite. I'm actually losing weight instead of gaining it. My doctor had diagnosed me with hormonal migraines - due to the lack of estrogen. Also, in the last 6 weeks I have become very withdrawn from my friends and family. I don't like to be around people anymore and I am extremely depressed and anxious now. I have started having panic attacks in the grocery store!! I think about death and serious illnesses all the time. I thought I was developing a brain tumor because of the headaches! Everything seems to be exaggerated - my mood swings, fatigue, no energy, no sex drive, no desire to date or even see my friends. In the last 6 weeks all I do is go to work and go home. That is not me at all! Usually you can't catch me at home! So before you get this please make sure the benefits out way the side effects for you - because it doesn't for me. I can't wait until my appointment in the morning to have it taken out!!
Birth Control	shawnye, 19-24 Female  on Treatment for 1 to 6 months (Patient) 	3	5	1	Female	19-24	7/15/2009 12:51:05 PM	i would never tell any one about this i spotted alot gained alot of 35 pounds my face broke out very bad.
Birth Control	rebelrose2712@yahoo.com, 19-24 Female  on Treatment for 1 to 6 months (Patient) 	5	2	1	Female	19-24	7/11/2009 8:48:22 PM	as soon as it was inserted, i started experiencing migraines and severe stomach cramps. i was also staying tired a lot; sleeping for over 10 hours a night and still feeling drained. there was also a lot of pain at the injection site (mostly when i picked up 10+ pounds). a month after insertion, i had it removed.
Birth Control	ronnie, 35-44 Female  on Treatment for 2 to less than 5 years (Patient) 	5	5	1	Female	35-44	7/7/2009 1:12:31 PM	I have gained 50 pounds in two years and I am now having liver problems that may be associated with this drug
Birth Control	25-34 Female  on Treatment for 1 to less than 2 years (Patient) 	5	5	5	Female	25-34	7/1/2009 4:18:53 PM	I am going on the last year of having the Implanon in. The first 8 months wwere a little crazy. i never knew when i was going to start my period.  After that i became regular, I knew when my period was going to start every month. I have not gained any  weight from this and i dont have acne because of this birth control. I have been very happy with this method and I have recommended it to many of my friends who are also using this method now and are happy with the results. I am not ready to have another kid so i will opt for this birth control next year when i have to take the old one out!!The only thing I can tell you is wait it out a little bit and give your body a chance to get used to it before you give up
Other	19-24 Female  on Treatment for 6 months to less than 1 year (Patient) 	5	5	4	Female	19-24	6/28/2009 1:31:10 PM	I am a 21yr old caucasian female with a history of severe menstrual pain and painful ovarian cysts. I had the Implanon put in 12/08. I had no period until 3/09 which lasted about a month. I haven't had any spotting or periods since. I would recommend this for women who share my problems. No period equals no pain. I have not had any other side effects except NO SEX DRIVE. It doesn't bother me too much, but the man in my life has a different opinion. I am currently seeking answers to this problem. All in all I've had it 7 months and I would recommend it to others. Although some of the reviews I've read have me a little worried of what may happen the longer I have it.
Birth Control	19-24 Female  on Treatment for 1 to 6 months (Patient) 	5	5	4	Female	19-24	6/23/2009 2:45:05 PM	I've had the birth control for a month and I am glad I did it.  It was painless to have inserted and I've had one period but other then that no spotting.  I have lost 5 lbs this month, not changing anything in my routine, and I have had no other side effects.  I read that a lot of people had severe acne, but I've never had acne so this may be why I still don't even after Implanon.  I did have some swelling for the first two weeks.  I've tried many different types of birth control, but I always gained weight and I would have severe headaches. I love this product, and hopefully my feelings wont change in the months to come.
Birth Control	bluerose26, 19-24 on Treatment for 6 months to less than 1 year (Patient) 	5	4	3		19-24	6/23/2009 2:38:42 PM	I have been on this for a lil over 7 months. When i first started it i didnt have a period for 3 months. That one lasted 2 weeks. then now its been over 3 months and I havent had my period again yet. I have gained almost 20lbs since i started this birth control. I get slight cramps around the time im supposed to have a period. I seem to be more moody too. So far Im not pregnant so this method works for that purpose.
Birth Control	Sarah F, 35-44 Female  on Treatment for 1 to less than 2 years (Patient) 	4	3	1	Female	35-44	6/23/2009 8:40:56 AM	I had the implanon inserted in May 08. I am a 39 year old woman. I am overweight by about 30lbs but in the last 3 months I've lost 14lbs by changing my diet/activity level.At first I was thrilled: after one normal period and a couple of 1 day episodes of spotting, I had no bleeding. I didn't have mood swings or weight gain. After trying the oral contraceptive pill, the Depo injection and the Mirena coil with unacceptable side-effects I thought I'd finally found a good method of contraception for me!Until now, that is...I had my smear nearly 4 weeks ago and since then I have been bleeding almost every day. I worried so called GP who said this is not unknown. My smear result has come back normal. I am to keep a record of bleeding and go see her in a month. At which point she may want to presribe an oral contraceptive pill to help control bleeding.Except I don't want to go on the pill at all. If I continue to bleed like this I will have to conclude that Implanon is a very effective form of contraception simply because it prevents one from having sex!I will have it removed and will make an appointment to have myself sterilised.
Birth Control	19-24 Female  on Treatment for 1 to 6 months (Patient) 	4	4	1	Female	19-24	6/18/2009 10:36:46 AM	I would definitely not recommend this birth control to anyone!! I've been on it for about 2 &amp; 1/2 months, my hair is falling out so bad, that I have two bald spots on each side of my head &amp; its only getting worse.  I've had horrible mood swings, no sex drive, depressed, chest pain, &amp; really bad migraines!! To make matters worse I'm always tired &amp; have been having horrible muscle weakness.  My muscle weakness is so bad that I can't grip my son's bottles, I can barely hold my son sometimes or even move! My hands already hurt from typing already! Another down side was that I gained 15lbs so far!! Still going up! I'm getting more stretch marks now than from when I was prego! I work out everyday &amp; do cardio for an hour everyday....so I really don't know what else to do.  I've been trying to convince my OB to take it out but he won't.  I'm going to ask one more time &amp; if he won't take it out I'm going to a different OB! Please do not take this!! I prefer the depo better!!
Birth Control	19-24 Female  on Treatment for 1 to 6 months (Patient) 	4	4	1	Female	19-24	6/16/2009 8:47:52 PM	I have been on this birth control since Dec. 08 and its now June 09. My period cycle has been all over the place. I bleed for two-three weeks at a time. Stop for a week or two then bleed again. Sometimes its extremlly light (spotting) to moderate bleeding. I still suffer from terrible cramps.  I occasionally break out with acne on my face and chest.  I also suffered from some weight gain. Overall, I don't like it, and want to get on another type of birth control.  If you don't like pills this is perfect, but if you don't mind taking them I would advice you to continue to take them. I never know when my cycle is coming on and going off, and now that its summer I really don't like that. Make sure you always ask the doc of all the possible side effects before getting on anything. 
Birth Control	Globetrotter, 25-34 Female  on Treatment for 2 to less than 5 years (Patient) 	5	5	5	Female	25-34	6/12/2009 4:23:40 AM	Wow - my experience with Implanon seems like the polar opposite of many folks here. Due to my wacky schedule and missing pills, I looked into implants when I was living in the UK a few years ago, and Implanon is what my clinic suggested. I had it in for three years, and just got it replaced in the US recently. Never had a symptom, don't menstruate, suspect my sex drive is lower than it would be, but overall no complaints. One thing I would recommend - before my UK doctor put me on Implanon, we did a trial - using a birth control pill with the same active ingredient as Implanon, I believe, and which carries the same dose every day rather than having the &quot;week off&quot; that my previous Ovcon pills had. The trial months went well (I stopped menstruating almost immediately), so we decided to put in the implant. I never had very heavy periods or cramping, so maybe I've just been very lucky - but doing a trial with pills before putting in a three-year implant seemed and seems like a reasonable strategy.
Birth Control	19-24 Female  on Treatment for 1 to less than 2 years (Patient) 	5	4	1	Female	19-24	6/3/2009 10:30:32 AM	I'm almost 21 and last year I had the implanon implanted in June. Come August I had spotting that lasted til the end of September. Although it was so light all I needed was a panty liner I still bled for almost 2 months. Its effective in being a birth control. However, come February I began spotting again. This time around it was a little heavier and needed use of tampons. It is now June and I just stopped spotting. I gained weight in the last two months and the bleeding was affecting my sex life. I also had to get multiple tests ran to see why I was bleeding. Come to find out the lining of my cervix was roughly 2mm a normal womans lining is between 6.5-7mm. I was premenapausal at 20. I don't reccommend this birth control especially for women under the age of 20.
Birth Control	NeverAgain, 25-34 Female  on Treatment for 1 to 6 months (Patient) 	4	4	1	Female	25-34	5/27/2009 4:03:41 PM	I'm a 25yr old healthy(not overweight) African American woman. I've had the implanon for about 3months and I have to say I hate it!! I love the fact that I don't have to take a pill everyday but the irregular bleeding is just too much. I got my period 2 weeks after inserting the implanon and it lasted for over 3weeks!!! My doctor had to give me a nuva ring just to stop the bleeding and I was still spotting! Now my period is back on and it shows no signs of stopping again. Yes it's a great birth control b/c I'm always bleeding I can never have sex!! I just made an appointment to get it removed tomorrow!!!
Birth Control	samanthao2006@hotmail.com, 19-24 Female  on Treatment for 1 to 6 months (Patient) 	5	5	4	Female	19-24	5/26/2009 8:12:17 AM	I've only had the implanon for about a month.. But before I had it put in, my Dr. pretty much told me no complaining before the 6 month mark because the side effects and spotting are probably high. I've spotted this whole month &amp;had cramps worse than any other period..(Midol is my new best friend) but compared to birth control pills (which I can't remember to take) or Mirena (which they HAVE to put inside you while youre on your period) I think I made the best decision for me. I had my son just 4 months ago, &amp;I'm happy that I'm preventing pregnancy for 3 yrs, its the perfect amount of time to reconsider another baby.That pain is still fresh in my mind, so the side effects of the Implanon are bearable. Plus, I knew what I was getting into. I felt like I had mood swings from birth control pills, anything that puts hormones into your body can affect you, so its not like this is a shock. I definetly insist on reading the entire pamphlet that they have at the dr.'s office. I havent had it very long to make an &quot;experienced&quot; review, but overall I'm happy with it.
Birth Control	ALong, 13-18 Female  on Treatment for 1 to less than 2 years (Patient) 	5	5	3	Female	13-18	5/25/2009 11:16:19 PM	I got this in Mar 08. The first week was horrible. Expect to be very moody. For the first 3 months there was no period. And I hope you don't plan to take a home pregnacy test. You'll show positive. You have to get blood tested. Now I have alot of spotting. VERY low sex drive. And cramps seem to be worse before an actual period.
Birth Control	19-24 Female  on Treatment for 6 months to less than 1 year (Patient) 	5	1	3	Female	19-24	5/19/2009 12:04:03 AM	I got the implant about 8 months ago and I spotted for 6 months straight, it has just recently stopped.  I also had a decreased sex drive for the first 6 months, this has recently changed as well.  However, now I have horrible breast tenderness, any little nudge kills me!  The implant is very effective, but I'm getting it out tomorrow, not worth it.
Birth Control	19-24 Female  on Treatment for 1 to 6 months (Patient) 	3	1	1	Female	19-24	5/17/2009 5:43:15 PM	the symtoms dont ahppen all at once they came out over a period of 4 months. i had one period and now i only have the period with out the bleeding. i dont think that you should take this form of birth control. my hair is falling out and i get headaches everyday. i had 11 out of the 16 symptoms.
Birth Control	candice_draper@yahoo.com, 19-24 Female  on Treatment for 1 to 6 months (Patient) 	5	1	1	Female	19-24	5/14/2009 10:15:13 PM	I have been on implanon for about 5 months.I have crazy mood swings,ACNE ,depression,restless,exhaustion,crying easily,hair incresing.I HATE this and would not recomend anyone getting on it at all.This is terrible form of birth control!
Birth Control	25-34 Female  on Treatment for 1 to 6 months (Patient) 	5	5	3	Female	25-34	5/6/2009 2:13:51 PM	have been on implanon since feb 2009.  At first loved it!  But I have been &quot;spotting&quot; consistantly for over a month now.  Very inconvienient.  Hoping it will stop soon, plan on giving it a few more months before talking about removal. 
Birth Control	unsatisfiedwithimplanon, 19-24 Female  on Treatment for 1 to less than 2 years (Patient) 	5	5	1	Female	19-24	4/30/2009 1:06:51 PM	I am a 23 year old, native american/caucasian woman and have been on this since Jan. 08. The first 2-3 months were great; no spotting, no abnormal periods, no side effects at all. However, after that I started spotting every single day for about 8 months straight. It lightened up for a few weeks, but now I just have really long periods or a period every two weeks. Worse than that, I have noticed a HUGE unexplained change in my moods; I cry easily, I get angry over the tiniest things, I snap at my husband for nothing and afterwards I sit and can't figure out why I am so mad over practically nothing, because I have a wonderful and loving husband and I feel so lucky to have him. I find myself feeling irritated often, so much so that it causes headaches. I also feel anxious a lot. Before this, I never had any sort of mood problem and I've always been a positive and optimistic person and I still have the same type of outlook, but out of nowhere, my mood shifts, leaving me wondering why I feel so upset. Yesterday I even went to a pharmacy to see if I could find a mood enhancing supplement because I have been so puzzled by my sudden change in moods, but now that I have read all of these reviews, I think I have figured it out.The ease of use and effectiveness of Implanon have been great, but the side effects SUCK big time! (yes, that's the technical term for it, haha) I don't think I can recommend this to anybody who wants to keep their sanity.
Birth Control	mommafrye, 25-34 Female  on Treatment for 2 to less than 5 years (Patient) 	5	5	5	Female	25-34	4/27/2009 5:01:06 PM	I personally love this product! I have been on it since June 2007. I recommend it for people who have a crazy schedule and don't remember to take the pill every day at the same time. I have my card that reminds me when I need to have it replaced. It is Great! I did not have a period the first 6 months I was on it. Then I went back to once a month but the perk is I will only spot for a day maybe 2 and I am done until the next month! yeah! I like that I don't have to worry about it.
Other	 Female  (Patient) 	5	5	4	Female		4/24/2009 10:25:58 AM	ive been on implanon for about 6 months and i really like it. im a little bit more moody, but its something i can handle. i get my period RARELY (which is great) and my sex drive has actually increased! really no physical problems at all. i love it.
Birth Control	35-44 Female  on Treatment for 6 months to less than 1 year (Patient) 	5	5	2	Female	35-44	4/19/2009 12:40:23 PM	I started this drug in July 2008. I spotted for one whole month, since then I have not had a period. I began taking sertaline &amp; hydroxyzine because I was crying so easily and very anxious that people did not like to be around me. since Ive taken the anxiety and depression pills I feel better. Then I noticed i gained ten pounds in weight in one month. I usually maintain a normal weight with diet and excercise. Im still doing everything as usual but Im now over 200 lbs and im 5'6&quot;. My back aches and I feel very heavy. I never had problems with acne and now my face is red all the time. I will take this out at my next doctor's visit. I bet I will not need that depression/anxiety pill anymore thereafter. I will go back to using the rythm method when I get implanon taken out. 
Birth Control	princessnay, 19-24 Female  on Treatment for less than 1 month (Patient) 	5	5	5	Female	19-24	4/10/2009 1:06:10 PM	Well I got it in on 03/30/09 I was scared aty first and thought about all the side effects and then I thought...All birth control has the SAME side effects...I like the implant...The only thing I didnt like was I had a longer period the first time in 6 months and I didnt like the nasty bruise that I got but thats because I have senitive skin..I would suggest this if you cant remember to take the pill everyday...You are safe for three years...My friend got ther 5 year IUD and she told me how they insert it and it seems VERY painful compared to the implant...And they say you are going to scare...You only have like a little tiny pin mark...Im going to continue this birth control...
