Birth Control	Rae Wiechman, 19-24 Female  on Treatment for 1 to less than 2 years (Patient) 	5	5	1	Female	19-24	7/13/2010 2:24:43 AM	I got the Implanon implant twice, once before I had my son; not realizing I was pregnant and then again after I had my son.  My Doctor at the time said that it was my best option because I have severe migraines, and  I was very excited that I didn't have to worry about remembering to take a pill every day and that I was set with BC for 3 years.  The implant process was very smooth, and so was the removal, and it appears to be affective.  But after that the satisfaction is gone.   My migraines have only continued to worsen, along with being very tired and lacking energy 24/7, high B/P, Raised heart rate, no sex drive, massive mood swings, severe depression, ternderness of the breasts, nausea, and stomach pain.  Basically to sum it up I feel like all the time, I dont want to move or do anything.  I have spent 1000s of $s going to the Dr. having numerous tests done checking for Thyroid disorders, Adrenal Disorders, and even brain tumors because the medications I was being given for all the health issues I was having werent working, and no cause could be determind.  Unfortunately my Dr. didnt know a whole lot about the implant when I started seeing him so it was far from our thoughts until a co-worker of mine told me about several of her friends who had been going through the same thing and were on implanon and that after having it removed they started feeling better.    Now I am going to have mine removed and looking forward to hopefully feeling better soon.  As for the effectiveness of this product.....take it with a grain of salt, I say its affective; but then it has killed my sex drive, so there hasnt been much of a chance in the past year in a half to test it.  I wouldnt recommend this product to anyone, unless they have it....then I would recommend they get it removed. 
Birth Control	i3lueyz33, 25-34 Female  on Treatment for 2 to less than 5 years (Patient) 	5	5	1	Female	25-34	7/10/2010 3:42:46 AM	First, I have to say that those reviewing this product that have only had it for a few months should just wait on reviewing it. It was great for me for about the first year (minus the irregular periods, those drove me nuts). I got it implanted Dec 2007, and once I hit the 2 year mark, it just decided to give me almost every side effect in the book!- light headed, dizzy, anxiety, depression, mood swings, even worse periods, weight gain.. it's unreal. I have constant conflicts with myself as to why I'm so angry all the time and how the smallest thing will set me off. I am totally withdrawn, tired all the time. This has been going on for about 6 months now, and I have an appt to get it taken out next week. I can't wait to be myself again.. to be HAPPY! I used to have the Depo shot and I had zero issues with it, it worked perfectly for me. But for some reason, this Implanon is just not agreeing with me. Anyone who is thinking of getting this done, I have read a lot and have my own experience, and it seems like it's hit and miss.. you'll either be 100% happy or 100% miserable with it. Like others have said, just do your research and consider carefully! 
Birth Control	Courtney, 25-34 Female  on Treatment for 1 to 6 months (Patient) 	5	5	1	Female	25-34	7/5/2010 3:30:17 PM	I had this inserted about two months ago after my GYN suggested I give it a try. I had been on Depo for over 4 years and she thought this would provide the same effectiveness without having to remember to go in for another shot. I am very frustrated with the weight gain! Since the inplant, I have gained 12 pounds. I have also noticed an increased number of headaches that don't seem to go away very easily. Depo had killed my sex drive, and Implanon seems to maintain that feeling. I am in the military and plan to keep it in for about three more months, so I can finish up some important training without having to worry about a period. But as soon as I get a chance it's coming out! I have been fortunate to not have a period or any other bleeding problems, but my GYN told me this would likely be the situation due to my many years using Depo prior to Implanon. The GYN sold me hook, line, and sinker on this product. Knowing what I know now, I'd never suggest this to any of my friends. The weight gain, lack of sex drive, and headaches outweigh the few benefits. 
Birth Control	25-34 Female  on Treatment for less than 1 month (Patient) 	5	5	5	Female	25-34	6/27/2010 12:25:18 PM	I had Implanon put in 9 days ago &amp; so far, I like it. I really got sick the day i was gonna get it BEFORE i had it put in bc of reading all these stinkin bad reviews so goes to show u cant let reviews help u decide. Different birth controls works diff on diff. people. ALL birth controls say they have side effects. All the one i have used have not affected me. I have used the pill &amp; Nuvaring(liked the ring but payin $65 a mth for it for last 2 yrs) so me &amp; the hubby had to find somethin less costly to last a few yrs til we decide to have another child. my insurance pay ALL of it..but so far i do like it. Had it put in on a Friday &amp; my period stopped 2 days later on Sunday &amp; nothin started yet like i thought it might but my Dr said irregular bledding was her worse complaint but said prob should just be for a couple of months then should regulate. But i have had NO bad side effects &amp; have lost little over a pound already so hopefully ill be one of the lucky ones that i wont have side effects with it b4 i have it removed in hopefully 2 yrs. So i say if u wanna try it, be my guest..u may just like it like i do &amp; it did NOT hurt to have put in, I didnt feel a thing but a sting from needle to numb my arm &amp; it was just for a split second. no soreness in my arm or nothin from it. So if u get it, I hope u have great luck with it like i have thus far.
Birth Control	Meagan, 19-24 Female  on Treatment for 1 to less than 2 years (Patient) 	5	5	3	Female	19-24	6/23/2010 6:51:39 PM	I've had this beastfor 1 yr 1/2. I had it put in when I had my son. It was great at first. I had no period and my skin was fine. Recently I feel like crap all the time. My period cant decide what it wants to do come or go. be light or heavy.the cramps are rediculous!! The mood swings are destroying my marriage!I haven't gotten pregnant so it has served its purpose. But MY GOD I wish I could remove it...but I'm getting my $900 worth!! thats right $900!!!! Dig deep and prepoare to not stop bleeding! 
Birth Control	19-24 Female  on Treatment for 1 to less than 2 years (Patient) 	3	5	1	Female	19-24	6/22/2010 9:14:17 PM	i got this stick put in a few months after i had my son and it is absolutley horrible. i am going tommorow to have it removed. i have had implanon for nearly 2 years and have had irregular heavy and long periods that last for months. i have gained nearly 30 lbs and have been severly depressed and moody. can't wait to get this out.
Birth Control	25-34 Female  on Treatment for less than 1 month (Patient) 	5	5	3	Female	25-34	6/22/2010 4:39:24 PM	I have only had the implant for a week so I cannot attest to the effectiveness or possible side effects (none so far,though).  My review is on the cost.  IF YOU ARE ON A HIGH-DEDUCTIBLE HEALTH PLAN, I RECOMMEND YOU STOP AND SERIOUSLY WEIGH THE COST!!  You are looking at *at least* $700 out-of-pocket if you have not met your annual deductible.  And that is based on your provider's contracted rate with your insurance carrier so it could be even higher than that.  The bill you will receive is not for the faint of heart!
Birth Control	veryunsatisfied, 19-24 Female  on Treatment for less than 1 month (Patient) 	1	5	1	Female	19-24	6/18/2010 10:23:57 AM	I got implanon put in 9 days ago. the day after I started having constant, bad migraine headaches, pain in my left abdomen, insomnia and high fever (101.2 - 103.0). In the morning I can barely get out of bed because the migraine, dizziness and muscle aches are so bad. not to mention the constant back pain and the amount of sweat that has been pouring off my body over the last 9 day. Im calling my doctors office as soon as they open today and telling them if they cant get me an appointment to have it removed today then I am taking it out myself. I dont know if these are normal side effects but if they are i feel horrible for every woman that has to deal with them. I feel like death is knocking on my door. I would go back to the patch but it gives me bad craps all the time. not only when im menstruating. I dont know what else I am going to do. 
Birth Control	19-24 Female  on Treatment for 1 to 6 months (Patient) 	5	5	3	Female	19-24	6/8/2010 10:42:15 AM	The implanon was inserted about 2 1/2 months ago and I was very excited about it. But after 2 days I got my period and have had it ever since. And it's been very heavy. My body gets irritated if I use either tampons or pads too long at one time so I switch back and forth. If my period would go away, I think I would love it!
Birth Control	emmas_mommy08, 19-24 Female  on Treatment for 1 to less than 2 years (Patient) 	5	5	3	Female	19-24	6/7/2010 3:32:25 AM	I got the Implanon after the birth of my daughter in 2008. It was ok at first. Then the bleeding started. Ill be on for 3 weeks off for a few days then back on for 2-3 more weeks. I have a period twice a month now and I never no when it will start or stop. I have terrible mood swings and really bad headaches. I get cramps right before I start but usually dont have anymore. I did not gain any weight, thank god, I lost like 25lbs. I break out all the time and I have really sore breasts. I will most likely keep it in for the full three years, unless I find something better, but not having to worry about it is a plus. Obvioulsy everbody is different so you will never know how it will effect you unless you try it.
Birth Control	Lacy, 19-24 Female  on Treatment for 1 to 6 months (Patient) 	5	4	2	Female	19-24	6/4/2010 11:29:54 PM	I have had it for about 4 months. I got it a month after i had my daughter. I have had very irregular periods multiple ones in one month when it used to be like clockwork. I also have gained probably 30lbs and have had terrible mood swings, fits of rage, just screaming and crying for no reason and always being angry. A new development that just recently in the last 2 weeks under the skin at the injection site is itching really bad, bad enough i want to rip it out to stop from scratching my arm raw. I have been satisfied with the fact that i have not gotten pregnant while on it. I have however been thinking about getting it removed because of the extreme discomfort and irritation.
Birth Control	brittanynicole, 19-24 Female  on Treatment for 6 months to less than 1 year (Patient) 	4	5	5	Female	19-24	6/2/2010 4:37:43 PM	I am on my 7th month with the implanon.  So far, I love it.  I almost wonder why there are so negative reviews. Although I haven't had a period for 3 months (I don't mind).  I haven't experienced any unusual weight gain. As long as you stay active and don't sit down with a bag of potato chips and watch the Office every night you should be ok.  However, I have experienced typical breakouts on my face around the time of the month when my period usually starts (if i have one).  I am much more emotional than I was before but that is about it.  I would recommend this product to anyone who is looking for a semi-permanent contraceptive. THANK YOU IMPLANON! 
Birth Control	Mommy08, 19-24 Female  on Treatment for 2 to less than 5 years (Patient) 	5	5	4	Female	19-24	5/24/2010 10:27:59 AM	I have had no problems!No irregular bleeding.I had head aches before so it was no suprise to me.My sex drive is low.
Birth Control	Ricasuart, 25-34 Female  on Treatment for 1 to less than 2 years (Patient) 	5	5	3	Female	25-34	6/1/2010 2:55:22 PM	I have used implanon for a year and a half. I like it because i dont have to remember to take anything. However my periods usually last from 2-5 weeks, and i hate that. I plan to take it out instead of waiting my 3 years because this is unacceptable to me. My periods are never regular anymore, ill go months without one, then get one for 5 weeks. its horrible. I dont cramp as badly as i did when i wasnt on it, and i rarely get moody. other than the periods being screwed up its an ideal birth control.
Birth Control	19-24 Female  on Treatment for 1 to less than 2 years (Patient) 	3	5	1	Female	19-24	5/25/2010 10:28:28 PM	I had mine put in just over a year ago after I had my daughter, and absolutley hate it. I have not stopped bleeding since I gave birth to my daughter. I feel like I am constently bloated. I have gained some weight that is extremely hard to get off and keep of. I have never had achne until I had the implanon put in. My sex drive has been almost non existant. My OB says to wait it out and see what happens. Insurance will not cover another form for another year so I am screwed..It is not worth it not at all! I would much rather buy box's of condoms for my husband (when I am actually in the mood) than be buying panty liners and tampons all the time! 
Birth Control	19-24 Female  on Treatment for 2 to less than 5 years (Patient) 	5	5	4	Female	19-24	5/25/2010 8:01:09 PM	
Birth Control	jmm0711, 19-24 Female  on Treatment for 6 months to less than 1 year (Patient) 	5	5	5	Female	19-24	5/20/2010 3:36:02 PM	First off please realize that different birth controls work for different women. As for me Implanon has been great. I had implanon implanted 10/2009. Just as I was told by my OB/GYN the first three months I spotted. At first I gained about 15 pounds but this is because ALL birth control trick your body into think you are pregnant. This weight gain is easily controlled by WATCHING YOUR PORTIONS AND WHAT YOU ARE EATING. Since I have stopped spotting, I haven't had a period. Which is GREAT! My mood swings have actually stabilized since I have been on Implanon. Before you make a decision talk to your OB/GYN about ALL of your options! It works great for me but may not for you. It really depends on your bodies normal about of hormones and how it reacts to those hormones. 
Birth Control	Tizzle, 25-34 Female  on Treatment for 6 months to less than 1 year (Patient) 	5	5	1	Female	25-34	5/18/2010 4:23:24 PM	I have had the Implanon since Nov09. I was advised the first 6mos may be crazy. Bcz the birth control had to settle. 1st month was great, period was one day long. Then month 2 period was 15 days long, Month 3, period actually lasted through month 4. MOnth 6 now and I have no period, which I must say is nice, However.... I am having fainting spells since getting the Implanon inserted. This seems odd. I have always had them, but havent had one since 07. Three days after the insert. BOOM, I blackout at work. My doctor tells me to live with it. One gyn tells me remove the Implanon(this gyn doesnt believe in this method of bc. The gyn who put the BC in says its not the BC, leave it in. Anyone else having fainting spells?
Birth Control	Jessmalt, 25-34 Female  on Treatment for 2 to less than 5 years (Patient) 	5	5	1	Female	25-34	5/14/2010 1:31:22 AM	I got the Implanon inserted in September of 07. I have had it now for about 2 years I really didnt have any problems that I noticed at first. Never had a period or anything, but I had gained like 50 pounds since I have been on this and I have been trying everything I could do to get the weight off and I cant! Also severe headaches all the time, so bad sometimes I get sick, also very moody. I thought maybe my body had changed after I had my son so I blamed it on that. I am seeing the truth now its not just me. It works great for not getting pregnant and everything, but can you put up with all the side effects that comes with it?
Birth Control	19-24 Female  on Treatment for 1 to 6 months (Patient) 	1	5	1	Female	19-24	5/12/2010 5:03:16 PM	I have had Implanon for 3 months now and I am getting it removed in a few days.  My friend suggested it to me because she has had great results with it.  I did not have good results. I have had constant heavy bleeding, headaches, horrible acne, no sex drive, mood swings, and 20 pounds of weight gain (in only 3 months).  I would have been willing to give it more time but the weight gain is out of control and ruining my life!  I have never had weight gain with any other forms of birth control.   
Birth Control	19-24 Female  on Treatment for 1 to less than 2 years (Patient) 	4	5	3	Female	19-24	5/9/2010 12:19:47 PM	I got the implanon inserted in October 2008, 6 months after having my son. My experience hasn't been the best with this drug.(I just got it removed 2 days ago)I have had ALOT of spotting, headaches, mood swings, and a very low sex drive but I think I could have no problem dealing with those side effects if it wasn't for the weight gain. I've gained 20pounds in one year and a half. After actually stepping on the scale and seeing that I increase I made a call and scheduled the removal. It's $125 but well worth it to get this out of my system. Implanon did not work for me but it works different on everyone.
Birth Control	25-34 Female  on Treatment for less than 1 month (Patient) 	5	3	2	Female	25-34	5/8/2010 7:24:08 PM	I have been on this for 3 days now and I am suffering horrible side effects.  I am extremely nauseous, gassy, tired, and have had a headache everyday.  I'm going to stick it out and see what happens next, or if the side effects disepate.  But, I guess it's worth it in the long run.  Just be ready to &quot;feel pregnant&quot;.
Birth Control	Mrs. Thomas, 25-34 Female  on Treatment for 1 to less than 2 years (Patient) 	5	4	1	Female	25-34	5/8/2010 4:01:09 AM	I had my implant for almost a year and during that time I suffered from severe headaches everyday just about the whole time. Also my first period which started the day I got the implant didn't end for about 2 months. Then later evened out to 14 days on 14 days off which sucked and I had no sex drive for the days off. I was in the hospital several times, given pill after pill and test after test they never could prove why I was having so many problems but they did suggest to remove the implant. The only good thing I can say is I didn't get pregnant but they had trouble removing it so now I have a dime sized hole in my arm and probably will have a permanent scar from the stiches. I wouldn't recommend this form of birth control to anyone. Sorry ladies.
Birth Control	25-34 Female  on Treatment for 1 to 6 months (Patient) 	2	5	3	Female	25-34	5/5/2010 9:35:59 PM	I am 31 and have had Implanon inserted since 2/19/10.  I'm ususally physically active and have a great sex drive.  Since I have been on it, I have had zero sex drive, have not exercised and in turn have gained a little weight.  I do like the fact that it's inserted into my arm and the light or no periods, but not worth the negative emotional side effects and the lack of interest in sex.  Will look for yet again another method of birth control.
Birth Control	crystal, 25-34 Female  on Treatment for 2 to less than 5 years (Patient) 	5	5	1	Female	25-34	5/5/2010 11:14:51 AM	I had this implant for the whole three yrs minus 10 days. I hated that I was on my period pretty much the entire three yrs painful sex, abdominal pain, no want for sex it was terrible I did not get pregnant though so it does work for that. I was always bloated it sucked. But I see there is some users who have had no prob i just wish i was one of them.
Birth Control	Victoria78, 25-34 Female  on Treatment for less than 1 month (Patient) 	3	2	1	Female	25-34	4/29/2010 1:43:43 PM	I have been on Implanon since 04/07/2010. I am currently thinking of having it removed due to headaches, mood swings, decreased sex drive and spotting. Overall I would deal with the side effects but the mood swings and decreased sex drive are terrible. I am going to be speaking with my doctor this week. It might work for others but unfortunately it does not work for me...
Birth Control	 Female  (Patient) 	1	1	1	Female		4/25/2010 7:49:31 PM	I've had implanon for about 2 months. I thought it would be a good long term birthcontrol. WRONG. Since I've had this put in I've been to the hospital 3 times with severe pain in my abdominal, had 2 MRIs and everything checked out perfectly fine (they thought it was my appendix) I'm getting it taken out APSP.I gained ten pounds, my skin &amp; emotions also went crazy. PLEASE DON'T EVER GET THISS LADIES I would rather be pregnant right now, then at least docotors would be able to give me answers.. very scary
Birth Control	19-24 Female  on Treatment for 2 to less than 5 years (Patient) 	5	5	5	Female	19-24	4/12/2010 3:17:44 AM	
Birth Control	Twitter--Angelikeways, 19-24 Female  on Treatment for 6 months to less than 1 year (Patient) 	5	5	3	Female	19-24	4/9/2010 9:27:04 PM	I've been on Implanon for a year now. The 1st couple of months I was on &amp; off my period, but it gradually became lighter, and now it only seems like I get my period every two months or so. I Love it now. Even tho it has some getting use to. Now my husband &amp; I dont have to use a condom, and I dont get that worried feeling after sex. One thing I didnt like.. my ache went crazy! but with a little more skin care, and overall taking care of my body the right way it's awesome.. Weight wise it was ok.. I did gain weight, &amp; it was hard to loose, but now (Joining the Air Force soon) tht my body is use to it, its easier (lost 10 lbs) I guess this BC works depending on your body.. Every woman is different. I would recommend this to anyone especially for those who are &quot;irrsponseble&quot; about taking the pill.. lol. when I have my period they are VERY light and last about 2 weeks. My mood swing arent tht badd prior, and the cramping isnt niether.. 8 1/2 out of a 10 :)
Birth Control	13-18 Female  on Treatment for 1 to 6 months (Patient) 	5	5	3	Female	13-18	4/8/2010 5:05:04 AM	I am very thankful to not have any of the emotional problems like so many of you, and overall Implanon works for me. The only downside is the prolonged periods; I have probably had maybe 10 days with no period/spotting since I got it put in, (three months ago), but hopefully this will become more regular. I have also had severe menstrual cramping but did so before i got it too. Overall i would approve, i just wish they could find a way to make periods more regular!
Birth Control	marissa, 19-24 Female  on Treatment for 6 months to less than 1 year (Patient) 	5	5	2	Female	19-24	4/7/2010 4:55:12 PM	I've been on implanon for about a year now and everything was going good until this month, I've been on my period for 4wks now and I have these bad stomach pains, I feel weak and my mood swings are so crazy right now..
Birth Control	Pamela, 25-34 Female  on Treatment for 2 to less than 5 years (Patient) 	5	5	5	Female	25-34	4/5/2010 8:27:38 PM	I had the Implanon inserted September 2007 after being on depo for 2 years.  my doctor told me that it was a great option for me since I have a fear of needles.  It was quick and easy to have it inserted though I was bruised for about a week at the injection site.  I have not had any bleeding since it was inserted, not even spotting.  After the first few days, I couldnt even feel it unless I was trying to find it.  I am having it removed a week from tomorrow to try to get pregnant.  When I am done having children, I will have it inserted again.
Birth Control	steph, 35-44 Female  on Treatment for 2 to less than 5 years (Patient) 	5	5	1	Female	35-44	3/29/2010 10:11:00 PM	I have been on this since December of 2007 (was on Depo for 7 years prior loved it no periods, a little weight gain) I am so disappointed in this but am glad to know I am not crazy. I have periods for months at a time and have to take pills to stop the bleeding. Am very moody and get upset every time anybody asks me anything. I can't even stand myself. I get this thing out in December I have gone to the Dr a few times to have it removed and always get talked out of it. I have headaches every day all day, I can gain 5 pounds in a day and always feel like a water balloon. I eat healthy and drink lots of water this is ridiculous.   
Birth Control	25-34 Female  on Treatment for 1 to 6 months (Patient) 	4	4	1	Female	25-34	3/29/2010 11:23:53 AM	I had the Implanon put in on Feb, 25, 2010 and will be having it removed in the morning. I read the reviews about this birthcontrol method and was a little scared, but was insured by my doctor that the most complaints she had was the irregular bleeding. That was not it for me. I have bleed since the day it was put in. I also have severe head aches and mood swings. I cry about the wildest things. I have never been the type to have mood swings this bad or even cry about nothing. I guess it is just different for everyone, but this was not for me!!
Birth Control	Amanda, 25-34 Female  on Treatment for 2 to less than 5 years (Patient) 	1	1	1	Female	25-34	3/27/2010 11:15:56 PM	I had IMPLANON put in about 6 weeks after my daughter was born. About three months later i received my period. For two years i had it almost constant. While this was going on i had symptoms of morning sickness, extreme anxiety, major mood swings, weight loss, severe dry skin, hair was falling out. I was tested for an overactive thyroid 3 times. Two years of this went by. I had it removed lost my mucous plug and now have severe bladder pain and uterus pain with every period. This lasts 3 weeks of every month. Now am getting a hysterectomy. Thanks IMPANON! Or should i thank my doctor for not helping me with the facts of this terrible drug! If it works for you im happy. Just know when to get it out.
