Birth Control	hotkixx, 25-34 Female  on Treatment for 6 months to less than 1 year (Patient) 	4	3	1	Female	25-34	6/11/2011 12:24:26 AM	I had Implanon injected about 8 months ago. My periods were awful at first but did get better. My complaints started a few months after i got it, I find that when looking at the side effects I have ALL of them. This includes some of the more serious ones. When I can afford my co-pay its coming out, wether I have to rip it out or not..
Birth Control	Beth, 25-34 Female  on Treatment for 2 to less than 5 years (Patient) 	5	5	2	Female	25-34	5/29/2011 1:19:19 PM	I had Implanon inserted in January 2009 and had it removed in March of 2011. I had no problems until I had the Lap Band surgery in October 2007. After losing about 50 lbs, I started bleeding constantly. Prior to the Lap Band surgery, I had some light spotting for about 14 days every 3-6 months.I will never use this again for one reason, though. It took my OBGYN over an hour of digging and cutting to remove the Implanon from my arm. It was very painful, and there were many complications that followed. I am finally healed (with a really dark scar on my arm that's about an inch long and 1/4 inch thick), and am not planning on using any birth control in the near future.
Birth Control	katkm, 19-24 Female  on Treatment for 2 to less than 5 years (Patient) 	5	5	5	Female	19-24	5/23/2011 1:31:50 PM	I love the implanon. I decided I wanted to try out a birth-control that would last and was worth it. I had it inserted in June 2008, So I'm just a month away to have it removed and have another one inserted. I haven't had any problems with it. No heavy bleeding like others, I can honestly say that I have had my period 5 times within these 3 years of use and each period would last about 7-8 days which that is not a problem to me. At the ends of this 3 year cycle  
Birth Control	PreciousA,  Female  on Treatment for 2 to less than 5 years (Patient) 	4	5	1	Female		5/23/2011 2:35:02 AM	Ok i have been on the Implanon for going on 3 years, and let me tell you it does work but my periods are nuts! I will have one for 3 months and then it will skip like a couple weeks ,then im back on it for another 2 to 3 months. Yeah i havent got pregnant because there is never anytime to have sex what so ever. My opinion I want it out im so tired of bleeding forever. Because then I loose alot of blood then I get really tired alot. Thats the only down fall for this thing. 
Other	J, 25-34 Female  on Treatment for 6 months to less than 1 year (Patient) 	3	5	2	Female	25-34	5/22/2011 9:07:45 AM	I have had the implant in for about 6 months now and am about to get it removed. Like most girls I have been reading about I have been bleeding for 90% of those 6 months. I wish I would have read all of these comments before I had it placed. The first month I loved it. I had no bleeding or spotting made me feel great. Then it all went down hill from there. I have now been spotting for 2 months streight. Think twice before you get this placed. Try everything first I would never get it again.
Birth Control	dontuseimplanon, 25-34 Female  on Treatment for 2 to less than 5 years (Patient) 	5	5	1	Female	25-34	5/11/2011 10:58:58 PM	DO NOT GET IMPLANON PLEASSSSSSSSSSE!!! I have been on this birth control for 3 years it is now time for me to have it removed. Although I didnt get pregnant these 3 years, I did have a lot of uncomfortable days. I maybe had 2 days out of each month that I wouldn't bleed. Then I remember one time out of the 3 years that I didnt bleed for 2-3 days. Please make sure that if you do get this birth contol that you have insurance because when it's time to have it removed, you will have to have insurance to do so. Also, I found myself having crazzzzzzy mood swings. PLEASE DO NOT GET IMPLANON PLEASSSSSSSSSE!!!
Birth Control	youngwoman, 25-34 Female  on Treatment for 6 months to less than 1 year (Patient) 	5	5	2	Female	25-34	5/11/2011 11:08:04 AM	Ive had Implanon for almost a year now, and its had its good and bad points.  First, in terms of pregnancy prevention, it has excelled (without a condom).  But for the first 6 months, I had TWO DAYS without some form of bleeding (I am NOT exaggerating).  The only good thing about that time was that when it did come time for my &quot;normal period&quot;, there were zero side effects - no cramps, no mood swings, nothing.  During the next 5 months, I could sometimes go a week without bleeding, maybe 1-2 days here and there....but for the most part, I bled almost every day.  My private parts grew sensitive to pads from having one on every day, and so now I can only wear a pad one day before bad things start happening.  Now, I have to alternate between a pad and a tampon every other day.  I did experience a small amount of weight gain and moodiness, but nothing else major.  It did make my periods go away in the sense that I couldnt tell one bleeding day from the next (i.e. no typical symptoms of a period).  My boyfriend hates it because the bleeding really turns him off when we get physical (even though it allows him the greatest satisfaction).  Overall, it has definitely done its job as pregnancy prevention, but the nearly-constant bleeding is really making things go downhill, so I am having it removed today.  
Birth Control	dfitz, 19-24 Female  on Treatment for 1 to less than 2 years (Patient) 	5	5	5	Female	19-24	4/30/2011 9:23:51 PM	I have been on implanon for 19 months, and i love it. I have experienced some spotting, unpredictable periods, and no periods at all. I definitely recommend it to any woman.
Birth Control	buchanme, 25-34 Female  on Treatment for 6 months to less than 1 year (Patient) 	4	4	2	Female	25-34	4/23/2011 7:04:12 PM	I had Implanon implanted in Oct 2010, after using Nuvaring for 2 years.  At first, I became overly moody to the point that I was placed on an antidepressant.  From the beginning, I had spotting; however, in the recent months it has gotten worse.  I now have a period for 3 weeks, then a week off ( a real pain when trying to schedule a pap smear).   My doctor has offered to put me on estrogen in order to combat the bleeding; however, being on the double dose of hormones (implanon and the antidepressant), I have decided to live with the spotting. 
Birth Control	35-44 Female  on Treatment for 6 months to less than 1 year (Patient) 	5	3	1	Female	35-44	4/14/2011 9:38:29 PM	Hate it hate it hate it. I'm bleeding more often than not, have gained at least 15 lbs and my skin looks like s**t. I am stuck with this piece of crap in my arm because I currently have no health insurance- good luck convincing a midwife at PP to remove one of these. I thought this would be cheaper than the pill because of not having insurance, but the money I'm saving on the pill I'm spending on tampons. I have always had heavy irregular periods with bad cramping, and I never thought they could possibly be worse - until now.
Birth Control	Gianna_S_Mommy, 19-24 Female  on Treatment for 1 to 6 months (Patient) 	4	5	3	Female	19-24	4/11/2011 7:35:51 PM	I've been using this for about 3 months now and I'm pretty pleased with it. I had 2 periods but the last one I had one spot of blood and a little bit of cramping. I used to have very painful periods so this is great for me. So far my ache has gotten better. I might be gaining some weight but I don't really keep track of it. This site really eased my fears cause not having a regular period is a little scary. But so thankful that I don't. Plus, no having to use condoms with my husband is wonderful. :) 
Birth Control	Kherron, 25-34 Female  on Treatment for 6 months to less than 1 year (Patient) 	5	5	5	Female	25-34	4/8/2011 3:23:12 PM	I had my Implanon inserted October of 2010. The insertion site was a little sore but nothing to write home about and I can hardly even see the tiny scar now. I had just refilled my 3-month NuvaRing when I had this inserted, so I continued to use the NuvaRing to regulate the &quot;irregular&quot; bleeding (cleared it with my NP first). Had a regular period for the first three months (don't know if this was because I was using NuvaRing too, but doesn't matter to me, was regular either way). Since I stopped using my NuvaRing, I have had NO periods. That's 3 months now and counting. I have gained just a little weight, but it just encourages me to eat right anyway. Little exercise and the right diet and it has melted back off. Mood swings? Can't say I've noticed, my husband hasn't mentioned anything. Headaches? Sure, but I've always been prone to them. I would absolutely recommend this product to anyone!
Birth Control	bubbles, 19-24 Female  on Treatment for 2 to less than 5 years (Patient) 	1	1	1	Female	19-24	4/5/2011 8:43:05 PM	I dont find this birth control method helpful at all i have been on it for 4 months and i have gained almost 80 pounds and also i have deperssion, since i have been using the implanon my depression has gotten alot worse and i dont like the way this birth control works.
Birth Control	kristen k,  Female  on Treatment for 2 to less than 5 years (Patient) 	5	5	4	Female		4/3/2011 5:14:39 PM	I am getting ready to have Implanon taken out since it has been 3 years and I have really enjoyed it.  It's been 100% effective.  I would say I had some spotting and had more regular periods the last couple months but without any major cramping and no weight gain.  My Dr did an ultrasound recently and did find some very small cysts on my uterus but it is unknown whether implanon is the cause or if they have been there.  I would recommend this to anyone who has trouble with taking a pill everyday or is looking for a &quot;long term&quot; bc method!
Birth Control	Shelby, 19-24 Female  on Treatment for 2 to less than 5 years (Patient) 	5	5	5	Female	19-24	4/1/2011 12:49:29 PM	Implanon has been very effective for me, no pregnancies, no periods. I have had it for almost three years now and am about to have my second one in Aug. I would definetley say it is better than the Pill or Depo shot. they both made me gain weight, but the implanon has put me back down to my usual 125.
Birth Control	25-34 Female  on Treatment for 2 to less than 5 years (Patient) 	4	5	3	Female	25-34	3/24/2011 3:52:06 PM	I have been using Implanon for almost 2 years.  It has been effective in the sense that I have not gotten pregnant on this birth control.  However, I constantly bleed after intercourse almost every time.  The bleeding will last from either 2 or 3 days to 2 or 3 weeks(and it is heavy most of the time).  It is really frusterating, and I have been working with a few different doctors reguarding this.  They all have said that they have seen these issues with other patients using the Implanon. I am pretty sure I will have the rod removed soon.  I would rather take a pill daily than be bleeding like this.
Birth Control	na, 19-24 Female  on Treatment for 1 to 6 months (Patient) 	3	5	3	Female	19-24	3/24/2011 2:58:05 PM	bleed alot with have bleed for 9 weeks none stop and off for 2 weeks and bleed for 8 doc cant figure out why.
Birth Control	MoreweightLessSex?, 19-24 Female  on Treatment for 1 to less than 2 years (Patient) 	5	5	2	Female	19-24	3/16/2011 6:19:01 AM	I' ve been on this method for over a year, and before this I was on the depo for about six years. I've gained weight since starting birth control in general, but after getting implanon I am the heaviest I've ever been, and cannot lose the weight. My sex drive is severely low and my self esteem with sex is just as low, which is putting strain on my husband and I. I never really realized implanon might be the cause until recently, and I'm going to look into taking it out. Another thing I feel is important to mention is jaw pain. I've gone to the doctor twice and a dentist once and their only explanation is tmj. I'm not ruling it out, but this pain started relatively at the same time implanon was inserted (left unnoticed) and has gotten extremely worse over the past few months to where I cannot open my mouth that wide to take a bite of food or even yawn. My husband has been suffering with that too, for obvious reasons. About three weeks after insertion I had 2 straight weeks of bleeding, but no period or spotting since. This method is easy and convenient because I cannot remember pills, but I'm starting to evaluate if these seemingly minor side effects are worth it... Increase my weight, decrease wanting sex? No thanks.
Birth Control	35-44 Female  on Treatment for 6 months to less than 1 year (Patient) 	5	3	1	Female	35-44	3/12/2011 4:06:56 PM	I've been on this birth control for 10 months &amp; it has been nightmare. Every time I have sex, I start bleeding again. Not to mention after being on it for 4 months I started to bleed heavily for 4 months straight, then it stopped for a one month; only to start bleeding again for the whole following month. I'm getting this thing outta my arm ASAP, which happens to be only 4 days from now.The most annoying side effect is when ever I have sex, I start bleeding again.It seems only when my partner does NOT ejaculate inside of me, only then I won't start to bleed again. Which is BS!Oh, &amp; when I started bleeding I had the most manic mood swings ever. So much so, that I went to the psych ward to be evaluated. And they increased my anti-depressants &amp; it still didn't help.So if u have acute mental illness, this isn't the drug for you. 
Birth Control		5	5	3			3/11/2011 8:11:08 PM	The implanon in my arm is bent. Since it has been bent I have not had my period. My doctor said that it being bent is ok. I have taken pregnanacy tests which have came back negative. So what is going on?
Birth Control	Rose, 13-18 Female  on Treatment for 1 to less than 2 years (Patient) 	5	5	4	Female	13-18	2/18/2011 8:26:52 PM	Well, I decided to use Implanon because I am not good with remembering to take pills. I have been using it for 1 1/2 yrs. It has been very effective but has side effects that annoy me at times. I get headaches and dizziness at times. My breasts sometimes ache and have gotten a little bigger. I have been moody at times and have problems sleeping. I have always had problems sleeping though. I really dont like that I have been on my cycle on and off for 2 1/2 months. I get off my cycle, I would have sex, and then I would bleed again and it hasnt stopped yet. The only good thing is that I know when it really stops, it should be gone for a couple of months ( I hope so). But the good thing is that it works well against getting pregnant.
Birth Control	25-34 Female  on Treatment for 2 to less than 5 years (Patient) 	5	5	5	Female	25-34	2/17/2011 12:19:15 PM	 U don't have to worry about taking a pill everyday for 3 years but any ways i love it when i got it in it did hurt a little bit and then i was black and blue for for 2 weeks i started to spot and i called the doctor about it they told me that it was normal i said OK and went on with my daily things with a month into having it in my arm i didn't get my period anymore and i was happy i have two kids and i don't need anymore right now well that's what my husbands says anyways i have been happy with having it in my arm i have had it for 2 years and 6 months and after that iv had to go to the doctor in 2011 to have it check because my body wasn't right the doctor said i was fine and that it was normal like the doctor says birth control is different on everyone it may or may not work and i had been a little under stress on getting married and moving to a bigger house so i love it and would tell someone to try it and see for them self's  
Birth Control	kpc08, 19-24 Female  on Treatment for 1 to 6 months (Patient) 	5	4	1	Female	19-24	2/12/2011 3:30:53 AM	This seemed like a great option for me. I'm 20 yrs old. I dont want any kids for a while, I want to wait until me and my boyfriend are married. I had this implanted in October 2010. The first two months were OUTSTANDING! I had a period for like 2 days each month. No cramping. No weight gain. Well fast forward to Jan. 2011, I get my period just like any other normal one, It seems to go away after 3 days, uh NO! It's not Feb 11, 2011. I've been on and off my cycle for over a month. Me &amp; my boyfriend can never have sex because it seems like as soon as we want to, it starts back up. UGH! I wouldnt recommend this to ANYONE. unless you want to be miserable all the time. My sex drive hasn't lowered, I just cant sastify it because of the complications with my cycle. DO NOT GET IMPLANON!!!!
Birth Control	Jess1, 19-24 Female  on Treatment for 6 months to less than 1 year (Patient) 	5	5	1	Female	19-24	1/26/2011 1:43:30 PM	I thought Implanon seemed like the best route of birthcontrol I could take. I'm 22, sexually active, and very fit.  The first 2 months were fantastic, no bleeding an no obligation of remembering to take my birthcontrol.  After the first two months it became unbareable.  I became pretty depressed and extremely angry.  I would suddenly get hit with 'fits of rage'. I would be working alone, minding my own buisness, and suddenly become so angry I would start slamming things around.  It got to the point where drinking became out of question because I would not be able to control my anger.  My family thought I was hiding a traumatic event because of the severe change in my temperment.  I'm in great shape and am proud of my efforts to stay fit and I even began hating my body and self image.  I consulted a doctor and she asked about my form of birthcontrol, I had never thought of that.  I decided to have it removed, even though I didn't think it could be the case.  I was desperate.  A month of so after having it removed I returned to normal.  The hormones were too much for me.  Good luck, but I would recommend this to no one.
Birth Control	35-44 Female  on Treatment for 2 to less than 5 years (Patient) 	5	5	5	Female	35-44	1/26/2011 9:12:05 AM	
Birth Control	dmfb, 19-24 Female  on Treatment for 1 to less than 2 years (Patient) 	5	5	3	Female	19-24	1/14/2011 12:51:26 AM	After being on the depo shot for 3 years prior to the implant, I was used to not having as a normal period. Upon the insertion of the implant, I spotted for a couple of weeks, then my period completely disappeared. The only issues I really have with this drug is that it makes me have a weird smelling discharge, something unlike I've ever experienced. And also, lately the site of the implant has a developing rash that itches. My sex drive seemed fine, but then again, it's hard to recall.
Birth Control	25-34 Female  on Treatment for 2 to less than 5 years (Patient) 	5	5	4	Female	25-34	1/13/2011 2:38:57 PM	After insertion, my period was about a month long. Then it stopped altogether. The only side effects I had was hair loss (which grew back for the most part) and loss of libido. My arm was bruised for about 2 weeks. When I got it put in, I was 1 and 1/2 months postpartem. So, when I lost my baby weight, you could definately see it from under the skin. It left a tiny scar. I haven't had it removed, yet.
Birth Control	swordandbubbles2125, 19-24 Female  on Treatment for 2 to less than 5 years (Patient) 	5	5	2	Female	19-24	1/12/2011 10:57:08 AM	I've been married for 3 years, and I've been on Implanon for over 2 years, and have had an AWFUL time with it!! my periods are insane and horrible, often lasting a month or more, and usually back to back (only a few days in between periods) not to mention the spotting...I've been fighting depression, mood swings, irritability, nervousness...none of which are normal for me.  naturally, I'm a bubbly, happy, sweet person who rarely gets upset. now I tend to get annoyed easily, I get pessimistic and depressed for no reason, am prone to fits of crying for no reason, very irritable with my husband (which has been hard for both of us- luckily he's the most patient and the most understanding man in the world :-) lucky for me) and the mood swings are killer for us both.I'm tired all the time, very little sex drive, which is sooo not fun. I feel worn out no matter how much I sleep or what I do.  I can't take much caffeine, and I try not to eat too much sugar, since I've already gained so much weight from Implanon.I've gained 40 lbs that absolutely will NOT go away, no matter what I do, and I exercise a lot and eat very healthy.  I've had non-stop pregnancy symptoms, for 2+ years!! it's awful...pregnancy symptoms without actually getting a baby...so not what I want.Implanon has completely changed me, physically and mentally, into someone I can't stand, and I regret getting it at all. I'm getting off it soon, God willing.  
Birth Control	25-34 Female  on Treatment for 1 to 6 months (Patient) 	5	5	1	Female	25-34	1/12/2011 2:21:54 AM	I have been on the implanon for 5 months. At first I was VERY excitied about getting the implanon. Ok the first month I started bleeding for like 2 weeks but I thought that was because I had just gotten it. My period went off for like 3 days. Then it came right back on. So I let that slide. So as the months went on I would have 2 LONG periods a month. Sometimes my period wont even go off. I am complaining and so is my husband! I am going to the doctor thursday and this will be getting removed. I highly DO NO recommend this to ANYONE! Maybe I should have stayed on my depo. Well good luck to the ones that love it and are not having any problems because I am going back to my DEPO. A birth control i know about!
Birth Control	teen_mom_2boys, 19-24 Female  on Treatment for less than 1 month (Patient) 	5	4	3	Female	19-24	1/9/2011 1:15:21 AM	Crampy, feeling sick to my stomach, slight head ache and tired ness but can't sleep at night..but I think its working..i dont feel pregnant or no signs of it :) but i've had implanon in for a week after switchin from mirena.
Birth Control	19-24 Female  on Treatment for 1 to less than 2 years (Patient) 	5	1	1	Female	19-24	12/29/2010 2:06:55 AM	HORRIBLE!!!! thank god I have a understanding husband. I have been on a period since incertion (a year and 3 months ago) can be light, can be heavy. Mood swings, random crying, crippling cramps, never ending sleep needs. its awful. I am counting down the days to get it taken out. 
Birth Control	cm13278, 19-24 Female  on Treatment for 1 to less than 2 years (Patient) 	5	5	3	Female	19-24	12/27/2010 4:54:41 PM	I had implanon for two years before getting it taken out. At the time, it was the only thing the doc recommended since i can't take estrogen.  I never had a period except some random heavy bleeding around christmas both years.  I liked I didnt have to remember to take it or anything like that.  I really enjoyed it for about the first year, no real side effects.  After the first year though, my sex drive became non-existent and i barely wanted to be around my partner anymore at all.  Thats my biggest complaint, after having it taken out, all is back to normal.
Birth Control	in doubt, 35-44 Female  on Treatment for less than 1 month (Patient) 	2	3	3	Female	35-44	12/25/2010 3:35:29 PM	I had the implanon inserted only 4 days ago. The insertion was easy and painless. The next two days however, I experienced a sharp pain in my arm as if the stick was sticking me.  I had limited mobility with the use of my arm but on day four it seemed to be better. When I removed the bandage, I appear to have a brusing on the skin. I am going to go back to the doctor for a follow up. I hope that the poking doesen't return and the brusing will go away. If so, I will give it a try for the first 3 years. I have yet to experience the bleeding, mood swings, weight gain and low libido. Right now, these are the least of my concerns. 
Birth Control	 Female  on Treatment for 1 to 6 months (Patient) 	3	1	1	Female		12/23/2010 11:19:35 PM	getting the implanon was a terrible decision. at first i liked how easy it was, then the problems started coming. i now have cystic acne on my face and have seen several doctors about it and they said i have no hope of getting rid of it unless it the implant taken out. my relationships have worsened. my sex drive is nonexistent and it has affected my relationship with my husband. i have insomnia and lose sleep nightly. i have exhausted 24 7. it has been horrible. unfortunately it is close to christmas and i am having to wait until the first of the new year to get it removed. I do NOT recommend it to ANYONE.
Birth Control	NotHornyAnymore, 19-24 Female  on Treatment for 2 to less than 5 years (Patient) 	5	5	4	Female	19-24	12/22/2010 7:54:26 AM	I was on the pill and was horrible at remembering to take it...16 and pregnant. After birth I got implanon. My period was all over the place, never knowing what to expect. My period wasnt predictable before so no huge change there. Most other symptoms expected I am not really sure if it is the birth control or my own growing body. I would say a slight weight gain and faster hair growth. My biggest complaint is my almost complete lack of sex drive. I guess you could call that effective birth control; if you arent having sex you wont get pregnant.   I am at the end of my three years and I do plan to get it again...this time I would like to really sit down with the doctor and try to figure out a dosage of hormonal pills along with this to try to up my sex drive. Even if it doesnt work I will most likely stay with Implanon.
Birth Control	19-24 Female  on Treatment for 2 to less than 5 years (Patient) 	5	5	2	Female	19-24	12/20/2010 6:07:16 PM	I have been on this since Jan 2008 and it has been horrible. I wish I would've known all the side effects. I've gained 20 or more lbs. I'm scared to weigh myself anymore. And it is hard to find anyone to remove it. no sex drive at all, tired, moody, aggrivated all the time. Never again.
