Diarrhea	45-54 Female  on Treatment for 1 to less than 2 years (Patient) 	1	4	1	Female	45-54	7/22/2008 4:42:17 PM	I was on Lomotil for 1 1/2yrs. The dr started with 2/day. When I was taken off because it wasn't working at all, he had me taking 1500/per month - that equals 10 5x/day. When I changed RX stores, the new pharmists flipped out!!! He was the only one that seemed to be aware of the damage Atropine could do to ones eyesite.  And he was right.  When I was started on this med I had better than 20/20 vision. Now I can't see anything with out contacts or glasses on at any distance. Everything is very blurry ALL the time with out them.  And on top of that, my chronic diarrhea from medical resectioning did not improve at any doseage!  If you value your eyesite, please be careful.  Be sure you have regular vision checks so you'll be aware if its changing and can make adjustments.  Although, by that time you may be to late, like I was.
Diarrhea	solo6916, 55-64 Female  on Treatment for 2 to less than 5 years (Patient) 	5	5	5	Female	55-64	5/6/2008 9:01:09 PM	Ihave had colitis for many years,without this and other meds I dont really know how I could live.
Diarrhea	45-54 Female  on Treatment for 5 to less than 10 years (Patient) 	5	5	5	Female	45-54	3/12/2008 8:02:54 PM	I have used Lomotil since 2001 with no side effects and very good results.  I can eat during the day while away from home now. My quality-of-life is normal! :)
Diarrhea	25-34 Male  on Treatment for 2 to less than 5 years (Patient) 	4	5	5	Male	25-34	3/11/2008 11:52:40 PM	It is a good medicine if you don't have chronic diarrhea!
Diarrhea		5	5	5			12/15/2007 12:15:45 PM	
Diarrhea	Pat,  Female  on Treatment for 1 to less than 2 years (Patient) 	5	5	5	Female		11/18/2007 1:27:11 PM	I've tried Imodium, Pepto bismol and other products. Lomotil is the only that controls my colitus. It's very frustrating to me that it is classified as a controlled substance and available by prescription only. It may create some dependence but that is better than the alternative, which for me is being pretty much housebound. I'm hoping someone come to their senses and make it an otc drug.
Other	Lhiggins, 35-44 Male  on Treatment for 10 years or more (Patient) 	5	5	5	Male	35-44	10/31/2007 10:02:53 PM	
Other	55-64 Male  on Treatment for less than 1 month (Patient) 	4	4	4	Male	55-64	10/14/2007 8:14:25 AM	I have been taking a cortico steroid (Endocort EC) since this past June 2007. I have microscopic colitis and IBS. After going off the Endocort and replacing it with Lomotil I am surprised and very pleased. Lomotil is working to keep my colitis in remission and also helps for stomach pains when I have a IBS flare-up. Lastly, Lomotil is far less expensive than Entocort which is important to me since I am retired and get only social security and recently joined a AARP plan to cover what Medicare does not. 
Diarrhea	65-74 Male  on Treatment for 10 years or more (Patient) 	4	5	5	Male	65-74	10/14/2007 12:27:16 AM	Crohn's Disease is the reason I have taken Lomotil Oral for the past 10-12 years.  I have not taken it every day for that long, but my physician alternated between Lomotil and other drugs meant for treating diarrhea.
Diarrhea	Debi, 35-44 Female  on Treatment for 2 to less than 5 years (Patient) 	4	5	4	Female	35-44	9/30/2007 10:39:53 PM	It has helped me live a better, more normal life with my family, something I could not do before I found it.
Diarrhea	Lisa Marie, 35-44 Female  on Treatment for less than 1 month (Patient) 	5	5	5	Female	35-44	9/24/2007 7:52:42 PM	Not only does this medication work, it works very quickly. 
