#choosemydrug	synonym
Joint Capsule Membrane Inflammation of a Diseased Joint	-
Fluid in the Lungs	Pulmonary edema
A Rare Hereditary Skin Condition	-
Intestinal Infection caused by the Roundworm Strongyloides	-
Intraductal Breast Cancer	Breast Cancer
Enlarged Breasts	Enlarged breasts in men
Breast Tenderness	-
Excessive Pigmentation of Facial Skin	-
Small Brown Spots on Facial Skin	-
Malignant Brain Tumor Glioblastoma	Brain tumor
A Type of Brain Cancer - Anaplastic Astrocytoma	Brain tumor
Metastatic Malignant Melanoma	Melanoma
Pituitary Hormone Deficiency	-
Primary Testicular Failure due to Torsion of Both Testis	Testicular torsion
Myotonia Congenita	-
Undescended Testicle	Undescended testicle
Anemia	anemia
Acute Gonorrhea of the Urethra	Gonorrhea
Female Urethral Syndrome	-
Treatment to Prevent Recurrent Aphthous Stomatitis	Canker sore
Apprehension	Anxiety
Atrial Flutter Electrically Shocked to Normal Rhythm	Atrial fibrillation
Generalized Attack of Muscular Weakness	-
Indolent B-Cell Lymphoma	Non-Hodgkin's lymphoma
Varying Shades of Excessive Coloration of a Body Part	-
Yellow-Brown Patches on Skin	-
Kidney Stones caused by Cystine	kidney stones
Inflammation with Fibrous Tissue Formation of Bile Ducts	Cystic fibrosis
Complications of Liver &amp;amp; Bile Ducts due to Cystic Fibrosis	Cystic fibrosis
Hardening of Liver and Blockage of Bile Ducts	-
Prevention of CMV Infection Post Kidney Transplant	-
Cytomegalovirus Infection of the Retina in AIDS patients	Cytomegalovirus (CMV) infection
Prevention of Cytomegalovirus Disease After Kidney-Pancreas Transplantation	Cytomegalovirus (CMV) infection
Acute Repetitive Seizures	-
Suppression of Recurrent Herpes Simplex Infection in HIV	acquired immunodeficiency syndrome
Infection of Intestines caused by Staphylococcal Bacteria	Staph infections
Infection Occurring During or Soon After an Operation	-
Infection of the Brain or Spinal Cord caused by Anthrax	Anthrax
Severe Infection caused by Staphylococcal Bacteria	Staph infections
Skin Infection caused by Anthrax	Anthrax
Infection of an Artificial Heart Valve	Endocarditis
Bacterial Infection of Heart Valve	Endocarditis
Bacterial Meningitis caused by Streptococcus	Meningitis
Diphtheric Infection of the Heart	-
Bacterial Meningitis caused by Staphylococcus	Meningitis
Red Lesions of Skin caused by Group A Streptococcus	-
Pneumonia caused by the Bacteria Anthrax	Anthrax
Increased Facial Hair in a Woman	Hirsutism
Puberty at an Earlier Age than would be expected	Precocious puberty
External Genital Warts	Genital warts
Hookworm Infection caused by Ancylostoma Duodenale	-
Pinworm Infection	Pinworm infection
Tapeworm Infection - Unilocular Hydatid Disease	Tapeworm infection
Induce Temporary Amnesia	amnesia
Ulcer of the Cornea of the Eye with Bacterial Infection	-
Severe Itching	Dermatitis
Prevention of Vitamin B12 Deficiency	Vitamin deficiency anemia
Anemia caused by Vitamin B12 Deficiency-Pernicious Anemia	Vitamin deficiency anemia
Inadequate Vitamin B12	Vitamin deficiency anemia
Low Energy	-
Drowsiness	-
Additional Medication for Diabetes Type 2	Type 2 diabetes
Lymph Node Positive Colon Cancer	Colon cancer
Diarrhea caused by E. Coli Bacteria	Diarrhea
Treatment to Prevent Traveler's Diarrhea	Diarrhea
Traveler's Diarrhea	Diarrhea
Sepsis Syndrome	Sepsis
Allergic Asthma that is Resistant to Treatment	Asthma
Excess Absorption of Diet Plant and Shellfish Sterols and Cholesterol	-
Pneumonia caused by the Bacteria Chlamydia	Pneumonia
Additional Destruction of the Inner Wall of the Uterus	Uterine fibroids
Increased Calcium in the Blood from Cancer	Hypercalcemia 
Cancer that has Spread To the Bone From Solid Tumors	Bone metastasis
Prevent Osteoporosis caused by Anti-Androgen Drugs	Osteoporosis
Prevention of Shingles	shingles
Complicated Appendicitis caused by Bacteroides Bacteria	Appendicitis
Appendicitis	Appendicitis
Infection of Abdominal Cavity Lining due to Bacteroides	Peritonitis
E. Coli Bacteria Infection of Abdominal Cavity Lining	Peritonitis
