Atrial Fibrillation	George, 55-64 Male  on Treatment for 5 to less than 10 years (Patient) 	4	4	2	Male	55-64	12/3/2009 4:38:23 PM	I have been taking Amiodarone for the last 8 years at 400mg per day.   I have experienced such things as tingling and pain in my feet, my back hurt so back I could hardly move at night.  When I would walk very far my legs ached severely.   I have been sun sensitive, sensitive to the heat and cold.   I must say though I did not have a breakthrough for almost 8 years.   Recently I had became so short of break and dog tired all of the time.  My doctor took me off of the medication and recommended an ablation, which I did about 2 weeks ago.   Still hoping that it works.   Amiodarone, as I was told by a cardiologist, is the last drug a person should be on, it is the &quot;big gun&quot; so to speak.   For a long time the good out weighed the bad for me.   Since having the ablation I can honestly say that I feel a hundred times better than before.  
Atrial Fibrillation	RIRudd, 55-64 Female  (Patient) 	3	1	1	Female	55-64	12/1/2009 7:39:58 AM	I developed life-threatening complications with this drug only after dose had been cut in half! Problems developed slowly, as drug is stored in body fat and takes a long time to leave body; drug had done a good job of controlling my a fib for several years; then I was seen by an MD that did ablations; I wanted to see if I was or might be a candidate for this procedure; that MD cut the dose in half; my a fib returned in 2 months ( no great surprise); but then I started to experience fatigue, muscle weakness, then started losing weight; I had to stop working; then developes intermittent fever, cough; diagnosed with bronchitis at one MD visit, with pneumonia two days later; was hospitalized (at my request!)  and 36 hours later developed resp. failure, and spent a week on vent in ICU!!  I was also throtoxic, with nodules on my thyroid;  I had several appts with MD's while the early symptoms were developing; no one questiond if Amiodarone was at fault; I could only find one reference in medical lit. on line that stated side effects might occur when dose lowered!  I am fine now; did require some short term rehab and physical therapy. Please be aware that these problems are possible even when dose lowered!  I assumed that &quot;less must be better&quot;---
Atrial Fibrillation		4	4	4			11/25/2009 2:06:57 PM	I like it
Atrial Fibrillation	19gordon47, 55-64 Male  on Treatment for 1 to 6 months (Patient) 	3	1	1	Male	55-64	11/21/2009 5:38:16 PM	Put on Amiodarone 400mg twice per day for three weeks in hopes of bringing my heart into normal sinus rythym. It was somewhat effective only. Heart was then shocked into sinus rythym, and placed on 200mg twice a day to maintaine the sinus rythym. Experience a lot of side effects especially in the morning upon taking the 200mg of Amiodarone. Such as headache, nausea,poor balance and coordination,consipation, stomach and intestinal gas release,weak in the knees,tired, feel like I'd like to sleep, but when I lay down I can't, have problems sleeping at night as well.This is side effects that come off the top of my head, but there is more !
Atrial Fibrillation	darla, 55-64 Female  on Treatment for 1 to 6 months (Patient) 	2	1	1	Female	55-64	11/13/2009 9:08:40 AM	Amiodarone gave me multiple side effects.  Lung toxicity was tops and that effects ability to walk (not enough oxygen in blood)...I was coughing and wheezing alot, upper esophagus partly paralized that affected swallowing. Hair loss, lower part of lungs couldn't get air (Felt stiff) Also hands and feet swollen, itchy hyperpigmented spots on face and neck, loss of taste, EXTREMELY TIRED, eyes sensitive to light, loss of apetite w/constipation, Plus I don't feel it was effective that much on the atrial arrythmia  I was having. I have no idea why I was given this toxic drug and am still having symptoms.  I only pray I don't have permanent damage.  
Atrial Fibrillation	ernie, 65-74 Female  on Treatment for less than 1 month (Caregiver) 	1	1	1	Female	65-74	11/11/2009 10:55:26 PM	My husband was given this medication in April,2009 because the pacemaker test was read wrong. He was only on it for 5 days. Since discovering it was wrong and he should have not taken the medicine at all he has started having trouble in his joints. He cna barely walk on his left foot and his right hand and wrist is swelling and painful too. He was diagnosed with rheumatoid arthritis but did not have any of these problems until he was given the amiodarone that he didnt need. I think this is a very dangerous medicine. He can't even do work like he used to and he is gettig worse. Every day it's something else wrong with him. It's very sad because he shouldn't have been taking the medicine because a stupid doctor read the test wrong. Can anyone tell me about any legal consultation i can contact. DONT TAKE THIS!!!
Atrial Fibrillation	tazmanuk, 35-44 Male  on Treatment for 6 months to less than 1 year (Patient) 	3	5	2	Male	35-44	11/4/2009 11:23:04 AM	Having several cardioversions, I was put on Amiodarone 200mg. I have trouble with joints, weakness in muscles.Also my eyesight has really deteriorated in the 12 months I have been on this.I recently October 2009, had an ablation to rectify my severe AF. I know it is only 6 weeks since my operation, the benefits have been brilliant. Hopefully My Consultant will remove the Amiodarone after my next consultation. 
Atrial Fibrillation	55-64 Male  on Treatment for less than 1 month (Patient) 	1	1	1	Male	55-64	10/25/2009 11:55:38 AM	developed tremours
Life-Threatening Rapid Ventricular Heartbeat	65-74 Female  on Treatment for 1 to less than 2 years (Caregiver) 	1	1	1	Female	65-74	10/24/2009 10:30:16 AM	My 72 year old cousin took this poison for 1-1/5 years.  Nose bleeds, low platlette count, tiredness, insomnia, weakness, hair loss.  Went to the doctor on Thursday and he said biopsy indicated liver disease.  He sent her home.  That evening she became inchoherent. Taken to emergency and Amonia count over 300.  Became more confused, unaware, and uncomfortable.  Body posturing, writhing in pain and could not communicate.  Stopped breathing next morning and all organs failed.  This drug is too dangerous to be on the market.  Better to die from heart failure than to go through this torture.
Atrial Fibrillation	AmioFailure, 55-64 Female  on Treatment for 2 to less than 5 years (Caregiver) 	4	4	1	Female	55-64	10/13/2009 3:48:11 PM	My husband began using this medication July of 2007.  He is followed by his primary care physician and cardiologist for years. In Feb 2009 he had a biventricular pacemaker inserted and his Amiodarone was increased from 200mg to 400 mg for one week by the electrophysiologist/md, then he went back to 200 mg.  He fell in May while teaching our grandson to ride his bike.  He hit his face on the street and his whole face was black and blue for weeks.  He started walking funny, wobbly per our grandson.  In June he fell and hit his head on the edge of our deck, he required 24 stitches in this head and has a huge scar.  In July he spent 8 days in CCU after collapsing at home, 911 had to be called.  At the end of August his Amiodarone was increased to 200 mg and 400 every other day. Since that time my husband now requires oxygen 24 hrs a day.  He was having arm and let involuntary jerking movements, terrible nose bleeds daily, upset stomach/bloating, unsteady on his feet, passing out, dizzyness, extremely tired and short of breath difficulty controling his bleedtimes/coumadin control.  He has not left the house on his own in two months, cannot drive, go out to dinner or stay up past 10.  He was well and active until about April-May when all these side effects began.None of his physicians brought up drug side effects.  I did some research and found the side effects, brought it up to the drs. and they immediately stopped this medication.  This was two weeks ago.  He is starting to improve in all areas except for the tiredness and shortness of breath.  I am hoping as more time passes that the breathing will get better.  Am planning on discussing with his pcp at next visit.  I would NOT recommend this drug to anyone!
Atrial Flutter	marilyn, 65-74 Female  on Treatment for 2 to less than 5 years (Patient) 	5	5	5	Female	65-74	10/12/2009 11:10:17 AM	Was very sick with atrial fib. and it went into flutter.  Was shocked three times and put on amiodarone.  It has been working well for me.  The only problem I'm worried about is I have a cough.  Don't know if it's congestion or something else
Atrial Fibrillation	RCF, 45-54 Female  on Treatment for less than 1 month (Caregiver) 	2	1	1	Female	45-54	10/12/2009 10:23:41 AM	My Dad took this drug after having a defibrillator implanted. Within days he developed shortness of breath and difficulty walking. During this time he was still in the hospital and not one healthcare professional considered that this drug might be responsible. At a follow 2 weeks after discharge his cardiologist suggested that it might be Amiodarone toxicity. He is now on oxygen full time, can hardly walk and steroids stopped working after a short time. His lungs are permanently scarred. Prior to taking this drug he had no lung problems. He is 79 yrs old. I'm not sure he'll make 80. Please get this drug off the market. It is a killer.
Atrial Fibrillation	55-64 Female  on Treatment for less than 1 month (Caregiver) 	1	2	1	Female	55-64	9/13/2009 8:04:24 PM	If your doctor is thinking about putting you on this medicine, DON'T let him. Don't let ANYONE you love be put on this medicine.My dad was put on this medicine after receiving a pacemaker. In less than a month's time he was admitted to a hospital due to what they thought was pneumonia. He was very weak then. After 2 days in hospital, they finally put him in ICU where he went into respiratory distress.They put him on a respirator which he was on for almost 2 weeks, took it out and he was not getting enough oxygen in his blood, so they reinserted a ventilator. After a couple of days, they put a trach in him. After being on numerous antibiotics and high dose steroids, his kidneys were near failure so they started dialysis. It was not successful for a couple of days, then doctor told us he would not make it.He died July, 2009. His death certificate stated amiodarone toxicity as cause of death.
Atrial Fibrillation	75 or over Male  on Treatment for 1 to less than 2 years (Patient) 	5	5	5	Male		9/10/2009 9:21:30 AM	i have had cronic AF for several years. During which timeI have had  Cardioversion  4 times but it only lasts a relatively short time. I have been on 200mg of Aminodarone for about a year with good results and no AF.
Atrial Flutter	amiodarone, 75 or over Male  on Treatment for 1 to 6 months (Patient) 	1	4	1	Male		9/7/2009 9:06:04 PM	was having loss of memory, getting very forgetable, 
Atrial Fibrillation	55-64 Female  on Treatment for 1 to 6 months (Caregiver) 	1	2	1	Female	55-64	9/7/2009 5:08:50 PM	After my husband was on the medicine for 1 month he developed an enlarged neck, difficulty breathing, chills, nausea and muscle weakness.  We insisted that it was the drug, Dr's disagreed.  He was put in the hospital and they treated the symptoms They would think he was ok and within 10 - 12 hours we were back in the hospital for the same symptoms.  This went on for about three weeks on and off until we insisted that he be removed from the medicine.  We have not had any problems since.  
Atrial Fibrillation	4jesus, 45-54 Male  on Treatment for less than 1 month (Patient) 	4	5	3	Male	45-54	9/7/2009 4:51:28 PM	So far I've been on this drug for 4 days and the only side effects i've gooten were the constipation and stomach pain. Kinda feels like the drug is tearing up your stomach, like when you eat too many hot peppers.
Atrial Fibrillation	75 or over Female  on Treatment for 2 to less than 5 years (Patient) 	3	3	2	Female		9/6/2009 4:19:28 PM	heart rythum is back to normal - however am concerned that it may contain the iodine that I am allergic to,  May physician has told me it is not the same kind.  I am very tired and weak and need a lot of sleep.  My feet feel packed and my legs give out.  
Atrial Fibrillation	rxmann, 75 or over on Treatment for 1 to 6 months (Caregiver) 	3	3	1			9/2/2009 4:51:57 PM	I am a cargiver for my 93yr old father-in-law. We are having a very difficult time determining if a severe rash on his chest and entire body is being cause by aminodarone or Coumadin 5mg.  MD Stopped the aminodarone about 1&amp;1/2 weeks ago but he is still taking the Warfarin or Coumadin. He has tacky-brady syndrome and the Cardiologist d/c'd the aminodarone. Where shall we go from here?  Thank you for you immediate concern with a response. Sincerely Vito D. Fabrizio
Atrial Fibrillation	bbs99b, 55-64 Male  on Treatment for 1 to less than 2 years (Patient) 	4	5	3	Male	55-64	8/30/2009 4:29:16 PM	Had a heart attack and came out of hospital with intermittent a-fib......the drug seemed to do its job.......have had worsening of vision and some blurred vision .....get very red in sun but didn't burn... Dr knew it was a very toxic drug and some new drug is out now called Multaq (dronedarone).......just started taking it but its not as toxic as the amiod or so the dr says .......we'll see 
Atrial Fibrillation	45-54 Male  on Treatment for 6 months to less than 1 year (Patient) 	2	2	1	Male	45-54	8/24/2009 4:22:36 PM	all ways tired and low blood pressure
Ventricular Fibrillation	ksanders, 55-64 Male  on Treatment for 2 to less than 5 years (Patient) 	4	3	1	Male	55-64	8/23/2009 5:08:21 AM	After having a sudden cardiac arrest I was placed on this drug. I took it for two years. I also had a AED implanted. I had approximately 4 &quot;shocks&quot; in those two years. I now have permanent lung damage (70 percent loss of CO2/O2 exchange). After the lung damage appeared I was place on another arrhythmia medication, Mexilitene. I think Amiodarone should have never been approved by the FDA.
Atrial Fibrillation Electrically Shocked to Normal Rhythm	jo, 75 or over Female  on Treatment for 2 to less than 5 years (Patient) 	5	5	1	Female		8/4/2009 10:11:16 PM	Pulse was in the 40s; loud ear noises when getting up in the morning, sunburn, thyroid problems, bruises would last for weeks, granules on my corea, tremors of hands, others too numerous to list
Atrial Fibrillation	65-74 Male  on Treatment for less than 1 month (Patient) 	2	1	1	Male	65-74	7/29/2009 12:12:42 PM	Was given this drug in the hospital after a heart attack. I was on this drug after bypass surgery. This drug casued nausea and muscle weakness. I also think this med caused psychological problems [violent dreams]. As Dave Letterman would say, &quot;I wouldn't give this med to a monkey on a rock.&quot; I finally convinced by cardio MD to take me off this med and now feel better. However, this med stays in your system a long time. I hope I don't have any further problems. Than God that I am now off this med!
Paroxysmal Supraventricular Tachycardia	55-64 Male  on Treatment for 5 to less than 10 years (Caregiver) 	4	4	4	Male	55-64	7/29/2009 8:37:53 AM	none
Atrial Fibrillation	maggie2pwisr, 75 or over Female  on Treatment for 2 to less than 5 years (Patient) 	5	5	5	Female		7/28/2009 8:37:25 PM	I started with 200mg tablets and after a year and a half my Dr. reduced to 100mg.  That has been for two years. I have had now problems with my AFIB.
Atrial Fibrillation	Betty Boo, 65-74 Female  on Treatment for less than 1 month (Patient) 	2	2	1	Female	65-74	7/23/2009 12:44:36 AM	I just began using this drug and am very concerned with the many side effects
Heart Rate Between 100 and 130 Beats Per Minute	karen, 45-54 Female  (Patient) 	1	4	1	Female	45-54	7/1/2009 6:15:03 PM	decreased b/p ,passed-out end up in hospital x5 days
Paroxysmal Supraventricular Tachycardia	eattabug, 55-64 Female  on Treatment for 1 to less than 2 years (Patient) 	5	5	5	Female	55-64	6/23/2009 9:53:13 PM	I no longer wake with my heart racing and am able to sleep all night
Atrial Fibrillation	65-74 Male  on Treatment for 5 to less than 10 years (Patient) 	5	5	4	Male	65-74	6/18/2009 7:53:53 AM	The main side effect I have is sunburn. I am out in the sun a lot and I have to use a 50 spf suncreen to keep from burning. I also very fair skin.
Heart Rate Between 100 and 130 Beats Per Minute	lilacs0618@aol.com, 65-74 Male  on Treatment for 1 to 6 months (Patient) 	2	2	2	Male	65-74	6/7/2009 1:31:41 PM	Extreme dizziness and afraid of passing out/ I lay right down when dizzy spells hit and stay quiet as possible  I have a de-fibrilator also
Ventricular Fibrillation	55-64 Male  on Treatment for 2 to less than 5 years (Patient) 	5	5	5	Male	55-64	6/2/2009 12:34:20 PM	
Atrial Fibrillation Electrically Shocked to Normal Rhythm	dcarver352, 65-74 Male  on Treatment for 1 to 6 months (Patient) 	2	5	1	Male	65-74	5/19/2009 1:16:45 PM	Felt dizzyness and was shocked back to normal heartrate twice.  Placed on amiodarone.  Later, developed a serious cough and upon checking my lungs found toxcicity attributed to amiodarone.  Now am still coughing and have serious shortness of breath.  
Prevention of Ventricular Fibrillation	Lark, 65-74 Male  on Treatment for 10 years or more (Patient) 	2	2	1	Male	65-74	5/9/2009 12:06:28 PM	Has not effectively controled my V-Tach, or A-Fib on stress tests.I Have been using for 15 years. I am now told that I have lung problems relating to the Med. I have been told that these lung problem may be permanent. What's up with this crap, poision!
Atrial Fibrillation	Sharwit, 55-64 Female  on Treatment for less than 1 month (Patient) 	1	3	1	Female	55-64	5/8/2009 8:38:54 AM	After 1 week of constant vomiting, I ended up in the hospital with pnemonia in both lungs and almost died.  Was told by the lung doctor, in his opinion, this drug did damage to my lungs.
Atypical Ventricular Tachycardia	sheila, 45-54 Female  on Treatment for 10 years or more (Patient) 	4	4	4	Female	45-54	4/27/2009 6:24:32 PM	this medication has helped me big time. without it,i experience these attacks and my ICD shocks me back to life. I'v had very little side effects, blured vision, redness of skin. I'v been on it now for 15yrs now. I developed this along with cardiomyopthy when i was pregnant. I went into congested heart failure in my 9th month. I was at emory awating heart transplant for two months.This medicine and coreg really got me back on my feet, without a transplant,praise God. 
Rapid Ventricular Heartbeat	sheila, 45-54 Female  on Treatment for 10 years or more (Patient) 	5	4	4	Female	45-54	4/27/2009 6:00:14 PM	this medicine has really helped my rapid heart beat. i tried to come off for a while, and i found my self passing out and receiving shocks from my icd. so--i went back on it, it really has helped me.
Atrial Fibrillation	ed49pahs, 75 or over Male  on Treatment for 2 to less than 5 years (Patient) 	5	5	1	Male		4/16/2009 10:27:49 AM	It appears as though Amiodorone is playing havoce with my stomach a very annoying and painful side effect.
Atrial Fibrillation Electrically Shocked to Normal Rhythm	lilyette@verizon.net, 65-74 Male  on Treatment for 2 to less than 5 years (Patient) 	1	2	1	Male	65-74	3/13/2009 7:59:42 AM	I became light headed, and at times passed out. My defibrillator shocked me back into normal sinus rhythm.
Paroxysmal Supraventricular Tachycardia	45-54 Female  on Treatment for 6 months to less than 1 year (Patient) 	5	4	5	Female	45-54	3/12/2009 1:32:45 PM	
Atrial Fibrillation	pamela, 55-64 Female  on Treatment for 1 to 6 months (Caregiver) 	1	5	1	Female	55-64	3/6/2009 1:04:26 PM	this was given to my father with explanation of risks and benefits, he developed fibrosis and died.Be very careful of it.
Atrial Fibrillation	geobet, 75 or over Female  on Treatment for 2 to less than 5 years (Patient) 	5	4	1	Female		3/3/2009 6:36:18 PM	I have had many side effects hair loss tremors.,difficult time sleeping thyroid problems.
Atrial Fibrillation	charlieww, 55-64 Male  on Treatment for 1 to less than 2 years (Patient) 	1	1	1	Male	55-64	2/23/2009 2:33:09 AM	Do not take this drug.I now have Pulmonary scaring. My lungs are damaged forever. Horrible shortness of breath. Simple tasks are a challenge. Totally changed my life.Stay out of cold weather. Doctor ignored my concerns until I pushed the issue.
Atrial Fibrillation	Dan Walter (Caregiver) 	3	3	3			2/16/2009 5:31:23 PM	Google &quot;Adventures in Cardiology&quot; to see how they treat AFIB at Johns Hopkins Hospital.
Atrial Fibrillation Electrically Shocked to Normal Rhythm	cee gee, 65-74 Female  on Treatment for 1 to 6 months (Patient) 	4	3	2	Female	65-74	2/7/2009 9:14:04 PM	5 months on this drug, still in sinus rythmn but side effects of anxiety overwhelming. choosing to stop using this drug and hope A Fib does not return. I have never seen any info regarding what to expect when I stop ( other than the possibility of returning A Fib) or what I can do to hasten the departure of this drug from my system. No more antiarrithmics for me.
Atrial Fibrillation	65-74 Female  on Treatment for 1 to less than 2 years (Patient) 	3	3	3	Female	65-74	2/4/2009 4:15:48 PM	I'm on Amiodarone for 16 mos. and it seems to be keeping me in rhythm. But do not like the possible side effects. Blurry vision, possible lung and liver damage. Also have trouble swallowing. 
Atrial Fibrillation	melodyjan, 65-74 Female  on Treatment for 1 to 6 months (Patient) 	1	1	1	Female	65-74	1/27/2009 9:46:01 PM	I am now recovering at home after 6 days in the hospital caused by side effects of this medicine.  My platelet count dropped to 10,000, could not walk to my mailbox without stopping with shortness of breath, had URI, hyperthyroidism and lung inflammation which caused my oxygen level on room air to drop to 80%.  I would not recommend this poison to anyone without VERY close supervision by a true professional (which mine was not). I had been taking the drug for almost 6 months, and no tests were taken for possible side effects despite my complaints to my cardiologist.  It remains to be seen if my blurred vision and  lung inflammation will be a permanent problem.
Atrial Fibrillation Electrically Shocked to Normal Rhythm	Janet, 65-74 Female  on Treatment for 5 to less than 10 years (Caregiver) 	5	5	5	Female	65-74	1/22/2009 6:57:52 PM	heart has remained in rhythm
Atrial Fibrillation	miller, 65-74 Male  on Treatment for 5 to less than 10 years (Patient) 	2	4	2	Male	65-74	12/31/2008 2:38:33 PM	Have used for five years; still have intermittent atiral fib. concerned about possible liver &amp; thyroid problems.
Atrial Fibrillation	Yaymee, 45-54 Female  on Treatment for 1 to less than 2 years (Caregiver) 	1	1	1	Female	45-54	12/31/2008 6:22:09 AM	My mom is currently hospitalized with Amiodarone induced Lung Toxicity. MRI shows damage throughout her lungs. She never smoked. Her Thyroid is destroyed. Her symptoms are severe lack of energy, low-grade fever, shortness of breath and hair loss. Please find another soluton - don't let your loved ones take this drug.
Atrial Fibrillation	65-74 Female  on Treatment for 1 to 6 months (Patient) 	1	2	1	Female	65-74	12/27/2008 4:25:26 PM	My doctor prescribed amiodarone for my afib about 3 years ago.  I was on it for 4 months.  I developed thyroid problems and have been on meds for that ever since.  While taking the amiodarone my eyes starting twitching to the point that I could hardly read or watch TV.  At night my legs and arms twitched so badly that I could hardly sleep.  My eyes still twitch occasionally and I haven't been on the drug in years.  I told my doctor that I wanted to discontinue taking this drug.  I went back on Inderal which works fairly well.  I still have had 6 bad episodes this year so far.  My new cardiologist has prescribed Sotalol.  I've read some of the comments and warnings on this drug and don't get that warm, fuzzy feeling about it.  I definitely would not recommend amiodarone to anyone.  
Atrial Fibrillation	Eilsel, 65-74 Male  on Treatment for 2 to less than 5 years (Patient) 	4	5	3	Male	65-74	12/25/2008 10:48:17 AM	I've had AF for 4 years. Amio helped get me back in rhythm. Side effects of fatigue,cold became intolerable. It did maintain rhythm. One year ago I got off. Now have controlled AF and feel much better but have irregular pulse. Now have two more problems to deal with - take thyroid for life and beginning dry macular degeneration. I am functioning better but have added two more lifelong health problems. Is/was it worth it!!
Atrial Fibrillation Electrically Shocked to Normal Rhythm	gran12, 65-74 Female  on Treatment for 1 to 6 months (Patient) 	3	2	3	Female	65-74	12/16/2008 5:22:54 PM	Have low BLP sometimes and weak spells,with no energy.
Atrial Fibrillation	67Fairlane, 45-54 Male  on Treatment for 1 to 6 months (Patient) 	2	3	1	Male	45-54	12/16/2008 12:39:18 AM	I have cronic AF. I've been cardioverted 8 times, it never lasts more then a few days. I have tried probably every drug out there; flecinide, Rythomol, Toporal, either they didn't work or in the case of Flecinide, I didn't sleep for 3 days which is a rare side effect. I have had two Cardio Ablations, after the first I was on Aamiodarone for six months, didn't work and the possible side effects were not worth continuing.
Atrial Fibrillation	steeltrap, 35-44 Male  on Treatment for less than 1 month (Patient) 	4	4	2	Male	35-44	12/8/2008 3:13:03 PM	took this drug for 4 yrs. kept heart beat regular, didnt like side effects. sunburn easily, blurry vision, and I beleive it caused heart attack related symptoms(chest discomfort, nausea, cold sweat. another doc besides my regular heart doc put me on Rythmol or Rythmol RS (generic is Propafenone) less side effects. would reccomend Rythmol.
