Atrial Fibrillation	becky, 55-64 Female  on Treatment for 5 to less than 10 years (Caregiver) 	2	4	1	Female	55-64	4/12/2011 3:57:08 AM	this drug has caused fatal side effects in the form of lung fibrosis and ARDS 
Life-Threatening Rapid Ventricular Heartbeat	45-54 Female  on Treatment for less than 1 month (Patient) 	1	2	1	Female	45-54	4/11/2011 1:58:07 PM	feel worse on med.still had flutters
Atrial Fibrillation	ajs1937@sbcglobal.net, 65-74 Female  on Treatment for 1 to 6 months (Patient) 	2	2	3	Female	65-74	3/22/2011 2:28:32 PM	i am more tired and don't see clearly
Life-Threatening Rapid Ventricular Heartbeat	DraconiousNoctem, 55-64 Male  on Treatment for 10 years or more (Patient) 	5	5	5	Male	55-64	3/17/2011 6:12:00 AM	I have had six episodes of sudden cardiac death due to ventricular fib. Since starting on this drug ten years ago, I have only had one episode of V-Fib and that was resolved by my internal defibrillator shocking me back to sinus rhythm. This is an excellent drug for people like me who really need it.My cardiologist and electrocardiophysiologist have monitored my lab work on a regular basis and I have never had any lung or liver problems with this drug. It can be a life saver.
Atrial Fibrillation	65-74 Female  (Patient) 	3	3	3	Female	65-74	3/11/2011 11:14:16 PM	
Atrial Fibrillation Electrically Shocked to Normal Rhythm	paul lippert6pc, 75 or over on Treatment for 1 to 6 months (Patient) 	4	3	2			2/19/2011 2:32:25 PM	Adding too my previos report, heagaches and dizziness also sleeplesness
Prevention of Recurrent Atrial Fibrillation	Paul lippert, 75 or over on Treatment for 1 to 6 months (Patient) 	3	4	2			2/19/2011 2:23:32 PM	While the drug has prevented atrial fibrilation it brought down my energy and stamina, B.P up to 170, leg cramps while riding bike, when ok i can ride 30 mi. no more
Atrial Fibrillation	ggmajoyce1945,  Female  on Treatment for less than 1 month (Patient) 	1	3	1	Female		2/18/2011 10:56:37 AM	i started taking amiadarone three weeks ago and have been in emergency twice with high blood pressure 180/140/heart rate 139 iam having afibs every other day 
Atrial Fibrillation	35-44 Female  on Treatment for 6 months to less than 1 year (Caregiver) 	1	1	1	Female	35-44	2/9/2011 10:37:12 PM	This drug also killed my mother. She did not do well on it, but was basically ignored by her doctors. Her feet and ankles started swelling on Easter Sunday, 2010. She called her doctor. They said she did not need to come in (even though the warning signs say to call your doctor immediately). I think the non concern made her feel like she was just complaining and would just have to live with discomfort and sickness. By May 23, she was so sick, we went to the doctor. One lung was completely filled with fluid. (We were not at the hospital where her doctors were located.) Still no concern about this medication. Within 24 hours, she was in ICU. W/in another 24 hrs. she was moved to a hospital that could better care for her. She stayed in ICU for 4 weeks before passing away. What I actually think she had was kidney failure that showed up as fluid in her lungs. I could just shake myself for not taking a stronger position earlier on. She was so very healthy and strong until this happened. If you are taking this medicine and having problems, please see if your doctor could prescribe something else. I found out too late that there are intermediate drugs that could have been tried first.
Atrial Fibrillation	nanabana7, 75 or over Female  on Treatment for 5 to less than 10 years (Patient) 	5	5	5	Female		2/5/2011 6:04:19 PM	I have taken this drug for six years and it has kept me in a NSR.  I take 100 mg every other day. I have lab studies done every six months and also my eyes check.  Been a blessing in my life. 
Atrial Fibrillation	45-54 Male  on Treatment for 2 to less than 5 years (Caregiver) 	1	1	1	Male	45-54	2/5/2011 8:19:09 AM	This drug killed my father. He had taken amiodarone for 4 years until he was diagnosed with fibrosis of his lungs. He passed away December 2010 on a vent. His lungs filled with blood and he suffocated, drowned in his own blood. This drug will kill you! 
Atrial Fibrillation Electrically Shocked to Normal Rhythm	carolina, 35-44 Female  on Treatment for 2 to less than 5 years (Patient) 	2	2	2	Female	35-44	1/16/2011 12:57:26 PM	scared to death because of the side effects it causes
Atrial Fibrillation Electrically Shocked to Normal Rhythm	MARK r, 45-54 Male  on Treatment for 1 to 6 months (Patient) 	3	5	3	Male	45-54	1/12/2011 1:16:54 PM	I have read all the posts on multaq and amiodorone, I was put on amiodorone short term, but high doses,6 per day for 2 weeks then 4 for 2 wks. then 2 per day for about 6-8 weeks then came the cardio version yeah out of afib in 5 minutes was so happy later made the mistake the other guy wrote 2 beers and back In afib started over anyway they zapped me again on multaq now (NO BEER) sorry for the long post but I wanted to let you all know my heart surgeon told me amiodorone IS A KILLER In long term use, and usualy only given to older patients, short term worked for cardioversion and what other people have posted multaq Is expensive and weight gain multaq is dronedarone sister drug to amiodorone Its also fairly new Ive had good luck with It.Hope this post helps some of you, IF your looking for support,there is a support group for patients and loved ones with implanted defibs and pacemakers called ICD SUPPORT GROUP.net web net is great but this group is more like a family of worried people helping each other god bless all the heart people!MARK r
Atrial Fibrillation	Jane, 55-64 Female  on Treatment for 1 to 6 months (Caregiver) 	1	1	1	Female	55-64	1/9/2011 2:01:49 AM	My wife was put on this drug after trying multaq.  Multaq gave her severe stomach cramps and bloating and was not controlling her afib. She has had an unsucessful pulmonary ablation through the ribs on both sides.  The surgery left her with plueral effusions.  So DR. put her on 40 mg lasix twice a day and swithed her multaq to amioderone.  She passed out and hit her head on the ground . She was taken by ambulance to the hospital and very shortly after went into Vfib several times. Her blood work showed low potasium and magnesium levels which caused by the lasix(diuretic). She recovered after getting potasium and mag IV's. Her new Dr. took her off the amionderone and lasix.  She is short of breath and Dr. thinks amioderone caused it. She is doing much better now.  Her previous Dr. should have been checking her electrolytes regularly. I don't think  amioderone good drug.
Atrial Fibrillation	buck, 75 or over Male  on Treatment for less than 1 month (Patient) 	3	3	4	Male		12/3/2010 8:33:35 PM	I have had some of the side effects-shortness of breath and no energy
Atrial Fibrillation	45-54 Female  on Treatment for 1 to 6 months (Patient) 	1	1	1	Female	45-54	11/18/2010 8:44:33 PM	I started on this medicine April 2010 and by the middle of September i was having shortness of breath ,very heavy sweating ,and very fatigue all i wanted do was sleep ,i called my DR. that prescribe the medicine and told the nurse the problems i was having and the nurse return my call and told me the DR. wanted me to continue to take the medicine because it was going to help my heart and me trusting my DR. icontinue to take the medicine and i thought it was going to kill me ,it has called damage to my lungs and my thyroid level is low  i felt this could have been avoided only if my heart DR. had stopped the drug.
Atrial Fibrillation	45-54 Female  on Treatment for less than 1 month (Patient) 	1	1	1	Female	45-54	11/11/2010 3:01:02 PM	I was placed on AMIODARONE 200 mg twice a day for AF .This drug is absolutely aweful! This drug has TOO MANY side effects. I have only been taking this drug for 7 days, and have experience naseua, vomiting, coughing, extreme tiredness, chest pain, and unbale to sleep at night. I request that I be taken off this drug! PLEASE DO NOT TAKE THIS POSION!!!!!
Ventricular Fibrillation	JW, 55-64 Male  on Treatment for 1 to less than 2 years (Patient) 	1	4	1	Male	55-64	11/5/2010 7:18:54 PM	This is a very dangerous Drug. It was slowly killing me. The list of side effects is huge &amp; I had many of them, several very serious ones. Difficulty with coordination, muscle weakness, muscle loss (I lost 40# mostly muscle), difficulty breathing, dizziness, sensitivity to the sun, too much sun turned my skin grayish blue, and vision. My Cardiologist wanted to keep me on it so I got a second opinion which after testing was I should have been off it long ago. &amp; then changed cardiologists. (For those few patients who truly need this, stopping it can kill you, so I knew to get a second opinion &amp; welcome the additional testing)Off it 4 months now &amp; I feel better than I have on over 5 yrs. My new cardiologist has me doing strength training as well as cardio &amp; I've gained 5# back so far. They also have me gradually changing my diet more towards Vegan, replacing meat with egg whites, soy products, and protein mix. I'm also eating more fruits &amp; veggies. More info on this at Dr Dean Ornish's site http://www.ornishspectrum.com/ It's working for me.
Ventricular Fibrillation	fava, 55-64 Male  on Treatment for less than 1 month (Patient) 	5	5	5	Male	55-64	9/22/2010 5:15:35 PM	
Atrial Fibrillation	zman0223, 65-74 Male  on Treatment for 1 to less than 2 years (Patient) 	2	2	2	Male	65-74	9/12/2010 1:33:38 PM	
Atrial Fibrillation	65-74 Female  (Patient) 	4	5	4	Female	65-74	8/7/2010 12:15:31 PM	Generally good results--- was not informed by doctor of serious side effects
Atrial Fibrillation	sayger2, 65-74 Male  (Patient) 	1	3	1	Male	65-74	7/20/2010 6:57:08 PM	Dizziness, severe heaadache, weakness, fluctiating BP, low thyroid function, nausea, rash, sunlight unbearable, ???
Prevention of Ventricular Fibrillation	75 or over Male  on Treatment for 1 to 6 months (Caregiver) 	2	2	1	Male		7/11/2010 9:27:54 PM	I have expirence vertigo with this medication;lost of appitate.
Atrial Fibrillation Electrically Shocked to Normal Rhythm	bad drug, 75 or over Female  on Treatment for 6 months to less than 1 year (Caregiver) 	1	1	1	Female		7/9/2010 12:10:54 PM	This drug almost killed my father.
Atrial Fibrillation Electrically Shocked to Normal Rhythm	help for bad drug, 35-44 Female  on Treatment for 6 months to less than 1 year (Caregiver) 	1	1	1	Female	35-44	7/3/2010 9:25:05 PM	This drug almost killed my father and has caused damage to vital organs. Please email me for detailed information and FDA warnings! This drug should be BANNED! email lharmon@equinealliance.org 
Atrial Fibrillation		1	1	1			6/23/2010 11:52:47 PM	This drug killed my father. After taking it for 22 days his lungs filled up with blood and 16 days later he passed away.
Life-Threatening Rapid Ventricular Heartbeat	ltlmac, 65-74 Female  on Treatment for 10 years or more (Patient) 	5	5	5	Female	65-74	6/20/2010 10:03:54 AM	
Other	Lisa, 55-64 Male  on Treatment for 1 to less than 2 years (Caregiver) 	1	4	1	Male	55-64	6/13/2010 5:00:35 PM	This drug killed my dad. Dr. thought he had broncitis, then neumonia, he started coughing up blood took him to the ER 8 days later he was dead. Pulminologist looked at dad when he first came in Dr. immediatly took him off the amio and started him on steroids but it was to late irreversible. DO NOT TAKE THIS MEDICATION!!!!!!!!PLEASE IF YOU VALUE YOUR LIFE.
Atrial Fibrillation	Bobby B, 75 or over Male  on Treatment for less than 1 month (Patient) 	1	4	1	Male		6/9/2010 4:31:19 PM	Have only been taking 5 days heart still beating very ruff
Atrial Fibrillation	Eilsel, 65-74 Male  on Treatment for 2 to less than 5 years (Patient) 	3	5	1	Male	65-74	6/8/2010 3:37:04 PM	I have written a review previously; this is 2 years later. It probably helped keep  me in rhythm for 3 years - been off for the last 2 and am out of rhythm BUT DOING AND FEELING MUCH BETTER. However, have 2 additional permanent health problems due to amio-hypothyroidism and machular degeneration. Amio was not approved by FDA for afib - maybe all the undesirable sideeffects are why  it wasn't!!!
Life-Threatening Rapid Ventricular Heartbeat	cougars, 55-64 Male  on Treatment for 5 to less than 10 years (Patient) 	5	5	3	Male	55-64	6/6/2010 9:39:29 PM	works for V-Tack, but, have severe lung problems and problems with sunburn.
Atrial Fibrillation	Gunny, 55-64 Male  on Treatment for 1 to 6 months (Patient) 	4	4	4	Male	55-64	6/3/2010 12:07:34 PM	Seem to be doing the job
Atrial Fibrillation	sister, 45-54 Female  on Treatment for 1 to less than 2 years (Caregiver) 	1	1	1	Female	45-54	5/20/2010 12:14:20 AM	This drug will kill you !!!!!!!!!!!! I've seen it frist hand. Compleate liver failure, kidney failure, and phnomia all within 2 weeks ..... Gone 
Atrial Fibrillation	55-64 Female  on Treatment for 1 to 6 months (Caregiver) 	1	3	1	Female	55-64	5/15/2010 2:06:22 PM	This pill killed my husband.
Atrial Fibrillation	65-74 on Treatment for 1 to 6 months (Patient) 	5	5	5		65-74	5/13/2010 4:42:21 PM	
Atrial Fibrillation	Port,  Female  on Treatment for 2 to less than 5 years (Patient) 	1	1	1	Female		4/28/2010 3:14:28 PM	I've had all kinds of problems with the amiodarone since I've been on it.My heartrate stays fast all the time.My doctor says I've to stay on it.What shall I do now.  Sign Falling-Out
Atrial Fibrillation	Georgerzay7n, 55-64 Male  on Treatment for 5 to less than 10 years (Patient) 	5	5	1	Male	55-64	4/22/2010 10:01:19 PM	I just read the review by David and I am in full agreement with him.   I have previously reviewed this drug and would like to add more.  I was on Amiodarone for 8 years and the problem with the drug is not only when you are taking it but after you get off of it.  There are so many different things that go on, like rapid heartrate, hypothyroidism and many more.  The big problem is that the drug stays in your system a very long time after you stop taking it. I agree that there has to be other alternatives.  A fib is like a plague just when you think you have it  undercontrol, it comes back.  
Atrial Fibrillation	DAVID, 55-64 Male  on Treatment for 2 to less than 5 years (Patient) 	5	5	1	Male	55-64	4/20/2010 7:31:40 PM	MY OPINION WHICH APPLIES TO ME: This is a dangerous, very effective drug for my afib but I am afraid of it. Trial and error I found out that by CONTROLLING high blood pressure ELIMINATION of excessive dietary salt, added potassium and magnesium supplements, REDUCED my afib attacks by 90%. Also to be avoided are chronic infections such as bad teeth. I absolutely must monitor and control my blood pressure by using a BP machine. If necessary I use Isosorbide sublingual to get my blood pressure under control. I use enalapril 50 mg once a day but nothing and I mean ZERO medications that I tried are as effective as sublingual isosorbide. ADRENALINE production I discovered is a MAJOR contributor to Afib. So is sleep apnea. This disease is a hydra, with many heads and a patient has to ATTACK it from many different angles other than AMIODARONE. I will not passively sit back and let an overtaxed cardiologist write an Rx for 200 mg / BID and then proceed to kill myself. Amiodarone to me is a medication to be taken ONLY to restore sinus rythym, and then readress the &quot;hydra&quot;. I learned to recognize the pre-symptoms of my afib attacks, poor sleep HIGH BLOOD PRESSURE, higher than normal pulse, sweaty palms, excessive urination, aggressive dreams and behavior (adrenaline). To me AMIODARONE is a miracle drug but I will not take it on a maintenance basis. There are too many other options open to me and I have found many of them to work splendidly. Learn your body, monitor your BP and pulse, try the alternatives that I tried, but for crying out loud just don't ASSUME that your cardiologist knows all there is to know. After all he does not have to live in your body and suffer the consequences. I hope this helps someone else.
Other	 , 75 or over Female  on Treatment for less than 1 month (Caregiver) 	1	1	1	Female		4/15/2010 4:27:05 PM	Our mother had a heart attack on 02/07/09.A few weeks later she could no longer breath very well and was diagnosed with pulmonary fibrosis.The amiodarone had done a lot of damage.Yes, she had other medical issues but struggling for air to breathe is horrible.She died on 5/7/09. What a shame.
Ventricular Rate Control in Atrial Fibrillation	marlene, 45-54 Female  on Treatment for 1 to less than 2 years (Patient) 	1	1	1	Female	45-54	4/9/2010 10:00:03 AM	i took this drug for almost 2yrs it destroyed my thyriod made me gain alot of weight plus it could turn your skin blue forever!and i still went into vtach.
Atrial Fibrillation	 Male  (Patient) 	4	4	4	Male		4/8/2010 11:54:00 AM	This is a test by QA....
Paroxysmal Atrial Fibrillation	sharon, 55-64 Female  on Treatment for 2 to less than 5 years (Patient) 	5	5	5	Female	55-64	4/6/2010 5:53:57 PM	I was put on the drug after my pacemaker/ def. implant because I was in danger of my heart stopping due to numerous fast beats, skipped beats, and slow beats.  I stayed on it about two years on a low dose.  My physician had blood drawn every 4-6 weeks to watch for liver and any other organ problems.  He sent me to eye and lung specialist also to monitor me.  I believe if you have a good physician, you can help yourself by being very active in your care and follow-up any symptom immediately.  It is a dangerous drug with many side effects and every one reacts differently.  I am the lucky one with this drug.  Fortunately I no longer need the drug.
Ventricular Rate Control in Atrial Fibrillation	65-74 Male  (Patient) 	1	4	3	Male	65-74	3/29/2010 2:59:40 PM	
Atrial Fibrillation	55-64 Male  on Treatment for 1 to less than 2 years (Patient) 	5	5	4	Male	55-64	3/24/2010 9:20:37 PM	no problems
Atrial Fibrillation	gwr5br, 55-64 Female  on Treatment for 1 to less than 2 years (Patient) 	2	3	1	Female	55-64	3/19/2010 7:34:06 PM	After taking this medication for a year or two my cardiologist cut the dosage in half.  I started having shortness of breath upon exertion, walking, step climbing, etc.,and was sent to a lung specialist.  After a number of Cat Scans, X-rays, PFT (pulmonary function test)and a lot of blood work, it was determined that I had interstitial lung disease.  Recent tests have indicated that this is clearing up somewhat and the doctormentioned that Amiodarone could have been the culprit. My cardiologist took me off this drug as soon as I was diagnosed with ILD and put me on Multaq. 
Atrial Fibrillation	elainrichmond, 65-74 Female  on Treatment for 6 months to less than 1 year (Caregiver) 	1	1	1	Female	65-74	3/15/2010 8:56:13 PM	this drug killed my husband
Atrial Fibrillation	35-44 Female  on Treatment for 2 to less than 5 years (Patient) 	4	4	1	Female	35-44	3/1/2010 4:28:43 PM	I was on Amiodarone for 3 years for atrial fibrilation. Although it worked very well for me, it has caused me to have permanent damage to other organs. I have thyroid problems and more seriously, lung and liver damage. I now have moderate to severe lung fibrosis and cirrhosis of the liver. I am now awaiting a liver transplant.
Atrial Fibrillation	maggie, 55-64 Female  on Treatment for 1 to less than 2 years (Caregiver) 	1	1	1	Female	55-64	2/8/2010 5:15:33 PM	My husband passed away in April 2009, he was taking amiodarone on and off since 2004 for Afib, the drug has terrible side effects that the drs., didn't mention. My husband got pulmonary fibrosis from this drug, to make a terrible story short he passed away from pulmonary fibrosis and ARDS which this drug also causes. He had a terrible time when he was on this drug, but still NO dr told us of the side effects, this drug should not be given to anyone without a signed consent form saying that the dr has told them that this drug can cause death. Amiodarone caused my husbands death, please if your dr wants to put you on this drug make sure you know about all the side effects, it is to late for my husband but maybe not to late for you,
Atrial Fibrillation	65-74 Male  on Treatment for 5 to less than 10 years (Patient) 	4	4	4	Male	65-74	2/8/2010 1:29:54 AM	Without it, I go into afib and sometimes spend several days in the hospital getting the heart regulated
Atrial Fibrillation	lilann, 55-64 Female  on Treatment for 1 to 6 months (Patient) 	5	4	1	Female	55-64	2/5/2010 2:53:51 PM	A horrible drug! I started it in July and stopped in September due to a rash. I lost my appetite and it has messed up my Thyroid so NOW I am on thyroid meds to straighten it out. When I stopped taking amiodarone-with Dr's permission- I started vomiting and just felt awful which lasted about a week even Pepcid didnt help. And my hair is thinning out--one of the side effects of amiodarone-it started in October. Cant wait until this drug leaves my system! If I had read about it before I got on it I would have screamed NO !!!!!!!!! There are other drugs out there so ask your Dr to prescribe something else. 
Atrial Fibrillation	75 or over Male  on Treatment for 1 to 6 months (Patient) 	5	3	5	Male		1/29/2010 1:16:38 AM	causes coughing
Atrial Fibrillation	IRREVERSABLY BLIND, 55-64 Male  on Treatment for 1 to 6 months (Caregiver) 	2	4	1	Male	55-64	1/26/2010 12:05:21 AM	I am writing this for my friend WHO IS PERMANATLY BLIND NOW AFTER 5 MONTHS OF THIS DRUG.  First symtom was what felt like slightly blurry or tired eyes at night.  Then suddenly 3 month into it his right eye was compeltely and fully blind.  He came off the meds, but it does leave your body slowly.  Over the next 2 months his left eye became more slowly blind, but completely and irreversably blind.  
Atrial Fibrillation	helen82632@aol.com, 75 or over on Treatment for less than 1 month (Patient) 	4	5	3			1/10/2010 4:03:04 PM	This drug has greatly helped the atrial fibrillation but my legs and feet are very swollen and slightly discolored.
Atrial Fibrillation Electrically Shocked to Normal Rhythm	uncle, 65-74 Male  on Treatment for 5 to less than 10 years (Patient) 	1	1	1	Male	65-74	1/8/2010 8:12:06 AM	This medication has damaged my liver and has stopped me from being functional. I am not happy with the way this medication is affecting my health. I am not the same person I was before I took this medication. I need help because I want to know how to take care of my liver while being ob this medication.
Atrial Fibrillation Electrically Shocked to Normal Rhythm	 Male  on Treatment for 6 months to less than 1 year (Patient) 	4	4	4	Male		1/6/2010 8:59:35 AM	HAve been able to hold steady heart rate now for over a month. very pleased.
Atrial Fibrillation Electrically Shocked to Normal Rhythm	John97405, 55-64 Male  on Treatment for 1 to 6 months (Patient) 	5	5	5	Male	55-64	1/3/2010 12:40:02 AM	After the Sotolol I was taking(the latest of a series of antiarrhythmics I have tried over a five year period) ceased to be effective, I talked with my physician about amiodarone and did my online research.  The potential side effects sounded so dire I elected to try to live with the AFib, taking a beta blocker to maintain heartrate.  This didn't work out for long due to shortness of breath and general lack of energy. So my cardiologist and I decided to try the amiodarone, then eventually switch to the newer Multaq.  I took 800mg per day for 4 weeks prior to having a cardioversion.  Then 400mg per day for two weeks following the cardioversion.  An EKG proved I was still in rhythm, so I was dropped to 200mg per day, which I am still taking.  I have been on amiodarone for 14 weeks now, and am still in rhythm 10 weeks since the cardioversion.  Fortunately I have been feeling great, with no side effects whatsoever.  Quite frankly, this is the best I've felt in five years, and now have the energy to have regular workouts and long walks, and have lost 20 pounds so far.  I am very happy with this medication so far.  
Atrial Fibrillation	Rusty, 55-64 Male  on Treatment for 1 to 6 months (Patient) 	1	1	1	Male	55-64	12/30/2009 10:58:13 AM	I was on it for 9 weeks. My side effects were to numerous to mention all of them.I hope and pray they will all go away. After taking myself off of it ,since the AF returned, I feel much better. My breathing has greatly improved and many of the other issues have as well. This drug is going on my list of allergies. I NEVER WILL TAKE IT AGAIN !!! Look up the side effects it may cause and you won't either.
Atrial Fibrillation	N/A, 75 or over Male  on Treatment for 2 to less than 5 years (Patient) 	4	4	4	Male		12/28/2009 8:02:12 PM	Has put my heart in sinus rythum
Atrial Fibrillation Electrically Shocked to Normal Rhythm	Frans1929, 75 or over Female  on Treatment for 1 to 6 months (Patient) 	5	4	4	Female		12/18/2009 6:56:55 PM	Seems to work well ...stay tuned ...  29 + year old women.. ready to get with it!
Prevention of Post Cardio-Thoracic Surgery Atrial Fibrillation	Mysterh, 45-54 Male  on Treatment for 1 to less than 2 years (Patient) 	2	3	1	Male	45-54	12/18/2009 12:00:23 PM	Took for two years after surgery and early episode of a-fib.  I just recently came off it. I cannot be sure if my symptoms of general fatigue have been related to the medicine or to the trauma and surgery my body underwent.  After two years i would expect more phiysical improvement but I feel the amiodarone has stifled my progress.  Glad to be off this risky drug.
Rapid Ventricular Heartbeat	missmam6, 55-64 Female  on Treatment for 1 to 6 months (Patient) 	2	1	3	Female	55-64	12/9/2009 6:23:30 AM	itching,bumps in face,nausa,not sleeping.
Atrial Fibrillation Electrically Shocked to Normal Rhythm	65-74 Male  on Treatment for 1 to 6 months (Patient) 	3	3	2	Male	65-74	12/5/2009 6:21:22 PM	
