Needing to Urinate Immediately	Shelia172, 45-54 Female  on Treatment for less than 1 month (Patient) 	3	4	2	Female	45-54	8/27/2012 12:18:31 PM	Took for 5 days, helped the bladder problem, however I experienced dry mouth and moderate degree headaches/dizziness. Will discontinue use.
Frequent Urination	Stashiywtfv, 75 or over Male  on Treatment for less than 1 month (Patient) 	1	3	1	Male		8/7/2012 8:21:20 AM	I took this drug for one week and had to go to the emergency room because I was in severe pain from not being able to go at all. Almost a quart of urine was still in my bladder. The doctor put in a catheter but I was admitted for 2 days because my kidney tests wer too high. I was not able to go after the catheter came out. This drug has really made my life worse. I would rather go often than have to live with this catheter.
Needing to Urinate Immediately	65-74 Female  on Treatment for less than 1 month (Patient) 	3	4	1	Female	65-74	8/2/2012 8:50:51 PM	does not seem to work
Needing to Urinate Immediately	Maggieb, 55-64 Female  on Treatment for less than 1 month (Patient) 	3	1	1	Female	55-64	7/28/2012 4:31:29 PM	I took this drug for 1 day and my mouth was so dry it was impossible to stay on it. I was more focused on my dry mouth than anything else. Water,sugar-free candy did not help. The next morning I woke up with the skin on my lips peeling fom the extreme dryness. I won't take it again. The side effect definitely rules this drug out for me.
Frequent Urination	auntof3sjb1017, 45-54 Female  on Treatment for less than 1 month (Patient) 	3	4	3	Female	45-54	7/26/2012 2:23:38 PM	So far, so good. Urologist said it would take two to three weeks for it to take the full effect.  I want it to work sooner, I don't have the patience to be pissing every 5 mintues.
Frequent Urination	laura, 35-44 Female  on Treatment for less than 1 month (Patient) 	1	2	1	Female	35-44	6/25/2012 7:16:14 PM	Side effects were worse than urinating every twenty minutes. 
Other	Buckles, 25-34 Male  on Treatment for less than 1 month (Patient) 	5	5	5	Male	25-34	6/24/2012 2:21:43 PM	Good stuff.  If it wasn't for Web MD's terms and conditions and abuse of their liability clause, I would be much more open and detailed.
Overactive Bladder	buddhasway, 45-54 Female  on Treatment for 5 to less than 10 years (Patient) 	5	5	5	Female	45-54	6/6/2012 9:42:30 PM	I have been taking Enablex for about 5yrs. now. It completely changed my life. No more Depends or trip planning based on bathroom availability. This stuff has totally improved my quality of life.
Overactive Bladder	55-64 Female  (Patient) 	4	5	4	Female	55-64	6/1/2012 1:47:00 PM	I took Enablex several years ago. It worked and I did not feel dried out. Then I decided to stop and see if I still needed it. For two years I was doing fine. Then the urinary urgency returned. I had one unsed bottle left. I took it for 90 days. Then I tried to refill it. My insurance company (now different) refused to refill it!! So I am on my second trial of generic drugs which are more drying for me. I am a singer and it peeves me that I can't take what worked for me. As far as constipation concerns..I had this problem anyway but I find that sprinkling flax on my cereal turned me in to a &quot;regular&quot; person! I know that all drugs don't work for all people bur I liked enablex and I am peeved my insurance company won't pay for it now. 
Needing to Urinate Immediately	silvergale, 65-74 Female  on Treatment for 1 to less than 2 years (Patient) 	3	4	4	Female	65-74	4/27/2012 6:54:44 PM	still have a problem
Overactive Bladder	rushing, 65-74 Female  on Treatment for 1 to less than 2 years (Patient) 	2	5	2	Female	65-74	4/7/2012 10:45:03 AM	At first the problem seemed to get better but after a year or so on it, I feel like I must have something else to help solve this problem. I have the 'sling' and it did nothing to help that I can tell.
Needing to Urinate Immediately	 Male  on Treatment for 6 months to less than 1 year (Patient) 	1	3	1	Male		4/4/2012 2:52:36 PM	Over a period of time  6 months became incontinent!  as soon as the medication was stopped the incontinence cleared up!
Overactive Bladder	45-54 Female  on Treatment for 1 to 6 months (Patient) 	3	4	1	Female	45-54	4/4/2012 11:20:15 AM	Have been taking 15mg once a day for several weeks now. Is helping somewhat, but my eyes have gotten so dry that my contacts are sticking to my eyes and had a HARD time getting them out! And it really does dry my mouth out also. Guess will have to decide if these side effects are not as objectionable as the urinary problems...
Overactive Bladder	olgagal, 75 or over Female  on Treatment for 2 to less than 5 years (Patient) 	5	5	5	Female		3/6/2012 3:27:50 PM	I have used Enablex off and on for 3 years. I have not experienced any of the side effects mentioned. I add 2 T ground flaxseed to my breakfast each day, and that has enabled me to avoid constipation from almost any cause.
Overactive Bladder	Lolo, 55-64 Female  on Treatment for 1 to 6 months (Patient) 	3	4	2	Female	55-64	11/26/2011 8:44:20 AM	Started on 7.5mg tab in Feb. 11 and have had 3 UTI in 6 mos! Currently have a terrible UTI where most given meds aren't helping. My doctor told me to stop taking and I have constant cramping, aching in pelvic, bladder area. She believes my bladder isn't emptying fully. I am 56 yo female nurse and have had 2 UTIs in my life, up until now. The leaking has started again (but could be from UIT), and my back hurts so bad, I have been in bed 3 days. My urine is foul smelling, like ammonia! I guess I will be doing Kegels!
Frequent Urination	HELP, 75 or over Male  on Treatment for less than 1 month (Patient) 	3	2	1	Male		9/26/2011 9:05:25 AM	I HAVE OVERACTIVE BLADDER URINATE EVERY1-1/2 HOURS TOOK ENABLEX 15 MG TABLES FOR TWOWEEKS. SLOWED URINATION DOWN TO EVERY 3 HOURS. NOW I HAVE BLURRED VISION? NOW WHAT TO DO ANY IDEALS?   
Overactive Bladder	grandmatweety, 45-54 Female  on Treatment for 6 months to less than 1 year (Patient) 	5	5	4	Female	45-54	9/11/2011 9:32:16 AM	Works great and I am able to skip it some days.
Needing to Urinate Immediately	goldenfawn, 65-74 Female  on Treatment for less than 1 month (Patient) 	5	5	4	Female	65-74	9/1/2011 8:21:25 AM	It really works!  I tried it for 5 days and what a relief.  The side effects were too many and had to stop (for now).  Hopefully, I'll be able to try it again.
Overactive Bladder	65-74 Female  on Treatment for 1 to 6 months (Patient) 	5	5	5	Female	65-74	8/30/2011 1:56:27 PM	have been taking for 3 months and helped so much. no accidents. i can tell when i must go and no more false trips to bathroom. it has been a Godsend.
Overactive Bladder	Granny49r, 55-64 Female  on Treatment for less than 1 month (Patient) 	5	5	5	Female	55-64	6/9/2011 6:52:14 PM	I experienced immediate improvement after having a very overactive bladder--having to change clothing 2 to 3 times a day due to inability to contain urge to urinate before using toilet.  I am so pleased with my response to Enablex and will continue to take it daily!
Urine Leakage When there is a Strong Desire to Void	35-44 Female  on Treatment for 1 to 6 months (Patient) 	5	5	5	Female	35-44	6/8/2011 11:50:22 PM	Very pleased with this medication.  I wish it was a little cheaper.  It has a high co-pay.  Def worth it!  It does give me heartburn. 
Frequent Urination	boondock5@verizon.net, 65-74 Male  (Patient) 	2	4	1	Male	65-74	5/31/2011 2:45:42 PM	The first nite i used this med it worked...i'm on my 5th nite and still get up 4to5 times a nite...i'm frustrated...
Needing to Urinate Immediately	abigail,  Female  on Treatment for less than 1 month (Caregiver) 	3	3	3	Female		5/22/2011 4:23:52 PM	what time should my mom take enablex?   day or before bedtime
Overactive Bladder	75 or over Female  on Treatment for 6 months to less than 1 year (Patient) 	1	3	1	Female		5/1/2011 12:58:06 PM	it is not stopping the leakes and freq.
Frequent Urination	averageguy60, 55-64 Male  on Treatment for less than 1 month (Patient) 	3	4	3	Male	55-64	4/29/2011 10:40:06 AM	I scanned all the reviews. So here is the result. Based on the data presented here by people who have taken, and are taking this medicine, apparently this drug works better, and with less negative side effects on male individuals than females. I am leaning toward this idea, that most likely the makers of this drug had male problems on their mind than females. Don't you think so? 
Overactive Bladder		2	5	2			3/27/2011 10:24:28 PM	
Frequent Urination	75 or over Female  on Treatment for less than 1 month (Patient) 	3	5	2	Female		3/21/2011 4:41:18 PM	I can't make it to the toilet in time and when I go it comes all out of the toilet.
Overactive Bladder	65-74 Male  on Treatment for 6 months to less than 1 year (Patient) 	1	4	1	Male	65-74	3/18/2011 2:15:59 PM	increased incontinence
Overactive Bladder	amber, 19-24 Female  on Treatment for less than 1 month (Patient) 	5	5	5	Female	19-24	3/13/2011 4:54:47 PM	Not having to urinate as often!
Frequent Urination	jorge, 75 or over Male  on Treatment for 1 to less than 2 years (Patient) 	1	5	1	Male		3/6/2011 5:05:44 PM	Frequent urination is getting worse, still have to go to the bathroom every thirty minutes At night I often wakeup every hour to go to the bathroom Enablex does no work for me.  What should I do.
Frequent Urination	Gottago, 65-74 Male  on Treatment for less than 1 month (Patient) 	2	3	2	Male	65-74	1/27/2011 11:39:41 PM	I was using Detrol LA, but plan no longer pays for it.  Doc put me on Enablex about 3 weeks ago.  Working well for the urinary problem, but  constipation and dry mouth are almost as bad as the uninary problem.  Going to look for some other answers. 
Needing to Urinate Immediately	iuay7i, 55-64 Female  on Treatment for less than 1 month (Patient) 	3	5	3	Female	55-64	1/22/2011 1:00:29 PM	Took it for 1 week it seemed to help. Then I got a rash on my leg next day rash on the other leg.  Very dry mouth, drink more and pee alot more. I stopped the drug and the rash went away, but I feel like I'm going to leak again. 
Overactive Bladder	Nan, 65-74 Female  on Treatment for less than 1 month (Patient) 	2	2	1	Female	65-74	12/27/2010 10:29:28 AM	This is the 4th drug I've been on - Detrol LA was the best but stopped working after 6 mos. This drug after 2 days has me so binded up that I have been taking prune juice (1/2) bottle to un-do the problem. Will stopped taking today.  Don't know what to do now.
Urine Leakage When there is a Strong Desire to Void	13-18 Male  on Treatment for less than 1 month (Caregiver) 	1	4	1	Male	13-18	11/13/2010 8:32:29 PM	My son is trying this med because detrol changed his behavior so much. He takes this in the am to help control leaking. He has no bladder control and actual has an AMS 800 implant. He takes meds at night so he can pee in the am and this so he can control himslef at school. He can not void at all, just dribbles and and is having back pain. Also, can see some behavior change but not as bad as detrol. We are going to discontinue. 
Frequent Urination	65-74 Male  on Treatment for 6 months to less than 1 year (Patient) 	2	4	2	Male	65-74	11/2/2010 6:40:15 PM	
Overactive Bladder	Joe, 45-54 Male  on Treatment for 6 months to less than 1 year (Patient) 	3	5	3	Male	45-54	10/30/2010 10:41:41 PM	It somewhat works. Not as well as I had hoped. I take it 2 hrs before bedtime and stop all liquids before that. I still get up several times a night to pee and must pee before I do anything where a bathroom is not available or I need to stay in the room or car.It doesn't work well for everyone and I'm one of those people.
Urine Leakage When there is a Strong Desire to Void	55-64 Female  on Treatment for less than 1 month (Patient) 	1	5	1	Female	55-64	9/3/2010 6:39:23 PM	no change
Frequent Urination	55-64 Male  on Treatment for less than 1 month (Patient) 	3	5	3	Male	55-64	8/22/2010 5:06:24 PM	I have been taking this med 15mg at night and already it seems to be helping, but am concerned about side affects, witch include dry mouth. I am a 56 year old bodybuilder and during the competitive season I drink over a gallon of water a day, I know this contributes to the frequency of bathroom trips, but it's something that I have been doing since I was 14. I'm thinking I'm not sure if I should be taking this drug. Other than that I feel great. 
Urine Leakage When there is a Strong Desire to Void	dorbheld, 75 or over Female  on Treatment for 1 to 6 months (Patient) 	5	5	5	Female		8/13/2010 3:08:48 PM	Has stopped the urgency &amp; helped the lack of control.  Has also helped another problem-frequent diarrhea. but I can only take a half a pill a day,otherwise it causes constipation.
Frequent Urination	65-74 Female  on Treatment for 2 to less than 5 years (Patient) 	3	5	3	Female	65-74	7/20/2010 9:46:53 AM	
Overactive Bladder	dottyp, 65-74 Female  on Treatment for less than 1 month (Patient) 	3	4	4	Female	65-74	7/10/2010 3:30:41 PM	I just started Enablex about a week ago and find it is helping quite a bit.  I will continue using this pill for now.  
Overactive Bladder	55-64 Female  on Treatment for 1 to 6 months (Patient) 	2	3	1	Female	55-64	6/11/2010 3:24:15 PM	Severe constipation.  I am still having incontinent episodes. 
Overactive Bladder	55-64 Female  on Treatment for 1 to less than 2 years (Patient) 	2	4	2	Female	55-64	6/10/2010 7:09:00 PM	This was about the 3rd different drug I have been on. Been on this one for about 1 1/2 yr. Worked good at first, but gradually problem has returned. Did kegals faithfully and feedback.  Now having to consider surgery (Interstim Therapy) with the little stimulator for the sacral nerve.  Medication caused extreme dry mouth which in turn make me drink more and have to urinate more.  
Urine Leakage When there is a Strong Desire to Void	friend, 55-64 Female  on Treatment for 2 to less than 5 years (Patient) 	3	3	3	Female	55-64	6/3/2010 11:31:00 PM	I would like to know other people's experience with Enablex vs. Vesicare.  Vesicare made me feel zonked, so I am trying Enablex, which may have the same complaint.  Vesicare is definitely more effective for controlling my urinary symptoms.  I think both cause me reflux if not taken with a substantial snack.  I think both casue drowsiness, so I take it at night.  Constipation is a serious problem with these drugs.  I take a stool softener, and that is not enough help.
Overactive Bladder	peepeelady, 35-44 Female  on Treatment for 1 to 6 months (Patient) 	3	4	3	Female	35-44	5/15/2010 6:05:12 PM	Has anyone had any weight gain? i have. i feel it is water retention... also dry mouth. Thank you no constipation : )
Needing to Urinate Immediately	Sil, 45-54 Female  on Treatment for less than 1 month (Patient) 	4	4	2	Female	45-54	4/30/2010 9:12:39 AM	It seems to help the frequent and immediate need to urinate, but not only is my mouth dry, but my facial skin is VERY dry and itchy.  I'm takin 15 ml, hoping a lower dose might alleviate that side effect.
Overactive Bladder	onefordgirl3, 45-54 Female  on Treatment for less than 1 month (Patient) 	1	5	1	Female	45-54	4/16/2010 5:28:37 AM	I have been taking this medication for a little more than a week and see no improvement yet. I will give it more time. I am going to try the patch also. I need something very strong. I actually need surgery.
Overactive Bladder	karmie916, 75 or over Female  on Treatment for less than 1 month (Caregiver) 	1	2	1	Female		3/15/2010 10:15:57 AM	the dry mouth was horrendous after 3 doses,but worse was the hallucinations experienced.  medicine stopped.  rather deal with a depends.
Needing to Urinate Immediately	helenbre35jo, 65-74 Female  on Treatment for 1 to 6 months (Patient) 	4	5	5	Female	65-74	3/6/2010 9:28:09 AM	I am able to hold urine better and I have lost 11 lbs on enablex. 
Urine Leakage When there is a Strong Desire to Void	EASYNSWEET, 65-74 Female  on Treatment for 1 to 6 months (Patient) 	5	5	5	Female	65-74	2/20/2010 6:38:30 PM	great drug ,it is working.
Urine Leakage When there is a Strong Desire to Void	katt2202, 55-64 Female  on Treatment for less than 1 month (Patient) 	5	5	5	Female	55-64	2/17/2010 7:57:41 AM	I have receooved more help frpm this drug than I have from Detrol or Vesicare. I actually can control my bladder and have very few accidents. I can go more places and do not have to constantly worry about accidents or having to take another change of clothes. I love it.
Frequent Urination	newly prescribed, 65-74 on Treatment for 1 to 6 months (Patient) 	1	5	1		65-74	1/31/2010 9:55:03 PM	have had side effects but no change in my condition. Side effects include dry mouth, dry skin, aching eyes (no glaucoma), impotence (never prior to taking Enablex). 
Frequent Urination	75 or over Male  on Treatment for less than 1 month (Patient) 	1	5	1	Male		1/31/2010 6:48:52 AM	2nd week @ 1 per day 7.5mg: I notice no effect.
Overactive Bladder	jdsp, 65-74 Female  on Treatment for 1 to less than 2 years (Patient) 	4	4	4	Female	65-74	1/28/2010 7:31:20 PM	
Frequent Urination	geb, 55-64 Male  on Treatment for less than 1 month (Patient) 	1	4	1	Male	55-64	1/14/2010 11:50:06 AM	Seemed to make problem worse.  Doctor now has prescribed Vesicare though not sure if its any better.
Frequent Urination	sucks to be a teen, 13-18 Female  on Treatment for 6 months to less than 1 year (Patient) 	4	5	3	Female	13-18	1/9/2010 6:08:18 AM	Well to start off I am only 17 and it feels like someone my age shouldn't have to be dealing with something like this but i have for 4 years now. I am taking the 7.5 MG pills and hoping to ask my doctor to give me the next dosage up from this. I have never been constipated while taking Enablex. Dry mouth is a side effect with most medicines and that is the only one I have gotten. I have been on several others and this one almost does the job perfectly. Concerts, Movies and trips to the mall can still be a bit of a hassle but this makes it a bit easier. Wish I could be back to perfect with out it though.
Overactive Bladder	BVersoy, 65-74 Female  on Treatment for less than 1 month (Patient) 	4	4	4	Female	65-74	1/1/2010 10:01:28 PM	
Overactive Bladder	allbears4me, 55-64 Female  on Treatment for 6 months to less than 1 year (Patient) 	4	5	4	Female	55-64	12/30/2009 10:44:31 PM	what is the dosege
Overactive Bladder	dectrol,  on Treatment for 2 to less than 5 years	3	4	4			12/8/2009 11:19:21 PM	
Overactive Bladder	pattyjs, 45-54 Female  on Treatment for 1 to 6 months (Patient) 	3	5	2	Female	45-54	12/3/2009 6:58:00 AM	Stopped taking after a month because of constipation.
Frequent Urination	myheart, 55-64 Female  on Treatment for less than 1 month (Patient) 	1	1	1	Female	55-64	10/25/2009 9:25:53 AM	
Overactive Bladder	marcccc, 55-64 Male  on Treatment for less than 1 month (Patient) 	5	4	1	Male	55-64	10/23/2009 6:17:03 PM	Unbearable side effects, such running nose, coughing, elbow pain, hardening year wax.
Overactive Bladder	iluvmykidz, 25-34 Female  on Treatment for 1 to 6 months (Patient) 	3	1	1	Female	25-34	9/24/2009 3:31:26 AM	I took enablex for two months. As it prevented me to take less trips to the restroom, the side effects were too much for me. It seemed to dry me out alot, my throat, nose, and I think even my ears. Now I am having problems with my ears. While I was on the med, my wax would harden extremely. Then I stopped the drug and now my ears will not stop draining. My Fam. Pract Doc said there is no infection. I am going back to see if its related as a side effect from the drug or not? Also seemed like I had weight gain. I will not take this drug again. 
Frequent Urination	ghsrep, 65-74 Male  on Treatment for 1 to 6 months (Patient) 	2	5	1	Male	65-74	9/21/2009 10:43:52 PM	keeps me safe in the daytime but hardly effective at night. Still getting up 2-4 times a night. Usually take about 7pm and try not to drinkafter taking med.
Urine Leakage When there is a Strong Desire to Void	eod, 65-74 Female  on Treatment for less than 1 month (Patient) 	4	4	4	Female	65-74	9/16/2009 9:00:45 AM	 After reading reviews, decided not to fill prescription. I eliminated ALL carbonated beverages from my diet and have seen big improvement.
Overactive Bladder	35-44 Male  on Treatment for 6 months to less than 1 year (Patient) 	5	5	4	Male	35-44	8/21/2009 11:28:02 PM	I have taken Enablex for the past 2 months  for Frequency and I have noticed a dramatic improvement right away in my symptoms.  I tried Vesicare but Enablex is the BEST!!!
Overactive Bladder	CD, 35-44 Female  on Treatment for less than 1 month (Patient) 	5	5	4	Female	35-44	8/14/2009 7:44:56 PM	Worked immediately. No reflux or headache like I had with Ditropan. Dry mouth less severe than with Ditropan.  Only taken it once, and hope for the best.
Overactive Bladder	123med, 75 or over Female  on Treatment for less than 1 month (Patient) 	5	5	3	Female		7/29/2009 4:44:37 PM	No complaints with exception  of my lips being dry and white.
Frequent Urination	cowgirl, 55-64 Female  on Treatment for 2 to less than 5 years (Patient) 	3	4	2	Female	55-64	7/29/2009 3:24:28 PM	I find it only lasts about 18hrs..still getting up at noc 2-3x 
Overactive Bladder	learned the hard way, 65-74 Female  on Treatment for less than 1 month (Patient) 	3	4	1	Female	65-74	7/21/2009 9:54:53 PM	I had a urinary infection so intense (voiding blood), that I was in an emergency room at 4:00 in the morning, and spent the next two days in bed with a temperature.  I prefer the bladder leakage!
Frequent Urination	55-64 Female  on Treatment for 1 to 6 months (Patient) 	3	5	3	Female	55-64	7/20/2009 3:17:34 PM	I have been using this for almost 2 months. I used to be up 7 or 8 times per nght. Now am usually up only 2 times....occasionally back to the 7 times. I am tired all the time from lack of sleep and the dry mouth is no fun.
Overactive Bladder	You Too?, 45-54 Female  on Treatment for less than 1 month (Patient) 	3	5	2	Female	45-54	7/5/2009 10:09:42 AM	I just started taking Enablex 1 1/2 weeks ago.  For many years I have been on lots of anticholinergics... Ditropan XL, Detrol LA, and Vesicare.  I liked vesicare but my vision was VERY blurry and stopped after a few months.  With Enablex I got SOOOO CONSTIPATED after just 1 week and didn't even realize it was a problem until one morning I thought I was going to have to go to the hospital to void.  Worst yet, I'm getting large HIVES on various parts of my body.  They have a yellow center and are very itchy.  Some have lasted one week now, with new ones developing daily.  Is this from the Enablex???  I can't think of anything else I have changed in my routine.  It must be.  When I looked it up on webMd it said a side effect was 'Giant Hives' but they were rare and listed them as serious.  My next step is to stop taking it and see if they go away.  Anybody else having hives with Enablex?  They look like giant bug bites.
Overactive Bladder	keekat99, 45-54 Female  on Treatment for 1 to less than 2 years (Patient) 	5	5	5	Female	45-54	6/14/2009 12:15:57 AM	I have taken another med for my overactive baldder but this one is the best. once aday and i don't wet on myself during the day.
Frequent Urination	wppxmermaid@aol.com, 65-74 Female  (Patient) 	1	5	1	Female	65-74	6/9/2009 10:26:32 AM	Medicine does not stop frequency and caused swelling in my feet and ankles.
Overactive Bladder	25-34 Female  on Treatment for 1 to 6 months (Patient) 	5	5	4	Female	25-34	6/1/2009 8:32:26 PM	I have been taking this medicine for nearly 6 months.  It has stopped most if not all of my leaks.  I have developed a UTI from it once and believe that it is giving me pain near my kidneys.  I want to go off of it, but I am scared of the leaks coming back.
Frequent Urination	brody, 55-64 Female  on Treatment for less than 1 month (Patient) 	3	5	1	Female	55-64	5/31/2009 8:45:15 PM	after taking this drug for 4 wks, My feet and legs began swelling- a lot
Needing to Urinate Immediately	weeza, 45-54 Female  on Treatment for 6 months to less than 1 year (Patient) 	4	5	4	Female	45-54	4/11/2009 11:52:26 AM	After several months of taking Enablex, I had drastic improvement.  I have been taking it for about 8 months now, but Enablex seems not to be working as well.  I am taking an anti-inflammatory drug called Mobic.  I would like to know if it is the cause.
Frequent Urination	65-74 Male  on Treatment for less than 1 month (Patient) 	1	5	1	Male	65-74	4/4/2009 10:10:53 AM	I had a problem with frequent urination. I took the drug for a week and the only difference I could tell was that my strem was weaker.
Frequent Urination	lilbear1825, 35-44 Female  on Treatment for 1 to 6 months (Patient) 	2	5	2	Female	35-44	2/24/2009 6:07:24 PM	I just took it til it ran out but have not had any changes in this or detrol 
Overactive Bladder	55-64 Female  on Treatment for 1 to 6 months (Patient) 	1	1	1	Female	55-64	1/18/2009 2:34:47 PM	This medication works for only 2 hours.
Urine Leakage When there is a Strong Desire to Void	Robert, 65-74 Male  on Treatment for less than 1 month (Patient) 	3	4	1	Male	65-74	1/15/2009 7:22:19 PM	This drug caused dry mouth, dizzenes,and a rash on my legs, arms, back,and top of my Head. I have discontinued using Enablex.
Overactive Bladder	blossom, 45-54 Female  on Treatment for 1 to less than 2 years (Patient) 	5	5	5	Female	45-54	12/31/2008 11:59:50 AM	I had a problem when I was young having many accidents.  Then I was told that I had an weak bladder.  I needed a doctors note for school.  At school I was told that when I had to go to the bathroom, I could just leave the classroom at any given time.  
