Other	Alejandra, 25-34 Female  on Treatment for less than 1 month (Patient) 	5	4	1	Female	25-34	8/22/2010 5:18:27 AM	I am a Trivora user, and my new pharmacist gave me Enpresse instead of my usual Trivora. I am very apprehensive about continuing this medication considering the reviews and I wasn't too thrilled about Enpresse anyway. It is the second day of my cycle and I think I will switch back to Trivora and use Enpresse as an EC. So far, I have noticed a little swellling in my fingers, I am sleepy, and mildly nauseous. I hope that my side effects don't worsen if I continue this drug.
Birth Control	dunkinkatie@yahoo.com, 19-24 Female  on Treatment for 1 to less than 2 years (Patient) 	5	5	1	Female	19-24	6/13/2010 4:32:37 PM	i switched from trivora and i have gained lots of wait and am always in a bad mood
Birth Control	Disappointed, 19-24 Female  on Treatment for 2 to less than 5 years (Patient) 	1	1	1	Female	19-24	8/6/2010 9:23:33 AM	I was on Enpresse for 3 years and I am very healthy, fit, and have never smoked.  I ended up having a TIA (small-stroke).  I was tested and they found absolutely nothing wrong with me.  I can only conclude that my families history with strokes and taking birth control was a bad combo.  If your family has a history of strokes...I don't recommend this from my experience.  I had to go through major and expensive testing and will never be able to take birth control again.  (I was only 23)
Birth Control	I HATE enpresse, 25-34 Female  on Treatment for less than 1 month (Patient) 	1	1	1	Female	25-34	7/1/2010 5:01:08 PM	I just got on this birth control and am VERY TIRED ALL THE TIME! I used to take Trivora and my doc prescribed Triphasil but the pharmicist gave me this. This birth control sucks and I am getting off of it!
Birth Control	CamoQueen, 19-24 Female  on Treatment for 6 months to less than 1 year (Patient) 	5	5	2	Female	19-24	6/25/2010 2:04:24 PM	With Enpresse ive managed to gain weight wich wasnt in the plan. Ive been real emotional, moody, and depressed. I was taking Sprintec. Next month when i go to the doctor im going to get a different pill. I do not recomend Enpresse.
Birth Control	briieme, 19-24 Female  on Treatment for 2 to less than 5 years (Patient) 	4	4	1	Female	19-24	5/15/2010 2:38:02 AM	First off, I switched to the pill from Ocella because I was having really bad mood swings the few days before my period. Now that I'm on this pill, I have moodiness, mood swings, and depression all month. I usually get cramps about 4 days a year and on my first period with this pill I had cramps three days. I also had pretty heavy spotting for the first three days after taking the pill and after my first period on the pill. It was more than just a few drops. I have a reduced appetite and enlarged breasts, which isn't too bad, but the mood swings are already wrecking my relationship with my boyfriend and have made me constantly confused with my behavior and stressed. The person that I am on Empresse isn't the real me. That a birth control pill has this much control over my emotions is worrisome. I am going to call my doctor on Monday and ask about switching.
Birth Control	Jules, 19-24 Female  on Treatment for less than 1 month (Patient) 	3	4	1	Female	19-24	5/10/2010 8:36:16 AM	I am very unhappy with Enpresse. I have had abnormal bleeding, horrible cramps, breast tenderness, increase in appetite and I've gained 4 pounds in 3 weeks. I am talking to my doctor today to switch to something else. I do not recommend this birth control pill.
Birth Control	35-44 Female  on Treatment for 1 to 6 months (Patient) 	5	5	1	Female	35-44	5/7/2010 6:16:16 PM	After taking Trivora, I changed to Enpresse after changing pharmacies. I experienced weight gain, swelling, breast tenderness and emotional lability. I've switched back to Trivora
Birth Control	25-34 Female  on Treatment for 2 to less than 5 years (Patient) 	5	5	5	Female	25-34	5/4/2010 11:23:57 AM	I've taken this for over two years and have had no noticable side effects. I have very light periods, no cramping, and no headaches. I'm ore concerned with trying to get preganat after I'm married because I've been on some sort of BC for 15 years.
Birth Control	19-24 Female  on Treatment for less than 1 month (Patient) 	4	3	1	Female	19-24	4/27/2010 9:43:42 PM	
Birth Control	kfj, 35-44 Female  on Treatment for 1 to 6 months (Patient) 	4	4	1	Female	35-44	4/9/2010 10:06:57 AM	I always swore there was a difference when i took this or Trivora!  Glad im not the only one.  Horrible symptoms on empresse. no sex drive,depression,  -FINE on trivora!
Birth Control	Wendy, 35-44 Female  on Treatment for less than 1 month (Patient) 	5	5	2	Female	35-44	4/7/2010 9:39:21 AM	Two days after taking this medication I started breaking out, and I'm almost 40. My face is dry and chapped and I looked like I gained 5 years in age. I also can't stop eating.
Birth Control	Micky, 13-18 Female  on Treatment for less than 1 month (Patient) 	5	5	4	Female	13-18	3/30/2010 11:32:55 PM	I am 18 years old. In the past 6 months I have taken 3 different BC pills. For the first four months I took Tri-Lo-Sprintec, a generic for Ortho-Tri-Cylen Lo. I had to switch to the brand name briefly because Tri-lo-sprintec was removed from the market. I was very upset because it was a wonderful pill with minimal side effects for me. I switched to Enpresse this month because I no longer have precription coverage. So far the only side-effects I've encountered are very tender, swollen breasts. I have been able to lose weight on this pill and so far have had no break through bleeding. I have been very nauseated when I wake up this week. I am attributing this to the pill because I am not pregnant. Overall, I can say that I am pleased with my experience so far. I will repost with an update if I am dissatisfied for any reason. BC pills prevent your body's natural processes; sure it's going to be upset with what you're doing.
Birth Control	19-24 Female  on Treatment for 1 to 6 months (Patient) 	5	5	2	Female	19-24	3/10/2010 11:26:33 AM	This is the first and only pill I've ever taken and my breasts have been pretty sensitive and a little swollen ever since I started taking Enpresse, which was in December of '09, and I get cramps randomly through out the month. I'm definitely going to talk to my doctor about possibly switching.
Birth Control	35-44 Female  on Treatment for 1 to 6 months (Patient) 	5	5	1	Female	35-44	1/19/2010 5:25:14 PM	Since the pharmacy switched me to Enpresse I have put on a few pounds, but the worst side effect is my face is broken out and I am 42 yrs old.  My complexion has NEVER been a problem.  I am back on Trivora 28 and have switched pharmacies.
Birth Control	Jen, 25-34 Female  on Treatment for 1 to 6 months (Patient) 	5	5	2	Female	25-34	1/13/2010 8:14:19 AM	My pharmacy switched me from Trivora to Enpresse because it was cheaper. I now have an uncontrollable appetite, cramps all month long, bouts of depression a day or two at a time, and my headaches have increased. All my period symptoms are amplified; cramps, bloating, swollen breasts, moodiness. I rarely had any symptoms at all with Trivora. 
Birth Control	Forty Something, 35-44 Female  on Treatment for 5 to less than 10 years (Patient) 	4	3	1	Female	35-44	1/8/2010 3:02:06 PM	I took Triphasil for years happily but was switched to Empresse, the generic brand, several years ago.  I went off this drug last month.  I had the nausea, throwing up, bloating, breast pain, and severe headaches (probably migraines but never got it diagnosed) for the past several years at the same time every month which lasted one to two weeks depending on the side effect.  The doctor said my hormones were changing because of my age and some of these symptoms were normal for those entering their forties.  Now I know that these horrible side effects were caused by Empresse.  All of these side effects stopped last month when I stopped taking this drug.   
Birth Control	bikinbabe06, 25-34 Female  on Treatment for less than 1 month (Patient) 	1	1	1	Female	25-34	1/6/2010 12:26:48 PM	I received Enpresse in place of my usual Trivora. The Pharmacist says &quot;it's the same thing&quot;. WEll...it's not. I'm only on my 2nd week. I can't stop eating, I've gained 3lbs, my boobs are swollen, stomach bloated, moody-more than the norm, and break through bleeding. I'm not taking it anymore. I'm getting Trivora back. This substitution B-S should be illegal!!!! 
Birth Control	gracie, 25-34 Female  on Treatment for less than 1 month (Patient) 	3	4	1	Female	25-34	1/2/2010 2:05:07 PM	Just started taking this pill for about 3 days and have been getting headaches that feel like migranes. Feeling light headed and wanting to vomit. I've never had side effects with the bc pill but with this one i have. 
Birth Control	none, 25-34 Female  on Treatment for less than 1 month (Patient) 	4	5	1	Female	25-34	12/17/2009 11:25:25 AM	I had also been on Trivora and received Enpresse when I went to get my refill.  This is my first month taking it and I have experienced a significant increase in appetite as well as extreme moodiness!  I am in the process of trying to get a new prescription from my doctor
Birth Control	froggie21281, 25-34 Female  on Treatment for 1 to 6 months (Patient) 	4	4	1	Female	25-34	12/15/2009 4:41:36 PM	I was on trivora 28 for about 3 years. my pharmacy switched me to enpresse as the new generric form. im 4 months i gained almost 20 lbs, and my cup size went up almost 2 sizes due to the pill! I as most women really am unsatasified with this!! I called my doctor and getting it switched immediately!!!
Birth Control	19-24 Female  on Treatment for 5 to less than 10 years (Patient) 	4	5	3	Female	19-24	10/24/2009 11:11:44 AM	I've been on trivora-28 for six years and they changed me to enpresse because it's the cheaper generic. I experienced a rapid weight gain, as well as breast tenderness, break through bleeding, unusual tiredness and rapid mood changes. They told me it'd be the same as taking Trivora. I'm very unhappy and am switching back to Trivora at the end of this month.
Birth Control	OLD USER, 45-54 Female  on Treatment for 1 to 6 months (Patient) 	1	5	1	Female	45-54	10/14/2009 4:40:23 PM	I HAVE BEEN ON TRI-LEVELIN AND OTHER BCP'S OVER THE PAST 30 YEARS AND WAS NOT OPPOSED TO TRY THIS WHEN SWITCHED TO THIS GENERIC BY THE DRUG PLAN.  UNFORTUNATELY, I HAVE BEEN EXPERIENCING HEADAHCES, NAUSEA, VISION CHANGES, MILD DEPRESSION, INCREASED MENSTRUAL PERIODS, LIGHT HEADEDNESS OVER THE PAST 3 MONTHS JUST PRIOR AND DURING MY CYCLES.  I HAVE CALLED MY DOCTORS TO MAKE CHANGES. I WAS VERY DISAPPOINTED THAT THIS GENERIC HAS SUCH SERIOUS SIDE EFFECTS ON ME.
Birth Control	`, 25-34 Female  on Treatment for less than 1 month (Patient) 	4	4	1	Female	25-34	9/21/2009 9:33:19 AM	With nothing else changing in my diet or general changes except for changing from Trivora, I experienced signficant mood swings and some weight gain.  This is my first month taking this pill and I will not get it again.  
Birth Control	JLO, 35-44 on Treatment for less than 1 month (Patient) 	3	3	1		35-44	9/15/2009 7:35:44 AM	This is my first month using Enpresse because my pharmacist switched manufacturers. I have been on the pill for 20 years and have never had a worse month than this one - horrible mood swings, severe depression and headaches. Did experience some constipation but did not make the connection until reading the other comments. I am switching back to Trivora - which gave me no adverse side affects. I hate when the pharmacy switches meds without warning. 
Birth Control	Leah, 25-34 Female  on Treatment for 10 years or more (Patient) 	5	4	1	Female	25-34	9/12/2009 9:46:12 PM	2 months ago I visited my pharmacy to pick up my prescription. They said that &quot;the manufactorer has changed the colors of the pills, but all else is the same&quot; Since then I've had horrible side effects, (extreme breast sensitivity and swelling). I know they changed something else besides the color and I'm VERY angry that they lied to me about it. After this month's pack, I'm changing pills.
Other	hje03, 19-24 Female  on Treatment for less than 1 month (Patient) 	3	5	1	Female	19-24	8/15/2009 7:35:59 PM	Very sick to my stomach and very dizzy. Would not recommend.
Birth Control	25-34 Female  on Treatment for less than 1 month (Patient) 	4	5	2	Female	25-34	8/3/2009 2:52:00 PM	I've been taking Trivora 28 for years. Enpresse is another generic for the same medication. The pharmacy switched me because Enpresse was cheaper.  Although they have the same active ingredients, I got very sick to my stomach while taking Enpresse. Severe abdominal pain, nausea, my bowels were irritated, and horrible cramps. I generally do not have a problem taking differnt generics with other mediations. However, something in Enpresse made me very very sick to my stomach. I am back on Trivora and do not have any problems. 
Birth Control	Minka, 19-24 Female  on Treatment for less than 1 month (Patient) 	3	5	1	Female	19-24	2/19/2009 10:11:22 PM	I actually had a minor stroke with this medication after taking it for one full week, and I'm only 20.
Absence of Menstrual Periods	mrzitly, 13-18 Female  on Treatment for less than 1 month (Patient) 	2	2	3	Female	13-18	1/26/2009 11:06:51 AM	im really scared i havent had my period in 5 mon im taking enpresse to regulate them and im a diabetic type1 will this work
Birth Control	25-34 Female  on Treatment for less than 1 month (Patient) 	4	5	2	Female	25-34	5/13/2008 4:24:43 AM	I haven't gone #2 with out the use of laxitives since I've started taking it. I have also have been very sick to my stomach. It makes me want to quit pills!
Birth Control	25-34 Female  on Treatment for less than 1 month (Patient) 	3	1	1	Female	25-34	4/11/2008 9:21:37 AM	really severe nausea and loss of appetite; would not recommend.  going back to portia.
Abnormally Long or Heavy Periods	13-18 Female  on Treatment for 1 to 6 months (Patient) 	3	5	3	Female	13-18	3/19/2008 9:52:15 AM	I have had 3 periods in 3 weeks i'm not happy stops then starts over and over
Birth Control		5	5	5			2/27/2008 11:37:17 AM	I was taking the brand name tryphasil for years then when my insurance didnt cover it anymore I started to take the generic which is Enpresse for the past 4 years now and have not had a problem at all
Birth Control	GiGI, 35-44 Female  on Treatment for 6 months to less than 1 year (Patient) 	5	5	3	Female	35-44	11/20/2007 7:28:58 AM	Not sure if thid id relsted but I have experience itching and a little swelling in my hands and feet since taking Enpresse???
Birth Control	19-24 Female  on Treatment for 1 to less than 2 years (Patient) 	5	5	5	Female	19-24	10/8/2007 10:16:51 PM	I have been very satisfied with Enpresse!
