Birth Control	tyh211, 25-34 Female  on Treatment for 1 to 6 months (Patient) 	4	4	2	Female	25-34	12/29/2009 2:06:28 PM	I have been on this pill for 10 weeks now and have been having &quot;spotting&quot; and a little &quot;breakthrough bleeding&quot; almost every day!  Its extremely frustrating because the whole reason why I chose loseasonique was to only have my period 4 times a year.  My appetite has increased slightly, and I've had minor mood swings here and there, but nothing major.  I understand that your body needs to adjust to a new BC.  I used to take Yasmin for years (which was great) but I decided to switch and try something different because I hate getting periods!From the other reviews I read on this website and others, it seems like the side affects of this pill are extreme, and overall no one seems very satisfied with it.  I'm going to continue with this pill for another month or so and hopefully the spotting and bleeding will stop.  I personally have had no other problems with using loseasonique, but the daily bleeding (even though it is minimal) is becoming such an awful nuisance and really needs to stop!!  Or I will have to go back to using Yasmin.Best of luck to everyone out there using loseasonique or whatever BC method you choose!  Wish me luck. :)
Abnormally Long or Heavy Periods	tmk711, 19-24 Female  on Treatment for 1 to 6 months (Patient) 	5	5	1	Female	19-24	12/6/2009 11:55:09 AM	I started taking this b/c because I have terrible cramps every month and my doctor suggested this. First month was fine, halfway into my second pack I started what seemed like a period, even had cramps! I am on my last week of my 3rd pack and still on this &quot;period&quot; It has been on and off for a month! I would rather have cramps than have to worry about starting a period. I also gained 6lbs and had bouts of acne that I never had before taking this.Talked to my doctor she said its completely normal. After this week I am done. Too good to be true! I would not recommend this b/c to anyone I know.
Painful Periods	25-34 Female  on Treatment for 1 to 6 months (Patient) 	2	4	2	Female	25-34	12/22/2009 3:33:53 PM	I am currently on week of the 3month pack. First 4 weeks was wonderful. No side-effects at all. Started spotting during week 5 which progressed to cramping and heavier periods since week 6. Cramping resolved after 1 week but continue to have period still. Not as worse as a regular one though but seems to last forever. Also worsened my migraines in the first 4 weeks. 
Painful Periods	birthy, 25-34 Female  on Treatment for 1 to 6 months (Patient) 	2	4	2	Female	25-34	12/17/2009 6:35:57 PM	My doctor placed me on this birth control due to my painful periods and pelvic pain.  I have had bleeding from the 2nd week I have taken the pill (I'm on the 7th week now).  Trying to be patient for results.  I believe this medicine has altered my moods and eating habits.  As of right now I am not satisfied with this birth control. 
Abnormally Long or Heavy Periods	MyAngel91704, 25-34 Female  on Treatment for 1 to 6 months (Patient) 	1	5	1	Female	25-34	12/14/2009 2:25:52 PM	I started taking this pill on November 15,2009...I did alright on it until December 8,2009....I have been bleeding for a week now...I think i would rather suffer with the cramps and headaches rather than bleeding for a week or more....
Birth Control	Spotter, 19-24 Female  on Treatment for 1 to 6 months (Patient) 	3	3	2	Female	19-24	12/13/2009 11:17:40 PM	Well, I haven't gotten pregnant yet, so that's good.On the first pack, once the second month rolled around, I spotted for about 6 or 7 weeks straight. It's gotten better, and I've been spotting less, but I'm still spotting a lot. I've noticed the tendency to start spotting around the first of each month of the pack, when I'd normally get a period. I used to suffer from painful periods, and haven't had any pain so far.I know some people said they've gained weight, which hasn't happened to me. However, my breasts have grown considerably. I'm not sure if this is due solely to the pill, or just my body, but I went from a small 36D to a 36DD, so I'm kind of hoping they'll stop growing. So far as the moodiness or horrible health problems, I haven't had any of that. My main problems have been breast size and a lot of spotting. I'm almost at the end of my second pack.OH! And another thing. I've been taking free samples from my doctor, but be warned: this stuff is expensive! The cheapest you can find a pack online for is $180, and it costs over $200 if you just get it at a normal pharmacy.
Birth Control	19-24 Female  on Treatment for 1 to 6 months (Patient) 	5	3	3	Female	19-24	11/15/2009 7:29:42 PM	I am on my 9th week of this birth control. I have experienced no breakthrough bleeding which is good because my periods were pretty bad. However, I have experienced dizziness/lightheaded, a rash of whitish pimples on my chest and forearm that I have never had and an increase in my eating habits. Is this common or will these side effects go away? 
Other	NACALEE , 25-34 Female  on Treatment for less than 1 month (Patient) 	2	5	2	Female	25-34	11/1/2009 10:43:39 AM	I HAVE BEEN TAKING THIS MEDICATION FOR ABOUT 3 1/2 WEEKS AND HAVE EXPERIENCED SEVERAL SIDE EFFECTS INCLUDING WATER RETENTION, DAILY HEADACHES, EXTREMELY LOW ENERGY,FEELING LIKE I HAVE TO THROW UP,ACNE,AND WEIGHT GAIN. I'M VERY TEMPTED TO STOP TAKING THIS PILL BUT I PLAN TO TAKE IT A FEW MORE WEEKS TO SEE IF THE SYMPTOMS GO AWAY. I HAVE ALSO CONSUTLED MY DOCTOR AND WAS TOLD TO CONTINUE TAKING THEM FOR AT LEAST THE 1ST 3 MONTHS AND WAS ALSO TOLD THAT SINCE THIS IS A LOWER DOSAGE THAN REGULAR BIRTHCONTROL THAT THE SIDEEFFECTS COULD BE GREATER ON A HIGHER DOSAGE.ANY FEED BACK IS GREATLY APPRECIATED.    
Painful Periods	madashell, 25-34 Female  on Treatment for 1 to 6 months (Patient) 	1	5	1	Female	25-34	10/26/2009 8:51:35 PM	i'm on my week 12and i have been bleeding for almost four weeks and i might have to have a surgery to hopefully stoop it for good.  I think this medication is a bunch of bull and should not be taken at all.
Other	Maddie, 35-44 Female  on Treatment for 1 to 6 months (Patient) 	3	4	2	Female	35-44	10/25/2009 7:23:12 PM	I have been on LoSeasonique for 3 whole weeks now. I have been bleeding heavily for 7 days now. I have consistently taken the pill at 7pm every night and plan to call my doctor tomorrow morning for advice. I'm definitely planning to stop taking the medication and will begin researching other OC's. 
Birth Control	25-34 Female  on Treatment for 1 to 6 months	2	2	1	Female	25-34	10/23/2009 2:11:08 PM	I was only one Loseasonique for 3 months. I had some breakthrough bleeding also I had acne like I was in high school again. Not only that but I gained 10 lbs in 3 months!I quit taking it and now am on Nuvaring wish me luck!
Other	mab, 45-54 Female  on Treatment for 1 to 6 months (Patient) 	1	4	1	Female	45-54	10/16/2009 11:08:41 PM	I am in the 7th week of taking this pill. i have been bleeding for 24 days straight. My doctor prescribed estradiol 2mg for 10 days to stop the bleeding. He said to continue the birth control while taking this. Its been 12 days since starting the estrogen It has slowed down but the bleeding has not stopped. Is there any advice for me while I await my next appt? 
Birth Control	TabiCat, 19-24 Female  on Treatment for 1 to 6 months (Caregiver) 	5	5	5	Female	19-24	10/8/2009 7:52:14 AM	I am through my first month of taking this birth control and I have not experienced any sort of break through bleeding, mood swings, acne or weight gain. The only complaint I would have is my breasts are slightly sore, but nothing horrible. So far its a great birth control! I am 24 years old and I suffer from severe periods with extremely bad cramps and now I only have to worry about having a period 4 times a year, not every month. My husband is glad to see me not having that pain every month and so am I.I would recommend this birth control!
Birth Control	Meri, 35-44 Female  on Treatment for less than 1 month (Patient) 	1	5	1	Female	35-44	10/5/2009 10:18:50 PM	After 3 weeks on Loseasonique, I have developed extremely high blood pressure, gallstones, and a kidney problem.  I didn't have any of these problems before.  I am not happy. This is a dangerous drug.
Birth Control	goozzzi, 25-34 Female  on Treatment for 1 to 6 months (Patient) 	2	5	2	Female	25-34	9/30/2009 2:52:39 AM	So far on the ninth week on the pill, I've had two periods of spotting for a couple of days and one prolonged period (1-week) of bleeding, which wasn't as heavy as my regular period, but was definitely longer.My main concern though is that my appetite has become virtually uncontrollable and I've already gained quite a few pounds. I am just constantly feeling hungry, which is disconcerting.Moreover, I've been experiencing constant fatigue, daily headaches and frequent nausea, and started feeling increasingly depressed. Seems like most of the forewarned side effects have manifested in my reaction to the drug. And a couple of days ago I started getting these scary anxiety/hyperventilation attacks... Has anyone else experienced the same effects?Now, I also have family history of breast+ovarian cancer, strokes, and high blood pressure. My dr. is aware of this but still said that the pill shouldn't increase these risks in me. However, I'm growing more and more skeptical given that I've been showing the other side effects already. Any thoughts/advice would be highly appreciated. I'm torn whether to stop taking the pill altogether or are the risks and side effects not so great and will dissipate with time?!Thanks a lot!G.
Birth Control	pahrumpgirl09, 19-24 Female  on Treatment for 1 to 6 months (Patient) 	2	1	1	Female	19-24	9/29/2009 3:05:04 PM	ive been taking this pill for about 5 weeks now and ive had been bleeding bad for about 3 of those weeks is that bad is it suppose to happen ? can someone help me im really scared and i have had most of the side effect and my doctor is out of town ..
Abnormally Long or Heavy Periods	FancyFace, 35-44 Female  on Treatment for 1 to 6 months (Patient) 	5	5	5	Female	35-44	9/10/2009 5:14:49 PM	I LOVE this pill.  It is great for women over 35 who need a low dose.  And, since it is a low dose, it doesn't cause yeast infections like OrthoTriCyclen does.  I haven't had any spotting or bleeding.  I think the secret to that is to take it the same time every night and not miss any pills.  I take it right before I go to bed the same time every night and I haven't missed one pill.  I used to have horrible heavy periods that lasted TWO weeks!  Well, NOT ANY MORE.  YEAH.
Birth Control	shadowprincess02, 25-34 Female  on Treatment for less than 1 month (Patient) 	2	4	1	Female	25-34	8/31/2009 10:45:44 AM	alot of break through bleeding on week 2 of the pills.
Painful Periods	19-24 Female  on Treatment for 1 to 6 months (Patient) 	3	5	2	Female	19-24	8/27/2009 11:34:06 AM	I've only been taking LoSeasonique for about two months. The first month went great. I didn't have any spotting or anything. However, about the time the second month rolled around and I would have normally started my period, I started spotting. And. it. has. not. stopped! I've been spotting for about a month (it has been very very light, so it's not EXTREMELY bothersome). My sister also had the same experience, and one other person I read about has as well. I'm going to hold out for about another pack and see if it gets better, otherwise I'll probably end up switching.
