Endometriosis	25-34 Female  on Treatment for 1 to less than 2 years (Patient) 	4	3	5	Female	25-34	6/6/2011 4:24:14 PM	I started taking this drug a year ago. I was trying to conceive and got accepted to a nursing program and put everything in the baby department on hold. At first I did not think that it was going to work because I had spotting but after a few months, as long as I took it everyday at the same time, the spotting went away. I do not take the placebo pills and therefore I have no period (which is nice because I could not have handled menstrual cycles while going through my nursing program). I have been having increasing abdominal pain and pressure the past month, but I feel that it is not from the medication but from the disease itself.
Painful Periods	jeniebeens, 35-44 Female  (Patient) 	5	5	5	Female	35-44	4/18/2011 8:53:48 PM	taking for painful periods mostly. I have always also had heavy/long periods and terrible PMS. I have been on this for about 1 year. I had some spotting during first 2-3 months. I've noticed slight PMS for 1 or two days NOT EVERY MONTH like in the past and then realize I'm in the &quot;yellow pills&quot;. This past 3 month cycle I didn't even experience the 2-3 day &quot;pill&quot; period and I'm not pregnant because I am not having sex. I LOVE this stuff! It's made life a lot easier. I know there have been negative reviews so I was prejudiced when starting but I can't be more pleased. I haven't had skin problems so I can't comment if it helps with skin problems. I don't know if it causes weight gain because I am on an exercise/diet regimen after my baby.
Birth Control	19-24 Female  on Treatment for less than 1 month (Patient) 	5	5	1	Female	19-24	4/13/2011 2:28:44 PM	I have been taking this BC for 24 days. 9 days ago i started spoting since then. I take the pill everyday at 10oclock and havn't missed a day, and i take it with orange juice. I keep thinking if i just wait it will stop but its not. Other then the spotting i have no other complains.Sure puts a damper on sexlife.
Disease of Ovaries with Cysts	19-24 Female  on Treatment for 1 to 6 months (Patient) 	2	5	2	Female	19-24	3/30/2011 7:32:41 PM	I just started this BC about two months ago.  I am not very comfortable with birth control pills, but unfortunately I do not have much choice because of an out of control endometrioma problem.  Ever since the second week, I have had a constant period.  I take the pill at the same time everyday, and yet it does not help.  I am already anemic, so it has been creating more issues.  I am hoping to get off this medicine ASAP, so I can find something that actually works.
Birth Control	violadae, 25-34 Female  on Treatment for 1 to 6 months (Patient) 	4	4	2	Female	25-34	3/23/2011 11:47:09 AM	I am on the last of my 4th month (1st month of 2nd pack) and have had major ups and downs with this drug. I bled for 2 weeks within the first month of taking it. I have not had anymore bleeding, I did not even have my scheduled period the first time. That was a bit unnerving. I have gained 7 lbs even though I eat healthy and eat no more than I did before taking this bc. I also work out, but alas, the lbs will not budge. I could deal with this (I was not overweight to begin with nor am I now) but on top of it I have been majorly bloated for 2 months straight. I mean it feels like I have gained 15 lbs just from the bloating. I am miserable. My headaches (the reason i got on this bc) have not improved. I know everyone responds differently to meds, but my experience has been sub par. I hoped all this would go away by now, but it seems the bloating is here to stay! I plan to get off of this bc once I finish the pack I am currently on. Imagine feeling liek you are PMS-ing all the time! Ugh, so wanted to love LoSeasonique!
Birth Control	Freestyle2410, 19-24 Female  on Treatment for less than 1 month (Patient) 	5	5	5	Female	19-24	3/22/2011 5:49:17 PM	This is only my first week of using Loseasonique, and I LOVE it! I had been on ortho tri cyclen lo for two and a half years but was experiencing problems wearing my contact lenses so my doctor suggested the change. At first I was terrified to take this medication after reading all of the horror stories from other reviewers, but I have not experienced any of that so far. In fact, I have noticed that the irritation with my contacts has disappeared, I feel unusually emotionally balanced and happy (before I would start crying over the littlest thing) and that uncharacteristically my libido has skyrocketed! The latter is actually what inspired me to write my own review because for over two years I went around feeling absolutely nothing and had to force myself to pretend to be turned on by husband (who is hot!). I realize it's only been a week, but so far I am truly thrilled. I must also add that I am extremely vigilant about taking the pill at exactly the same time every day and exercising frequently, so perhaps this is why I'm not experiencing any of the undesirable side effects others have mentioned. Fingers crossed everything stays on track. Best of luck!
Endometriosis	Charityellington, 25-34 Female  on Treatment for less than 1 month (Patient) 	3	5	4	Female	25-34	2/21/2011 12:39:15 PM	I've only been on Loseasonique for a week and i really haven't had any trouble. I have gotten a little nasuea but not where i can't handle it! Everybodies body is different so just because someone had a bad experience doesn't mean you will! I believe every bc can cause weight gain, bloating, etc, but for someone to say it gave me gallstones and kidney stones i don't believe that! It just so happened at the same time! Kidney stones are from caffiene and other stuff you consume by eating or drinking! I mean come on! Sorry I know i am not a dr but it just doesn't seem true that a bc pill can cause you to have stones! So far i feel fine dr told me to start it the first day of my cycle which i did and i still am bleeding a week later but that is normal for me, plus it takes time for medicine to regulate through the body! I am looking forward to seeing if some of these outrageous comments are true or not for me!
Painful Periods	lelan, 25-34 Female  on Treatment for 1 to 6 months (Patient) 	1	3	1	Female	25-34	2/14/2011 12:21:46 AM	This pill is horrible! The extreme breast tenderness lasted for 1 month after I began taking it. I even developed horrible acne which doesn't go away and leaves scars. And the HEAVY spotting and cramping have lasted 3 full months! I finally got my doctor to take me off LoSeasonique and prescribe a different BC pill, but now I'm not even having a period. I'm married and in my 30's, used plenty of other BC pills before with no problems, and am definitely not pregnant (am infertile because of Endo and OC, which is why I'm on BC pills). I've never missed my period in my life until now! What gives? I can't even start my new BC prescription until LoSeasonique is out of my system and I have my period. Hate this pill! Would NOT recommend!
Endometriosis	35-44 Female  on Treatment for 1 to 6 months (Patient) 	1	4	1	Female	35-44	1/29/2011 12:08:12 PM	On my 8th week of this med and I'm done. I have gained 10lbs, breasts very swollen and tender, exhausted and have been bleeding straight for TWO weeks--and I'm definitely not pregnant. I think I will just deal with the pain of endometriosis and get back to my life. I have taken other BC and never had any side effects. Be warned.
Birth Control		1	5	1			1/16/2011 7:49:39 PM	
Endometriosis	sortofhappy, 35-44 Female  on Treatment for 1 to 6 months (Patient) 	5	2	4	Female	35-44	11/15/2010 11:44:30 PM	I've been on LoSeasonique for my 3rd month.  If I forget the pill more than 2 days, I will have a full cycle.  Nonetheless, I have experienced hardly any pain with my cycles, which is a miracle for me, my mood swings have improved over 80%.  The breakthrough bleeding is horrible though, 1-1/2 to almost 2 weeks as a 'punishment' for forgetting a pill and taking it the next day.  When that happens after 2 days forget it, I will bleed.  And my doctor's office said the same thing, it is &quot;normal.&quot;  Get outta here!  I love the less pain though.  I can't beat that with a stick.  I love the mood swings almost gone, and my poor family does too.  I just had a repeat mammogram and it seems that all of a sudden, I may have breast cancer.  That is a red light for me.  I also got the pills as free samples, but they are extremely expensive if I choose to contine on them. Now that I have read others' comments, I don't think I will start the new &quot;free&quot; box of pills.  I think I would rather have the horrible pain instead of the breakthrough bleeding and wondering if it has given me breast cancer.  
Painful Periods	13-18 Female  on Treatment for 1 to 6 months (Patient) 	5	5	3	Female	13-18	11/8/2010 8:23:02 PM	i have been on birth control since 10th grade. i have been on different birth controls but this one is the best by far. the only thing i don't like is the sickish feeling when i start it and the fact that i'm hungry 24/7. 
Birth Control	Em,  Female  on Treatment for less than 1 month (Patient) 	2	5	1	Female		10/20/2010 1:00:54 PM	I started taking this BC on the first day of my period (Thursday), which was almost over 2 weeks ago. My last period only lasted 4 days, and my previous periods lasted no longer than 6 days. Since this is my first time on a BC, I didn't really know what to expect, but I knew something was off when I continued to spot with thick, dark discharge after my period ended. I tried to trooper through it by continuing to take it up until the Saturday after the first week. It is now Wednesday (a day shy of the two-week mark). The spotting stopped last night, but now I'm experiencing bright, liquidy discharge. I don't have a medical diploma to tout, but I know enough to say that this is not normal.During the 1.5 weeks that I took the BC, I had constant cravings (mainly for sugary treats and meat), was agitated by inactivity, had shaky hands, could not sleep during the hours I would regularly go to bed. Before you mark me of as neurotic, I have to assert that I'm as easily stressed out as a pet rock. I'm about as mellow as a person can naturally be. In short, if taking a BC would put me under this much ... I don't even know what to call this... I would much rather not take it and go with the old-fashion route: using condoms and calculating the days of the month to have sex.
Painful Periods	Ellie, 45-54 Female  on Treatment for 6 months to less than 1 year (Patient) 	3	5	3	Female	45-54	10/18/2010 12:17:53 PM	No real side effects after 7 months other than continually bleeding. Not sure if I like that everyday! 
Endometriosis	tired, 35-44 Female  on Treatment for 1 to 6 months (Patient) 	1	5	1	Female	35-44	10/5/2010 5:05:05 AM	I have been on this bc for 4 wks. My doctor put me on this to see if the itching down below would stop. It hasn't. I have no sex drive. I'm bloated, I hardly sleep, I've gained weight and I do workout. I am always hungry and I have bad cramps like if I'm going to start my period. I have acne on my chin and noise. I haven't spotted or anything like that but, with the cramps I wish I would.  I am going to stop taken this bc and ask my doctor to put me back on Lutera.  At least I know with Lutera I had the itching problem, but I didn't get any of the other side effects like what I stated above. 
Disease of Ovaries with Cysts	Tracy, 45-54 Female  on Treatment for 1 to 6 months (Patient) 	5	5	5	Female	45-54	9/26/2010 9:59:33 PM	I just finished my first package of pills and got my period exactly as planned,  I had mild cramping prior and a very light period.  I am very pleased with the pill. No weight gain or side effects.  
Abnormally Long or Heavy Periods	Ladymel, 35-44 Female  on Treatment for 1 to less than 2 years (Patient) 	5	5	4	Female	35-44	9/21/2010 10:17:40 PM	I have had hormone problems since I was 13. Im now 35 have had two children while taking progesterone and NOTHING has ever worked for me like this has. I used to have very heavy bleeding that would last up to 20 days. When my dr put me on these pills I stopped and I have not had a period in a year now. The only side effect I have had is vaginal dryness but the other benifits are well worth me buying something else for that problem. And I have lost 16 lbs!
Endometriosis	anonymous, 25-34 Female  on Treatment for 6 months to less than 1 year (Patient) 	3	4	1	Female	25-34	8/19/2010 12:14:03 AM	I started out with Seasonique and took the pill for three months with no period, until I took the sugar pills. However, I became extremely depressed, felt pregnant the entire 3 months, and felt sick the entire time. I have recently switched to Lo Seasonique and it is no better. The Lo Seasonique has resulted in a lot of spotting and has made me extremely emotional with regular mood swings. The Seasonique is effective in that I do not experience a lot of pain during my cycle. I intend on switching back to Yaz, because Yaz has been the best birth control I have ever taken. 
Abnormally Long or Heavy Periods	25-34 Female  on Treatment for less than 1 month (Patient) 	1	4	1	Female	25-34	7/25/2010 8:20:08 PM	I am SO glad it's not just me! I got my tubes tied in Oct 2009, and since then have had horrible periods with excessively heavy flow, severe cramping, and ridiculous mood swings. My doc started me on LoSeasonique to try and help. I started it three weeks ago and hae been bleeding since the fourth day. I've also gained three pounds and am constantly hungry! I will be stopping the pill effective immediately since seeing that I'm NOT the only one with these problems!
Birth Control	mila, 25-34 Female  on Treatment for 1 to 6 months (Patient) 	3	4	1	Female	25-34	7/12/2010 12:27:24 PM	this bc is horrible! a had break through bleeding every month and almost every week of the month and also started bleeding at the end of my 7th week on the pill and now im on my 13th week and still bleeding, called the doc she said its normal. will be stopping the pill once Im done with this last week of the pack, no other major side effects though, maybe a little more moody but who wouldnt be if you bleed for more than a month? 
Other	Susan, 45-54 Female  on Treatment for 1 to 6 months (Patient) 	1	3	1	Female	45-54	7/3/2010 4:20:12 PM	Tried it to get erratic periods under control, also hoped that the low dose estrogen would alleviate the hormone triggered migraines that came with my periods.  All was fine until a month and a half on the pill. I started bleeding like a regular period - it's been 11 days now without easing up. I read other accounts of multiple week bleeding. I am giving up on this pill.   This is a fail.   
Birth Control	hateseasonique, 45-54 Female  on Treatment for 1 to 6 months (Patient) 	1	5	1	Female	45-54	6/30/2010 12:58:23 PM	I started LoSeasonique bcs I wanted 4 periods a year - HAH! I started this AWFUL BC on April 11th, began bleeding on May 7th and still have NOT stopped bleeding!!! I have now been bleeding non-stop for 54 days!!! My GYN says it's normal - NOT!!! She does not seem to think there is a problem. Since I am one to &quot;see things 'til the end&quot; I am finishing up my 1st &amp; ONLY 3-month pack of this HORRIBLE BC and going back on OVCON-35 which I have been on for the last 11 years - hopefully my period will finally stop and my body will get back to normal once going back on my original BC. Ladies, if it &quot;aint' broke, don't fix it&quot; - don't let the fantasy of having only 4 periods a year fool you, this BC is HORRIBLE it should be taken off the market IMMEDIATELY!!!  
Other	syracusemom, 45-54 Female  on Treatment for less than 1 month (Patient) 	2	5	3	Female	45-54	6/16/2010 6:28:58 PM	I am a 50 year old perimenpausal woman who has been struggling with mood stability.  I have been working with a psychiatrist for medication that has been helpful.  She is working with OB/GYN to stabilize hormones thinking that would help.  I have never been on birth control before.  I am in my second week of this and I have swollen, painful breats.  I feel like I have perpetual PMS and morning nausea.  
Endometriosis	Eva500, 35-44 Female  on Treatment for 1 to 6 months	1	3	1	Female	35-44	6/5/2010 9:50:07 AM	I've been on this medication for 3 months. I have had a period every month for 12 to 15 days. I have headaches and legs that are numb. Also the endometriosis pain has not gone away and usually is strong pain lastinng 90 minutes to 2 hours. 
Birth Control	DebDoes, 45-54 Female  on Treatment for 6 months to less than 1 year (Patient) 	1	3	1	Female	45-54	6/3/2010 4:31:03 PM	After 3 packs of bills (9 months or so) I had gained some 30 plus pounds, had knot-like acne on my chin, around my mouth and nose (I never have acne), was having numbness in both arms and achiness in my left arm (as if I was wearing a blood pressure cuff that was too tight); I was seeing 'stars'; constantly hungry, and migraine headaches.  I wrote a list of symptoms and took them to my doctor. She swears that at least half of these are not 'documented symptoms', but I was having all of them. Oh, and I didn't mention a decreased sex drive, and insomnia...I was awake more than I slept.  After 2 weeks off this pill, I felt like a new woman.  3 weeks later I feel more energetic, am sleeping thru the night and generally am better...and I'm not hungry all the time! 
Birth Control	19-24 Female  on Treatment for less than 1 month (Patient) 	5	5	4	Female	19-24	5/29/2010 7:09:22 PM	I started LoSeasonique about a week ago. Previously I have had every birth control under the sun: IUD (I was allergic, got hypopigmentation, eczema), Yaz (Had to go on anxiety medication, englufed breasts, horrible acne), DepoProvera (Bled for 6 months straight, severely anemic, depressed), and I am allergic to Latex, and have Endometriosis. Doctor wanted to put me on Lupron and have surgery, I wanted to try something less invasive first. She suggested LoSeasonique.I take it every day at the same time (set an alarm on my phone to remind me), but unfortunately yesterday I took it a little late and ended having some breakthrough bleeding yesterday and today (Which isnt a big deal because I usually bleed randomly all the time). I think the key with this medication is timing. Also I have had a little nausea but nothing bad. My breasts are NOT tender, which is a first (extremely cystic breasts). I have had no cramps. My appetite has actually DECREASED and I feel less bloated then I normally do. Overall I am pretty happy so far, if the nausea would just go away I would be a even happier camper.  
Birth Control	ebie, 19-24 Female  on Treatment for less than 1 month (Patient) 	1	4	1	Female	19-24	5/16/2010 3:45:48 AM	am on 3rd week now bleeding everyday...filling tampons...terrible upper abdominal pain. nausea.im her husband shes doubled over right now waiting on monday so her doc can end this...her doctor had her take 10 of those pills over the course of 4 days...to no avail on the bleeding and the pain hurts me to watch. we have a 2 month old son she cant spend more than a few minutes with before being sick. doc acts like its not a big deal. doesnt return calls. apparently this is normal??? id rather wear a rainsuit and pray there are no long term damages done by her use of this obviously wonderful drug... good times
Birth Control	25-34 Female  on Treatment for 1 to 6 months (Patient) 	5	5	2	Female	25-34	5/12/2010 10:42:06 PM	Although it has been effective in me not getting pregnant my side effects are horrible. I feel nauseous a lot have had chest pains and anxiety and dizziness since taking this. I switched from loestren because I felt nauseous but this pill is not working for me either. I did not get a period when I got to the yellow pills. I am in my second week of my 2nd pack and started bleeding today. I feel like I have the flu but I know it is the pills. I am calling my gyno tomorrow and stopping this pill immediately.  The side effects outweigh not having a period every month.
Painful Periods	45-54 Female  on Treatment for 1 to 6 months (Patient) 	4	5	4	Female	45-54	4/29/2010 2:11:50 PM	Only on my second month, but did not have a period the first month or any breakthrough bleeding! I have gained some weight, not sure if it's because of the pill, or just cause I'm not doing what I should be doing for diet and exercise.
Birth Control	25-34 Female  on Treatment for 1 to 6 months (Patient) 	4	4	2	Female	25-34	4/19/2010 7:06:00 PM	I take this medication primarily for birth control, but also because I have problems with prolonged, heavy, and painful periods. I have experienced weekly spotting that lasts for 3-7 days with a flow that is slightly less than a normal period. I also have experienced breast tenderness, vaginal dryness, an increase in discharge (clear),a sense of feeling overly tired, and an increase in appetite and cravings (sometimes intense). Overall I am dissatisfied with this medication - I have been on it for 8 weeks now and will continue to take it through the full first three months, but will be consulting my doctor at that time to discuss finding a medication that will yield better results and fewer side effects. 
Birth Control	Jen, 35-44 Female  on Treatment for 1 to 6 months (Patient) 	5	5	2	Female	35-44	4/12/2010 6:57:56 AM	I am on my third pack of pills and  haven't gotten my period in over a month.  No, I'm not pregnant, but am extremely moody and have gained 10lbs.  I'd rather have a monthly period than have the emotional roller coaster that I&quot;ve been on!  I'm calling my dr today to switch!
Painful Periods	pens87, 25-34 Female  on Treatment for 1 to 6 months (Patient) 	2	4	1	Female	25-34	4/5/2010 8:52:24 PM	horrible....enough said...I have had my &quot;period&quot; for six weeks...migraines...nausea...naturally the Dr says its breakthrough bleeding...lol...
Birth Control	25-34 Female  on Treatment for 1 to 6 months (Patient) 	5	5	1	Female	25-34	3/22/2010 11:06:32 PM	I've been taking LoSeasonique for just over 1 month and am going to stop taking it. My doctor told me to give it the full 3 months to see how my body adjusts to it, but I just can't wait it out that long. Since switching to this pill I am always hungry and have gained at least 5 pounds! I haven't changed my diet, even though I am always hungry I try to ignore it, but the weight has still come on! My skin and hair seem like they are very oily lately, and my face has been breaking out like crazy! I've experienced increased anxiety and when it comes on it is most often severe. I also am extremely sensitive and I find myself bursting in to tears out of no where. I've been getting a lot of headaches and just feeling like I'm out of it a lot of the time, very spacey. Also in the month I've been taking this, I have been spotting so much! Once I started this pill at the end of my cycle, the first week in to my pack I had a full period again! And since then have been spotting or having discharge constantly. I know they say you may spot when starting this, but it just hasn't stopped! I had been taking Yasmin for years, and switched to Loestrin in the past for shorter periods (my period would last about a full week on Yasmin) but the Loestrin also made me feel extremely anxious and my moods were horrible so went back on Yasmin. Decided with my doctor to give LoSeasonique a try, but I am done changing pills, I'm going back to Yasmin. Other than the lengthened periods, I had no negative side effects on Yasmin. I'd rather have my period for a week and feel normal the rest of the month, a few days shorter period is not worth it! If you are happy with your current pill, I would recommend sticking with it. I would not recommend this pill at all. It is the worst birth control pill I've taken and the side effects are horrible!!
Painful Periods		3	5	2			2/9/2010 10:54:49 AM	I, too, went on this pill so I wouldn't  have to deal with a monthly period, but I've had consistent spotting or breakthrough bleeding the last month of each pack.  Everything is fine the first two months of each pack, and then I bleed every day for the last month, which defeats the purpose of my going on this pill.  I thought this spotting would go away after the first few months (pack of pills), but six months later, I'm still experiencing it.  I'm going back to the tradiitonal birth control pills.
Birth Control	mustang mistie, 35-44 Female  on Treatment for 1 to 6 months (Patient) 	5	5	2	Female	35-44	1/23/2010 1:08:20 PM	I have been taking this pill for 4 weeks now and i have had mood swings weight gain and spotting for 3 weeks, Im going to try to keep taking it till the 3 months is up, bugt I dont know if I can handle much more spotting!!!!!! When will it end????
Abnormally Long or Heavy Periods	kristy, 35-44 Female  on Treatment for 1 to 6 months (Patient) 	1	3	1	Female	35-44	12/31/2009 10:31:20 AM	I am moody, I have bled for 2 months--just spotting, and I have never really had problems with acne and for 3 months I have broke out on my face.  I am quitting today!
