Abnormally Long or Heavy Periods	Great Pill, 35-44 Female  on Treatment for 1 to less than 2 years (Patient) 	5	4	5	Female	35-44	9/24/2012 4:44:35 PM	As a 35 yr old woman, I have tried many pills to combat my heavy, painful, and frequent periods. This is the only one birth control pill on the market that has worked! And has controlled my periods without side effects. In the begining there was some break through bleeding (a month long of off-on days) and some breast tenderness. Now a year later, I can't imagine taking another drug. Its expensive but when you break out the cost per month and factor in all the pads and tampoons and advil you won't need, it works out well.
Birth Control	t.e, 25-34 Female  on Treatment for 1 to 6 months (Patient) 	4	3	2	Female	25-34	5/9/2012 12:50:33 AM	I am on my first pack and I have been spotting for the first 2 months, almost every single day... What is the point of having your period every 3 months if you spot every day!? Considering a new method because this is too high maintenance!
Birth Control	25-34 Female  on Treatment for 1 to less than 2 years (Patient) 	5	5	5	Female	25-34	5/2/2012 3:44:58 AM	I have had very poor experiences with Bc in the past.  Found out I'm very sensitive to the high hormones meds.  My doctor put me on the once a month lodose Bc and I was very happy with it.  When I found out about the same med for 3 months at a time I was more than willing.  I had some spotting for the first pack and some Pms symptoms around when I would have stopped before.  After that my periods are light and only a few days when they're supposed to happen.  I love it.  Very happy. It's not for everyone but you need to find what combo works for your body.  Oh there's also a generic now. Yeah! 
Birth Control	kelliejo1211, 25-34 Female  on Treatment for 1 to 6 months (Patient) 	3	5	3	Female	25-34	4/19/2012 2:12:08 PM	I have been on seasonique for many years, and it has been great, really light periods and weight loss- the perfect drug.  This past cycle, I was accidently given seasonique lo, not a good experience, I gained weight and I have had non stop spotting.  Fortunately my pharmacy is switching out my packs today so I can go back on the seasonique.  The seasonique line is great, but the seasonique lo is not for me.
Other	sw, 19-24 Female  on Treatment for 6 months to less than 1 year (Patient) 	2	5	1	Female	19-24	2/29/2012 9:31:18 PM	I am currently on my 3 week and a half of my period on this birthcontrol. I have been on lo seasonique for 8 months now. There has been 1 month out of 8 that I have had a normal month, otherwise I have pretty much had a continuous period. This is rediculous.
Birth Control	LoriBug85, 25-34 Female  on Treatment for 6 months to less than 1 year (Patient) 	5	4	5	Female	25-34	2/22/2012 2:40:51 PM	I have been on LoSeasonique for 6 months now, and I absolutely love it. I have lost 25-30 pounds since I started taking it, have only had two periods in the last six months, and no evident side effects. The ONLY downside for me is that it is so expensive! For one three-month pack it is $188 at my pharmacy, but when I started taking it there was a discount card given to me by my gyno, which made SIX months around $80! Talk about disappointing when I found out they discontinued the discount card! I have never had such a great BC before, I think I'll just have to shell out the cash!
Endometriosis	SammyK, 25-34 Female  on Treatment for 6 months to less than 1 year (Patient) 	4	5	1	Female	25-34	2/7/2012 9:15:43 PM	Started this for endometriosis &amp; abnormally long periods. I now have 3 week long periods EVERY month. I just stopped taking this because the nauseousness was out of control. Not a huge weight gain, but an obnoxious 5 lbs compared to other types of bc. I will say I have had trouble with every type of bc I've ever tried, but this tops my list. Not to mention I'm super moody! I'm NEVER moody!
Birth Control	lodose, 19-24 Female  (Patient) 	5	5	4	Female	19-24	1/30/2012 5:31:10 PM	I really have enjoyed taking this medication.  It never made me moody like past BC pills. I didn't notice weight gain unlike in the past, I even dropped a few pounds.  A reason there are so many comments about bleeding is because it is a low dose.  It may not be strong enough for some women, but for those of us who don't need it strong it works great! My periods have been lighter and I love it! only down fall is that it is super expensive!
Birth Control	KimInGA, 25-34 Female  on Treatment for 1 to 6 months (Patient) 	3	5	1	Female	25-34	12/20/2011 11:54:41 AM	I've been using 13-week-cycle birth control pills for 5+ years now - Seasonique and Jolessa. My doctor recently switched me to Lo Seasonique and it's been terrible!!  2 weeks after starting, I began to spot.  It never stopped until I took a week off from the pills and let a period come.  Then I began taking them again and lasted 3 weeks before nonstop spotting (nearly as heavy as a period) once again forced me to take a week off.  I guess you are supposed to just keep taking the pills and deal with 3 months straight of having a period?!?  Right, and I would explain that to my husband HOW, exactly?  Plus 3 months straight of cramps and PMS-like extreme annoyance -- it just gets better and better!  And did I mention the weight gain?  The only good thing I can say is that I didn't get pregnant, although it's basically destroyed my sex life with the nonstop bleeding so I'm not sure there was even an opportunity to get pregnant.  The minute I can get my doctor's office to call me back, I'm switching to something else, ANYTHING ELSE!
Painful Periods	RuthAnn24, 19-24 Female  on Treatment for 6 months to less than 1 year (Patient) 	5	4	3	Female	19-24	12/13/2011 12:45:06 PM	So the first pack I loved got my period a week before the placebo week. I still have really bad cramps so it didn't really help that but it was nice only getting one period.. I started the second pack and it was perfect until the second month. I started bleeding at first nothing but a panty liner but then it changed to full on bleeding for 2 months literally 2 months until I got to the placebo week it got really bad with the cramps again.. Then I'm on my third pack now and no bleeding.. I'm going to stick it out with the third pack just to see if my body is finally adjusting.. And I hadn't gotten ahold of my doc pretty much useless in helping non pregnant girls. but I have had some positive side effects I have lost a lot of weight I weighed 127 when I was put on it and now way 114 I'm 5'10 so that alot for me.. my skin is really clear also.. 
Birth Control	HormoneFree, 25-34 Female  on Treatment for less than 1 month (Patient) 	4	5	1	Female	25-34	12/5/2011 8:50:58 PM	If you are hormone-sensitive, please read! I have tried every pill family on the market and my doctor recently prescribed loseasonique, as I have not yet tried this type. I have experienced not-so-pleasant side effects in the past from the other pills &amp; nuva ring (severe acne, migraines, nausea, melasma, mood swings, fatigue), so I had high hopes for this one. I had been off pills completely for 2.5 months and felt great. I took my first pill from loseasonique at 11pm Sunday evening, and by 11am Monday morning, I was experiencing shortness of breath, dizziness and even blacked out while laying down trying to calm the symptoms. I managed to drive myself to urgent care and get checked out to make sure nothing serious was happening, but I am 100% sure that what I experienced was a result of the pill. I am an athlete, in great health with a balanced diet, and have never before had these &quot;anxiety&quot; type symptoms. Again, everyone reacts differently, but if you experience something similar, please use caution. Doctors might say otherwise, but I believe that only you know your body best. Needless to say, I had enough of a health scare, and I will not be sticking around to see if these symptoms subside. 
Endometriosis	13-18 Female  on Treatment for 1 to 6 months (Patient) 	5	5	4	Female	13-18	12/1/2011 7:42:01 PM	i've been on 4 different BC pills in the past 2 years, and LoSeasonique has given me the best experience. i have a pretty bad case of endometriosis. i've been on LoSeasonique for almost 5 months now and my first period was a breeze. i had cramps for only one day (usually 3-5) during my period, which only lasted 4 days. my only concern is that when i first started LoSeasonique i started getting awful migraines everyday from the minute i woke up to the minute i went to bed. luckily after about 3 weeks these went away. i get spotting every so often but nothing that's unmanageable. i also noticed that my bloating has almost completely gone down. i've gained a little weight, but only in my breasts (which is perfectly okay with me). so far, LoSeasonique is the best pill i've been on.
Endometriosis	19-24 Female  on Treatment for 1 to 6 months (Patient) 	2	4	2	Female	19-24	11/28/2011 2:56:38 AM	
Birth Control	kay1991, 19-24 on Treatment for 1 to 6 months (Patient) 	4	5	4		19-24	11/13/2011 2:12:18 PM	I am on my 4th week of LoSeasonique &amp; I love it! I was a bit nervous about starting it because of all the bad things I had read online- but I have experienced very little side effects. I have a history of acne, and I can actually not take my acne medication anymore &amp; just take this BC. I was supposed to begin my period on the 8th of this month- it's now the 13th &amp; I have began spotting last night- but nothing I could complain about. I love the idea of not having a full period for another 2 months &amp; so far my experience has been great! I am unsure as to the effectiveness, but it sure does seem to be working so far!
Endometriosis	truman212, 35-44 Female  on Treatment for 1 to 6 months (Patient) 	4	4	4	Female	35-44	11/8/2011 1:14:58 PM	Will finish second month of Rx today.  During the past 4 days, I have started having pre-period, brown discharge and lower back pain normally associated w/ a regular period cycle prior to period beginning.  Prior to this symptom, I have been satisfied with the medication.  I suffer from both endometriosis and PMDD and was put on the Rx to stop having menstrual cycles and to trigger sexual appetite (prior bcp had wiped it out). Because I am no longer having a period, it has reduced my PMDD related symptoms by 90% (my boyfriend is elated).  My sexual drive has increased only 10% though -- hopefully will increase with time.  It is possible that I have experienced weight gain, but could also be a lingering effect from my previous bcp and not-so-stellar diet.  I have started exercising and changed my diet so will be curious to see if the pounds start coming off.  One noticeable side effect I've had is the need to urinate in the middle of the night/early morning (sometimes both).  It doesn't matter how little or much liquid intake I've had for the day, or if I urinate before going to bed (which I do), I wake up with pressure on my bladder and the immediate need to urinate with a significant amount of urine produced (I wonder if it is the result of water retention from the pill escaping from my body??) I feel like an 80 year old!  This started within 2 days of beginning the Rx and had never experienced prior to.  So far, have found very little research or information on this side effect.  Will be curious to see how the next few months go.
Birth Control	Stephanielee91, 19-24 Female  on Treatment for 1 to 6 months (Patient) 	4	5	1	Female	19-24	11/1/2011 12:50:28 PM	I started taking this for BC and so I could plan my period around my honeymoon. The first 3 months I had breakthrough bleeding for 3 weeks! Now I have it again and have had it for 2 weeks! I've been on it 4 months, its ridiculous. I have awful mood swings, lose my temper even easier, and am an emotional wreck. I was NOT like this before I started this BC and my obgyn said I had to wait till im on the placebo pills to switch and i cannot wait to get off it!!
Other	manh, 35-44 Female  on Treatment for 1 to 6 months (Patient) 	1	3	1	Female	35-44	10/23/2011 11:55:59 PM	period lasted for 15 days after my physician said I would not get my period for 3 months.  taken for hormone related headaches, no change in headaches was seen.
Birth Control	25-34 Female  on Treatment for 1 to 6 months (Patient) 	3	1	1	Female	25-34	10/13/2011 4:40:34 AM	Complete loss of sexual appetite. Caused major discomfort in vaginal area including burning.  Burn would occur with or without sex. Had to get off this pill and try a different one. 
Abnormally Long or Heavy Periods	NDavis, 13-18 Female  on Treatment for 1 to less than 2 years (Patient) 	5	4	2	Female	13-18	10/12/2011 10:07:35 AM	I have been switching birth controls because my body is very sensitive to many things . Either I havent getting periods like I should or now on LoSeasonique my period hasnt been off in almost 3 weeks. This is fustrated because im on the third pack and it was doing really good for me . And lets not get into the weight gain ... I have gained over twenty pounds .Im getting off of it very soon.
Other	CrzyinPA, 45-54 Female  on Treatment for 1 to 6 months (Patient) 	4	5	4	Female	45-54	10/5/2011 3:39:28 PM	I was out on this to help with extreme perimenopausal symptoms.  I have one 7 day period the second week that I took the med.  I'm on my second pack and have not had another period since.  I have noticed a slight increase in acne but I find that it is easily manageable.  I have had absolutely no weight gain or some of the other extremem symptoms that others are writing about.  I'm sticking!
Birth Control	25-34 Female  on Treatment for 6 months to less than 1 year (Patient) 	2	4	2	Female	25-34	9/25/2011 11:57:12 AM	I have been on this BCP for 6 months. Not only is it not covered by my insurance..it was also very expensive. My body agreed with it the first 3 months, but the last 3 months have not been a good adventure. I have had breakthrough bleeding/spotting for 2.5 months straight. I have had no other symptoms. I was hoping this BCP would work for me, but it didn't. 
Birth Control	Kas123, 35-44 Female  on Treatment for 1 to 6 months (Patient) 	3	4	2	Female	35-44	9/8/2011 2:47:38 AM	I went on the pill to help with moodiness around my period.  Loseasonique was recommended by my doctor, but I have experienced cyst like pimples around my chin, dry splitting nails and break through bleeding.  I have been on this site to see if others are having insomnia with this drug.  I can't tell if it's the birth control or something else. I've taken everything out of my diet and I'm still up randomly. I do notice numbness/ tingling in my arms and my feet fall asleep easily when I cross them.  Sounds random, but I swear it's all come about after getting on this pill.  Thinking of stopping
Other	blueskymomma, 45-54 Female  on Treatment for 1 to 6 months (Patient) 	1	3	2	Female	45-54	9/5/2011 3:07:45 AM	Am trying loseasonique because the idea of 4 periods a year instead of 13 sounds fabulous! Started 1st pack on July 17th, began spotting August 3rd its Sept 4th and still bleeding. Mostly spotting, but every day and going on over a month now. Twice in the last week have had serious bloodclots and heavy bleeding that occurs at night, weird. I really want to give it a chance, but wondering if this pill works for anyone over 45? Have a week left in 2nd pack and then one more pack to go. I am diligent about taking it at the same time and have not had any other side effects, just constant bleeding. 
Birth Control	iloveicecream, 25-34 Female  on Treatment for 1 to 6 months (Patient) 	4	5	4	Female	25-34	8/29/2011 6:20:56 PM	i am on my 6th week of loseasonique.  the first month was wonderful.  i didn't have any side effects at all.  i started documenting my weight everyday, because i had heard some women gain weight.  so far, i've actually lost a couple pounds.  i've always been a sugar addict and am trying to eat healthier.  but sometimes i just have to eat something sweet!  a month into it, i got my period just a few days before i would have normally.  i had no warning signs, no pre-cramps.  my breasts were a little tender, but i just thought it was effects of the pill.  the first 4 days were really light and no cramps at all.  but then it became like a full blown period, only it lasted longer.  i normally bleed for about 4 days.  i was wondering how much more blood i could possibly have that needed to come out!  i often get terrible cramps and take midol.  i wanted to see how bad these cramps would get.  they weren't severe enough for midol, but i just felt really 'blah' the first 2 days of regular bleeding.  in total i bled for about 10 days.  the first few days and the last few days were really light.  but for like 2 days in the middle, it was really heavy.  i bled through a super tampon in like 2 hours!!  i think i'm gonna stick it out and see if eventually my periods gets lighter and just the 4 times a year.  this is my first time to try any birth control, and i did want to start with a lower dose.  my main reason for taking this pill was to prevent pregnancy, but the 'only 4 periods a year' was appealing since i can have pretty intense cramping. and really, who wouldn't want less periods anyway, haha.
Painful Periods	Kiacourtreek, 35-44 Female  on Treatment for 1 to 6 months (Patient) 	1	5	1	Female	35-44	8/26/2011 5:07:51 PM	The 1st mo i started taking the pill i came on my period and it lasted for 15days with heavy cramps after that i didnt have a period for a month then my period came again with cramps and so far this is day 15 but im trying to give it a chance is this normal? I dont know but, i have 3months worth left and if it dont get any better no more pill for me.
Endometriosis	tovabell, 25-34 Female  on Treatment for 1 to 6 months (Patient) 	5	4	5	Female	25-34	8/20/2011 12:17:10 PM	I take BCP's to control Endometreosis and have been on many brands (tri-cyclen, tri-cyclen lo, the ring, the patch, mircette, lo-estrin fe, and seasonale). After every surgery my doctors changed the brand/hormones in an effort to suppress growth of Endometrosis.Frankly, all of these pills have the same side effects for me and so I dealt with them - some had more bloating (patch, seasonale, tri-cyclen) others made me a little more moody (lo-estrin) and no sex drive to all of the above. The ring caused my pelvis to inflame and I felt the need to eat constantly (very strange for me). So, after my last surgery, my new doctor suggested LoSeasonique. I've had surgeries since age 18 and assumed she gave it to me because I have already been on everything else; but I find that I do like this pill. It really does seem different. After 6 weeks - no bloating, spotting, excess hunger or acne. Those things I had learned to live with weren't there anymore. So far, I am doing well and hope it will help prevent new Endo.Cons:It is new(ish) and is not always covered by insurance but it does have a savings program. When I switched to it from Mircette I did have some dreary moodiness which was already anticipated. But I've come out of that now.My hope is someday women won't have to go through all of this, with Lupron treatments or a hysterectomy as their only other option.
Birth Control	19-24 Female  on Treatment for 1 to 6 months (Patient) 	5	4	5	Female	19-24	8/8/2011 12:11:52 PM	After being on the implenon a 3 year birthcontrol method that is inserted in your arm and having horrible 1 month long periods trying something else especially a pill was okay with me. This is my second packet and I love it my period regulated I only get it the last week of my 3rd month like its supposed to. I had one month of very little spotting then went away my mood has changed,I love it. I have just adjusted to taking a pill every morning!
Birth Control	Toya, 35-44 Female  on Treatment for 1 to 6 months (Patient) 	3	3	2	Female	35-44	8/3/2011 8:25:47 AM	I'm new to bc pills &amp; have been taking Lo Seasonique for 1 mo.  After 2 wks, I began to have spotting.  My gyn told me this may happen until my body adjusts. When spotting occurs, she suggested stopping the pill for 4 days to allow my body to have a period.  I did as she suggested, had a short 2-4 day period, &amp; then resumed the pill.  The bleeding stopped for 2 wks &amp; then spotting has resumed again.  So, I have again stopped the pill and will resume after 4 days.  I plan to give my body some time to adjust to the pill b/f making a final decision.  I wanted to share this method of dealing with the spotting b/c I've read several posts indicating constant bleeding (there is a soluion).  Per the insert, a back-up bc method is required for the 1st 7 days after resuming the pill.  Hope this info helps others &amp; I truly hope this pill works for me as 4 periods a year would be a beautiful thing:)
Birth Control	19-24 Female  on Treatment for 1 to 6 months (Patient) 	4	5	2	Female	19-24	8/1/2011 11:02:28 AM	I'm a nineteen year old college student that is tired of having periods. I thought I'd try LoSeasonique because 4 periods a year sold me. My first month was great and no complaints but when I started my second month I got my period. My doctor told me I would have spotting, but I've had a regular period for 10 days already and I'm getting very annoyed. My boyfriend isn't too thrilled either. 
Abnormally Long or Heavy Periods	sandiegomama, 35-44 Female  on Treatment for 1 to 6 months (Patient) 	4	4	2	Female	35-44	7/5/2011 3:22:55 PM	My reason for taking this rx is to alleviate heavy periods, cramping and nausea. I am 43 years old and am tired of having a period, which has increasingly become very heavy over the past few years. I am into my 3rd month of pills. I have mixed feelings about it but will continue to give it a try and hope the pill does what it should in the long run and give me lighter periods only 4x year. Prior to taking the pill, I was off BC for 6 years. My period would last 5 days and like clockwork, I knew when to expect it every 28 days. After I began the pill, I got an unusual long and heavy period. I bled heavily for 6 of the 10 days. My next period started 28 days later. I spotted for 3 days, had a medium flow for 2 days, spotted for 3, medium flow for 3 days and it stopped, total 11 days. Weird! Then 28 days later, spotting off and on for 5 days and I questioned whether I was having a period. Then medium flow for 4 days and 5 more days of spotting, total of 14 days. During the periods, I had cramps and nausea 1-2 times a day. I am curious what my period will be like when I am on the one week placebo pill. Doctor says all this is normal as my body adjusts to it. I still have a great desire for sex and hubby doesnt complain of sex while spotting. No additional weight gain or loss. My hormonal acne seems to have gone away! I have some moodiness during the period but not sure if its related to the pill or my children. 
Painful Periods	Jennnnaaay, 19-24 Female  on Treatment for 6 months to less than 1 year (Patient) 	2	4	1	Female	19-24	6/30/2011 7:35:36 PM	I was given this not because I am sexually active, but because I have PAINFUL cramps. They were horrible. I was glad BC was making it go away. But as of now...I HATE LOSEASONIQUE. DO NOT TAKE IT! I'm on my third pack, just finishing up the second month. First of all, it made me breakout. I didn't know what was wrong...until I read about the same things on here. I even broke out on my LEGS! :| Second of all, I don't spot...i get pretty much a period right now when i am not eve suppose to be on it for another MONTH! Third of all, I get cramps STILL. My period without this i would cramp for one day...and then it'd be gone, but now this stuff makes me cramp everyday. Not bad cramps...but still. I have horrible mood swings. I crave food. I did gain some weight. On the sample pack, it was fine. I spotted a little. The second pack i was still doing ok. But now...I cannot sleep, I want to eat everything, i have HORRIBLE mood swings, and more acne. I am switching BC when i am finally DONE with this. Ugh...
Other	Lynell101, 25-34 Female  on Treatment for 1 to 6 months (Patient) 	2	4	2	Female	25-34	6/27/2011 6:05:01 PM	Well, I started with the starter pack and into my 3rd month now. I really dont have many complaints, except the acne!!! Out of all the side effects I get acne. The reason I took seasonique was because I hate getting periods, so 4 a year instead of 12 sold me. I have not had my first period yet, which will be in 3 weeks, so I'm a little nervous there. I have had a little spotting, but nothing to complain about, usually if I take the pill around the same time, the spotting doesnt happen. Also, I do have the increase of appetite too, luckily Im small framed, so I dont really mind. I will finish this packet and see how things go otherwise back to Yaz it is, which helped keep my skin clear!
Endometriosis	AngelMyne, 25-34 Female  on Treatment for less than 1 month (Patient) 	1	5	1	Female	25-34	6/9/2011 12:35:21 AM	Im having an adverse reaction. Numbness of the nose spreading to the upper lip and now the lower lip. Ive taken the med for only 2 weeks now. It other wise seemed to have no other problems for me other then a slight headache off and on for the first week? I cant find any mention of Facial Numbness for this drug and I May be the only one to experience this as a side-effect.
