Abnormal Heart Rhythm	Mary, 65-74 Female  on Treatment for 1 to 6 months (Patient) 	4	4	3	Female	65-74	6/23/2011 12:09:35 AM	67 yr old female, mitral valve surgery in '62, done well since until 5 years ago when A-fib began in ernest.  Electro conversion last August, failed in Oct., ablation in March.  On Amioderone and wanting off due to severe side effects, also on Metoprolol and concur with most of the symptoms of each drug but things are controlled, however, BP's consistant @ 110/50 with 65 heart rate but VERY little energy compared to old and the side effects worry me.  Am contacting cardiologist ASAP to get weaned off them.  Otherwise, I'm trading one illness for multiple others.  Vision is already worse, night especially and I work swing shift.  Oh, the joys of getting older but I'm still here and feel blessed to be so.  Some side effects, particularly with Amiodorone appear to sometimes come on suddenly and they can be so severe that they are frightening so am checking into alternative medications.  
High Blood Pressure	45-54 Male  on Treatment for 6 months to less than 1 year (Patient) 	5	5	4	Male	45-54	6/15/2011 5:18:46 PM	works great for blood pressure.I have had a very low sex drive.
Mitral Valve Prolapse Syndrome	ashb1984, 25-34 Female  on Treatment for 2 to less than 5 years (Patient) 	5	5	4	Female	25-34	6/8/2011 3:23:00 PM	I started taking it for mitral valve, rapid heart rate and high blood pressure. I was on the extended release version at 25mg twice a day. For the first three months I had terrible stomach pains but they subsided and all my symptoms were controlled. But I've lost wieght and now no longer have high blood pressure so when I slack on the medicine it no longer controls all my symptoms. And my cardiologist just told me to drink salty drinks (propel water or gatorade) which I dislike. Don't really know what to do...
High Blood Pressure	oldunk2523@Google.com, 75 or over Male  on Treatment for 2 to less than 5 years (Patient) 	4	5	5	Male		6/5/2011 9:01:21 PM	I have High Blood pressure and have had a stroke in my lungs. This medication has been no problem at all.But now that my Dr. is in the Hospital herself I've ran out of &quot;Metoporol&quot;.I don't know when I'll be able to see a doctor.It takes a month or more to get an appointment. 
Abnormal Heart Rhythm	Duume, 75 or over Male  on Treatment for 2 to less than 5 years (Patient) 	4	4	4	Male		6/1/2011 4:14:28 PM	  I BELIEVE the reason for me taking this was 'abnormal heart rhythm'. The real reason is that my heart guy prescribed it.
High Blood Pressure	fernbanks, 45-54 Female  on Treatment for less than 1 month (Patient) 	5	5	1	Female	45-54	5/29/2011 12:42:21 PM	Began taking 25 mg 2xdaily two weeks ago. BP numbers lowered quickly to very good levels however, I became EXTREMELY fatigued, woke up during the night for 1-3 hours, became nauseated off and on during the day, and had frequent headaches. Switched a few days ago to Amlodipine (Norvasc) 2.5 mg1xdaily and fatigue is almost gone as well as the headaches. I am experiencing some swelling in my feet and ankles which I did not have with the metoprolol. I am also concerned with the effects this new RX may have on my gums and teeth. I have a feeling that this may not be my permanent BP med either.
High Blood Pressure	rikers, 55-64 Male  on Treatment for 1 to less than 2 years (Patient) 	4	5	5	Male	55-64	5/27/2011 10:10:08 PM	I was greatly suprised, happy and satified with medication since my phuysician started me on it, I said heres another pressure drug the physician is experimenting on me, but unbeliveability after several weeks my blood pressure was better than normal as a matter of fact it scared the hell out of me 118/72 no I can't belive this I'd better take my pressure again, again 121/71, less than hour later I took it again 122/68 oh hell I think maybe its getting to low oh! oh! ER here I come but at the triage the nurse sayed your blood pressure is fine 120/72 damn trip to ER for nothing. since then I have been taking this medication every day on time thank you pharmaceutical company for this blessing.
Abnormal Heart Rhythm	polly, 75 or over Female  on Treatment for 1 to less than 2 years (Patient) 	3	5	5	Female		5/27/2011 8:02:42 PM	
Ventricular Rate Control in Atrial Fibrillation	T8erchip, 45-54 Male  on Treatment for 1 to less than 2 years (Patient) 	4	4	3	Male	45-54	5/24/2011 11:19:53 AM	I've been taking this for 1.5yrs for Afib. Take it everyday on time and no excessive alcohol. Hangovers are twice as bad when on this drug. I've had a weight gain around my stomach. Seems to work when used right.
High Blood Pressure	butchie 111, 55-64 Male  (Patient) 	4	4	4	Male	55-64	5/23/2011 11:17:41 PM	blood pressure well controled.feeling tired
High Blood Pressure	BYRD, 55-64 Male  on Treatment for 2 to less than 5 years (Patient) 	4	5	3	Male	55-64	5/13/2011 6:35:00 PM	I agree with all that opined that it does make one tired and lathargic. Getting to sleep at night (9pm) is no problem, its the nightmares that awakens me at 4am, and of course never go back to sleep. But, hey ! Im still ALIVE.
Heart Attack	55-64 Female  on Treatment for 6 months to less than 1 year (Patient) 	4	4	3	Female	55-64	5/10/2011 9:17:46 AM	I am worried that I may have another heart attack.  I feel that my doctor is not given me enough preventive treatment.  This medication is working, I guess.
Angina	Goldie, 45-54 Female  on Treatment for less than 1 month (Patient) 	2	3	1	Female	45-54	5/10/2011 8:20:43 AM	I have been taking this med for two weeks and it's the worst...I've never felt so tired in my life! I have told my doctors that I want to cut the dosage in half...25mg to 12mg and start weaning me off immediately. I am also afraid to go to sleep fearing my heart may stop! I wish I never started this med!
Heart Attack	Jimmy, 65-74 Male  on Treatment for 6 months to less than 1 year (Patient) 	5	5	5	Male	65-74	5/9/2011 8:16:09 PM	I take one for breakfast and one for dinner, with food as per instructions, Since last year 11-21-2011 till today. Very happy with this medication.
High Blood Pressure	65-74 Female  on Treatment for 6 months to less than 1 year (Patient) 	3	4	1	Female	65-74	5/7/2011 11:39:25 PM	This drug has not reacted well with me.  It has made me very tired all the time and I have no energy.  Very unlike me, in fact I am on the Depressed side at the moment.
Heart Attack	35-44 Male  on Treatment for 6 months to less than 1 year (Patient) 	5	5	4	Male	35-44	5/5/2011 10:28:05 PM	
High Blood Pressure	45-54 Female  on Treatment for less than 1 month (Patient) 	4	1	1	Female	45-54	4/30/2011 9:09:22 PM	feeling dizzy, feeling nervous, makes pulse rate go down.  am now taking 1/2 two times a day instead of the whole pill.
Mitral Valve Prolapse Syndrome	45-54 Female  on Treatment for 1 to 6 months (Patient) 	4	3	2	Female	45-54	4/26/2011 9:39:34 AM	At first i was dizzy and tired all the time, that has subsided, but now i am losing my eyelashes!!
High Blood Pressure	25-34 Female  on Treatment for 1 to less than 2 years (Patient) 	3	5	2	Female	25-34	4/26/2011 7:16:55 AM	
Ventricular Rate Control in Atrial Fibrillation	Kittykat122, 55-64 Female  on Treatment for 2 to less than 5 years (Patient) 	5	5	5	Female	55-64	4/25/2011 1:53:33 PM	I have been very lucky with this drug.  I haven't had any side effects and it works really well.  
Additional Medications for Treating Pheochromocytoma	Dawn A. Smith, 35-44 Female  on Treatment for 6 months to less than 1 year (Patient) 	2	5	1	Female	35-44	4/24/2011 8:34:58 PM	It worked for a while in conjunction with Diovan HCT, but now my bp is up again after 6 months of use.
High Blood Pressure	Morgan's Nana, 65-74 Female  on Treatment for less than 1 month (Patient) 	3	3	1	Female	65-74	4/19/2011 4:01:41 PM	Took this medication 1 day and my heart rate went down to 41.  Guess it just was not for me.
High Blood Pressure	redaceaz, 65-74 Male  on Treatment for 1 to 6 months (Patient) 	2	3	1	Male	65-74	4/9/2011 1:50:27 PM	I read that one of the side effects of this drug is &quot;vivid dreams&quot;.  To say the least it's more like nightmares!
High Blood Pressure	Ginny, 35-44 Female  on Treatment for less than 1 month (Patient) 	5	5	5	Female	35-44	4/7/2011 2:05:36 PM	Last week I went to the doctor and my bp was 146/86, she put me on Metoprolol Tartrate 25mg daily and within the week it went down to 117/76! I also have noticed less anxiety and had no idea this medication treated that symptom too! I have had no side effects other than being super tired the first day, now I'm up and at 'em.
Abnormal Heart Rhythm	Koukla, 55-64 Female  on Treatment for 5 to less than 10 years (Patient) 	4	5	3	Female	55-64	4/6/2011 7:27:38 PM	I've gotten ringing in my ears recently.If I stop taking the drug will it go away?
Other	RuthDV, 45-54 Female  on Treatment for 5 to less than 10 years (Patient) 	4	3	3	Female	45-54	3/30/2011 11:27:05 AM	I'm embarrassed to say I've been on this med. for 8 years now, and today was the first time I looked at all of these patient reviews! And now, I'm wondering. I took 50 mg. per day of Metoprolol for years, due to extreme tachycardia (NOT high BP), and didn't really notice any harsh side-effects. It controlled my heart-rate wonderfully. (Brought it down from my normal resting heart-rate of 137! - to a normal 90 or so.) But just prior to my double-mastectomy (for breast cancer) in April 2010, my cardiologist upped my dosage to 75 mg. of Metoprolol a day, as my anxiety level was through the roof. Ever since my experience with breast-cancer, I believed some of my new &quot;side-effects&quot; were all being caused by the cancer-drugs I'm taking ... but I'm seeing here that various reviewers are also experiencing these same side-effects:  numbness and tingling in hands/fingers, joint pain, insomnia, and weight-gain. I never thought about attributing any of these side-effects to my increased dosage of Metoprolol! And the hand/finger numbness/tingling/joint pain has become unbearable, ever since last Spring ... getting worse every month now. Perhaps it's also an unknown drug interaction? (Metoprolol combined with my cancer-drugs?) Hmmmm ... I think I need to call my cardiologist, and see her again soon. After all these years, I may have to try something else that does NOT have these side-effects. I'm a fine artist and cannot live without FUNCTIONING hands!
High Blood Pressure	Judie, 65-74 Female  on Treatment for 2 to less than 5 years (Patient) 	4	5	4	Female	65-74	3/30/2011 3:44:38 AM	I had double bypass nearly 4 years ago. Since then I take 150mg twice a day and 5mg lisinopril. My bp and heart rate stay low IF I watch sodium intake which is important. I have tiredness and get anxious but I keep busy, dont dwell on it and keep my mind active. I work out twice a week at fitness center which helps greatly. I do the cardio water aerobics and recumbant bike.  Working out helps keep bp down and people should not think that medicine alone is enough.  Excercise and proper diet is a hugh contibuting factor. I would like to decrease my dosage and am going to discuss this with my doctor and cardiologist.  
Other	conquered, 65-74 Female  on Treatment for less than 1 month (Patient) 	2	2	1	Female	65-74	3/27/2011 7:56:38 PM	chest pain, irregular heartbeat low cholesterol
High Blood Pressure	Happy, 65-74 Male  on Treatment for 2 to less than 5 years (Patient) 	5	5	5	Male	65-74	3/27/2011 3:07:22 PM	Taken 12 1/2 mg once a day for two years (had 6 bypasses) BP averages 118/54. So far no side effects.
Abnormal Heart Rhythm	GA PEACH, 65-74 Female  on Treatment for less than 1 month (Patient) 	1	2	1	Female	65-74	3/25/2011 6:12:11 PM	I was prescribed this medication (12.5 MG)to lower my heart rate which was extremely high only ONE time. I was already taking lisinopril and hydrochlorothzide for high blood pressure. This drug is awful. I've taken it twice and won't be taking it again.  First time I had mild problems going to sleep, neck &amp; back pain, and itched all over. The second time I did not sleep the entire night, had same itching sensation, and found my self gritting my teeth.  I won't be taking this again.
Acute Syndrome of the Heart	Mike, 65-74 Male  on Treatment for less than 1 month (Caregiver) 	1	1	1	Male	65-74	3/13/2011 9:39:28 PM	EVery time I take this medication,I don't feel good. It give me a fast rate in my heart.
High Blood Pressure	jnut604, 25-34 Female  on Treatment for 1 to 6 months (Patient) 	2	5	2	Female	25-34	3/12/2011 9:54:35 AM	I have been on this for about a month. I feel out of it all day, extremely tired, dizzy and depressed to the point where i am just going through the days motions. It has helped lower my blood pressure, which is hereditary &amp; not that high. But at what cost? I am taking 50mg once a day. I am going to call my doctor &amp; wean myself off. Not worth it to feel this way.
High Blood Pressure	cgbrownwilliams@yahoo.com, 65-74 Female  on Treatment for 1 to 6 months (Patient) 	3	4	2	Female	65-74	3/10/2011 2:24:42 PM	Since taking my blood pressure is a little on the low side. Also my pulse is  running in the mid 60's to mid 50's.
Acute Syndrome of the Heart	Metoprolol Tartrate, 55-64 Female  on Treatment for 6 months to less than 1 year (Patient) 	5	5	5	Female	55-64	3/9/2011 8:34:58 AM	Make me sleepy
Heart Attack	Poodles01, 65-74 Male  (Patient) 	5	5	5	Male	65-74	3/9/2011 12:47:15 AM	Had very few heart related symptoms since starting this medication 11 years ago after a MI.
Abnormal Heart Rhythm	ashwee, 19-24 Female  on Treatment for less than 1 month (Patient) 	2	5	1	Female	19-24	2/25/2011 1:47:37 PM	does this drug make you dizzy
High Blood Pressure	45-54 Male  on Treatment for less than 1 month (Patient) 	3	3	3	Male	45-54	2/16/2011 11:18:11 AM	want more info on this medication
Heart Attack	Frisco, 65-74 Male  on Treatment for 1 to less than 2 years (Patient) 	4	5	4	Male	65-74	2/7/2011 8:16:04 AM	Do have dizzy spells when I suddenly get up from sitting but it has lowered my blood pressure and my side effects are minimal. 
High Blood Pressure	35-44 Female  on Treatment for 1 to 6 months (Patient) 	5	5	5	Female	35-44	1/22/2011 6:08:48 PM	
Heart Attack	gfk756, 45-54 Male  on Treatment for 10 years or more (Patient) 	5	5	5	Male	45-54	1/22/2011 8:01:08 AM	no problems with my heart since starting this treatment 20 years ago
Abnormal Heart Rhythm	65-74 Female  on Treatment for 1 to 6 months (Patient) 	5	5	5	Female	65-74	1/20/2011 12:43:06 AM	
Abnormal Heart Rhythm	65-74 Male  on Treatment for less than 1 month (Patient) 	4	4	4	Male	65-74	1/3/2011 2:33:27 PM	
A Continuous Squeezing Pain in the Chest	Spaceymae, 25-34 Female  on Treatment for less than 1 month (Patient) 	3	3	3	Female	25-34	12/23/2010 9:30:23 AM	just started this pill yesterday.
High Blood Pressure	65-74 Male  (Patient) 	2	4	3	Male	65-74	12/14/2010 6:03:07 PM	
Other	55-64 Female  on Treatment for 5 to less than 10 years (Patient) 	4	5	4	Female	55-64	1/13/2011 2:18:41 AM	my bp norm 112/69 but spikes to 215/97 when anxiuos or dehydrated. Spikes still occur with regular metoprolol use.(?)Inow have serious symptoms of psoriosis(sp?)after 5yr use of same.Use no other meds. Dosage: 25mgx2daily. Do not experience BP spike if I miss a dose. BP avg while on Metoprololis 116/67. 
High Blood Pressure	55-64 Female  on Treatment for 6 months to less than 1 year (Patient) 	5	5	1	Female	55-64	12/14/2010 5:07:33 AM	Taking 50 mg per day.  Also take Lisinopril, 20 mg.  Until I read the reveiws here, I wasn't sure if this drug was causing my problems; still not totally sure but problems started with this med.  I was always a good sleeper, but now wake up after just a few hours of sleep and it takes hours to get back to sleep.  Started clenching my teeth; anxiety.  Have had stress in my life all the time and never did this before.  Glad to read the weaning info; plan on doing that and talking with dr. at next appt.
High Blood Pressure	55-64 Male  on Treatment for 6 months to less than 1 year (Patient) 	3	3	2	Male	55-64	12/12/2010 8:12:09 PM	Seem to experience a breathing problem when I do light exertion.  Never had this feeling before this drug.
Abnormal Heart Rhythm	waddles, 55-64 on Treatment for less than 1 month (Patient) 	2	5	2		55-64	12/9/2010 10:28:13 AM	copd also; lopressor caused slight heart pains for a few weeks but did lower heartbeat; average on bp
Angina	55-64 Female  on Treatment for less than 1 month (Patient) 	4	5	4	Female	55-64	11/25/2010 2:31:51 PM	I tend to get a little tired sooner then I would have before.
Ventricular Rate Control in Atrial Fibrillation	dmbhr1, 55-64 Female  on Treatment for 5 to less than 10 years (Patient) 	4	4	1	Female	55-64	11/19/2010 7:59:42 AM	I was diagnosed 5 years ago with A fib and put on this drug. It did not control the A fib so Flecainide was added.  Eventually, I had a heart ablation that corrected the A fib but then I developed PAC's &amp; Atrial Tachycardia.  I have been on this drug for 5 years and have gained 70 lbs. I too have experienced extreme fatique, hair loss and depression which I now take Pristique for.  Had my 2nd heart blation in July and just slowly weened myself off the Toporol.  Still taking the Flecainide and going to my doctor today for follow-up.  He will not be happy with me when he hears I stopped the Toporol.  I lost 6.5 lbs the first week off the drug.  I really believe this drug is effective for heart arrythmeas but everyone should seek out all options.  Heart Ablation is a good option but you do have to stay on meds until it works.  Results are not immediate.  For me, I'm convinced stress, caffeine and alcohol all affect heart rate.
Angina	55-64 Female  on Treatment for 2 to less than 5 years (Patient) 	3	5	3	Female	55-64	11/13/2010 12:03:27 AM	Every few months I have an angina attack
Abnormal Heart Rhythm	HealthyAnne68, 65-74 Female  on Treatment for 1 to less than 2 years (Patient) 	5	3	2	Female	65-74	11/10/2010 7:16:47 PM	This medication makes me extremely fatigued.Also I notice that my hair seems to be thinning.
Other	45-54 Female  on Treatment for less than 1 month	5	5	5	Female	45-54	11/3/2010 10:46:11 AM	I take 25mg twice a day for SVT. I hesitated taking medication because I was afraid. I feel very good on this medication.
High Blood Pressure	julie, 65-74 on Treatment for 6 months to less than 1 year (Patient) 	2	5	5		65-74	11/3/2010 12:37:16 AM	
High Blood Pressure	Sunshine, 55-64 Female  on Treatment for 1 to 6 months (Patient) 	4	4	3	Female	55-64	10/23/2010 9:37:55 PM	I have nausea and am more tired at the end of the day.  Some heartburn.
Abnormal Heart Rhythm	metoprol, 45-54 Female  on Treatment for less than 1 month (Patient) 	2	3	2	Female	45-54	10/20/2010 10:22:42 AM	I still have heart palpatations in the afternoon and evening
Migraine Prevention	Tranny, 75 or over Male  on Treatment for 1 to 6 months (Patient) 	2	5	1	Male		10/16/2010 7:15:32 PM	Side effects: lethargy, tire easily, shallow sleep: readily wake up and go back to sleep, joint pains. Effective for migranes and hypertension, but the price in suffering is too high.
High Blood Pressure	Vickie, 75 or over Female  on Treatment for 6 months to less than 1 year (Patient) 	1	1	1	Female		10/16/2010 6:35:54 AM	First of all, we were put on this Medication, Metoprolol Tartrate Oral about 9 month's ago and it is Terrible. I am not able to sleep at night, my leg's and ankle's are extremely swollen and my blood pressure has shot up from 125/80 to 190/92. But during the daytime, I am all doped up and tired.To each as own, but I do not recommend this Medication to anyone. The Side Effects are Terrible.
High Blood Pressure	rclay123, 65-74 Male  on Treatment for 2 to less than 5 years (Patient) 	3	3	3	Male	65-74	10/11/2010 2:10:48 PM	Started meto tar 50mg twice daily after coronary bypass x2 36 mos ago.. BP 140/70.. after 24 mos started having angina, headaches &amp; dark urine.. reduced dosage to 1/2 tab twice daily for 8 wks, headaches reduced somewhat, angina still moderate, BP OK @ 140/75... I've sched coronary Dr appt for next week.
Heart Attack	jb, 25-34 Male  on Treatment for 1 to 6 months (Patient) 	5	5	4	Male	25-34	10/6/2010 11:52:58 AM	I think it is making me break out or a rash on my forehead? Anyone else have this?  email me please  glockfup@aol.com33 year old male
High Blood Pressure	Kat, 55-64 Female  on Treatment for 1 to less than 2 years (Patient) 	5	5	5	Female	55-64	9/22/2010 10:50:42 PM	It lowers my BP, but I was told by a friend not to take my 1 mg of alprazolam 1 mg with  it. Does this harm me?Thank you
Ventricular Rate Control in Atrial Fibrillation	55-64 Male  on Treatment for 1 to 6 months (Patient) 	4	4	2	Male	55-64	9/17/2010 8:04:31 PM	Very tired and want to eat everything insight. Not good for someone with Heart problems. Lose concentration and want to Nap all the time. I am going to see if my Doctor has anything else. 
Ventricular Rate Control in Atrial Fibrillation	t8erchip, 45-54 Male  on Treatment for 6 months to less than 1 year (Patient) 	2	5	1	Male	45-54	9/16/2010 10:21:49 AM	Dr. took me off Pacerone (it worked at keeping my heart rate regular) but he thought this was better, and put me on Metoprolol. What a mistake.. It doesn't work. Heart rate is not regular. I gained weight around my waist really fast. 30lbs in six months, And my hair is falling out. Going to Dr. and changing back ASAP!
Abnormal Heart Rhythm	65-74 Female  on Treatment for 2 to less than 5 years (Patient) 	3	3	3	Female	65-74	9/9/2010 1:36:35 PM	
Overactive Thyroid causing Life-Threatening Symptoms	Kathy, 45-54 Female  on Treatment for 2 to less than 5 years (Patient) 	3	2	2	Female	45-54	9/8/2010 4:44:55 PM	I was prescribed Metoprolol after receiving radioactive iodine for Graves disease.  I also take this in conjunction with Lisinopril for high blood pressure.  It seems that this medication worked for a few years but now I am trying to determine what really is the cause to my side affects, which are:  Erratic heart rate (usually on the high side).  However, in the past week, BP reduced to 100/70 and I have fainted 5 times in the past 2 weeks.  I have hives all over my body, extreme fatigue, memory loss, vertigo, dry eyes, numbness in hands, swelling, lithargic and my hair is falling out.  Is this really helping me or hurting me?  I'm miserable. 
High Blood Pressure	stickslm, 55-64 Male  on Treatment for 1 to less than 2 years (Patient) 	3	3	3	Male	55-64	9/6/2010 9:11:04 AM	
Abnormal Heart Rhythm	ellie, 45-54 Female  on Treatment for 1 to 6 months (Patient) 	4	4	3	Female	45-54	9/5/2010 5:46:55 PM	overall good but made me feel tired and possible depression, I just hate having to be on meds.drink truly 8 x 8 ounces of water truly every day no matter what and exercise diligently to the full extent your doc says is ok and you will feel great
High Blood Pressure	skyhounds, 45-54 Female  on Treatment for 1 to 6 months (Patient) 	5	5	4	Female	45-54	8/29/2010 11:34:36 AM	This drug has reduced my BP, only problem I have found is sweating, in cold A/C you are dripping with sweat
High Blood Pressure	75 or over Male  on Treatment for 1 to 6 months (Patient) 	3	5	3	Male		8/25/2010 4:35:14 PM	
Abnormal Heart Rhythm	x643qc, 65-74 Male  on Treatment for 1 to 6 months (Patient) 	3	3	2	Male	65-74	8/19/2010 6:21:53 PM	
Abnormal Heart Rhythm	65-74 Female  on Treatment for 2 to less than 5 years (Patient) 	4	5	3	Female	65-74	8/13/2010 10:59:54 AM	This medication makes me extremely fatigued.
High Blood Pressure	35-44 Female  on Treatment for 1 to less than 2 years (Patient) 	3	5	1	Female	35-44	8/11/2010 11:03:47 PM	Has lowered my blood pressure however has lowered my heart rate into the 50's, causing chronic fatigue.  I was switched to this after an allergic reaction to lisinopril.
High Blood Pressure	scoobie61, 45-54 Female  (Patient) 	4	4	4	Female	45-54	8/2/2010 12:29:09 PM	
High Blood Pressure	morristhecat, 55-64 Male  on Treatment for 2 to less than 5 years (Patient) 	5	5	3	Male	55-64	7/29/2010 3:13:30 PM	has caused ED i believe, very unhappy about that, fatigue possibly, weight gain possibly, &amp; now nagging dry cough possibly. have taken 50 mg AM &amp; PM for 4-5 yrs now. changing drs &amp; will try some other BP rx soon i hope !!
Abnormal Heart Rhythm	steve, 45-54 Male  on Treatment for less than 1 month (Patient) 	2	5	1	Male	45-54	7/25/2010 9:54:16 PM	Was on Corgard for twenty years and all was good until three weeks ago when hr was 112 in Doctors office,went this week to a heart rhythm guy and started me at 50 mg twice daily.pretty scared was only taking  Corgard 10 mg am and 20 mg pm.Not sure yet but just now took my fourth dose and before my hr was 105 at rest.Give some input about 100mg daily.Thanks.
Abnormal Heart Rhythm	55-64 Female  on Treatment for 2 to less than 5 years (Patient) 	5	5	5	Female	55-64	7/15/2010 10:11:46 AM	
High Blood Pressure	trish, 45-54 Female  on Treatment for 6 months to less than 1 year (Patient) 	4	5	3	Female	45-54	7/8/2010 11:36:42 AM	does anyone have a problem with diarrhea? I had to increase the medicine to lower my BP and now I have this problem,
High Blood Pressure	toola, 45-54 Female  on Treatment for 6 months to less than 1 year (Patient) 	4	5	4	Female	45-54	6/20/2010 1:00:21 PM	has worked better for me than lisinopril
Heart Attack	65-74 Male  on Treatment for 10 years or more (Patient) 	5	5	5	Male	65-74	6/17/2010 4:25:46 PM	
Heart Attack	35-44 Female  on Treatment for 1 to 6 months (Patient) 	3	4	1	Female	35-44	6/15/2010 3:04:51 PM	started on this med. along with zestril after a heart attack to help heal the damage and increase survival rate. never had bp probs. and when first began my bp would drop to 68/52 before takin the med! i have been on it almost 3 mo. now and the sluggish drained no energy feeling cont to worsen and my muscles now feel so tired and heavy..when walking i take frequent breaks due to being wore out..im 42 and feel to be 70...my dr. seems to hav no concern .
