High Blood Pressure	p3wydq, 75 or over on Treatment for 1 to less than 2 years (Patient) 	4	4	4			6/15/2010 11:42:11 AM	good  effect
Abnormal Heart Rhythm	25-34 Female  (Patient) 	4	4	4	Female	25-34	6/14/2010 12:52:14 AM	
Abnormal Heart Rhythm	19-24 Female  on Treatment for 1 to 6 months (Patient) 	5	5	5	Female	19-24	6/13/2010 1:40:48 PM	I was diagnosed with SVT and an arrythmia after pulse reached 280bpm for over 45 minutes. I have been on the medication for a month and have not had any more episodes.A 25 mg dosage has been very effective, although my bp has been slightly low. 
High Blood Pressure	confsprts, 65-74 Female  on Treatment for 2 to less than 5 years (Caregiver) 	4	4	3	Female	65-74	6/9/2010 8:49:29 PM	Does this cause swelling?  My mother and sister are both on this and are experiencing swelling of ankles and feet.  After discussion with mom's doctor, I was told there is no relation and this is not a known side effect.
High Blood Pressure	35-44 on Treatment for 1 to 6 months (Patient) 	5	5	5		35-44	6/4/2010 9:16:50 PM	I am experiencing alot of sweating in cold aircondition and irritation. Otherwise BP stays normal. I need to know more on side effects.
High Blood Pressure	MARTY, 55-64 Male  on Treatment for 6 months to less than 1 year (Patient) 	3	3	3	Male	55-64	5/30/2010 12:58:50 PM	ALTHOUGH IT DID SOMEWHAT BRING BP DOWN ,I STILL NEEDED LOTENSIN TO GET BELOW 90 DIASTOLIC I NOTICED WEIGHT GAIN, I AM A RUNNER AND IT HAS AN EFFECT OF SLOWING THE HEART RATE WHICH DOES MAKE SPORTS ACTIVITY FEEL SUGGISH AS WELL FROM THIS I NOTICED WEIGHT GAIN OF 10 LBS, AND IN SPITE OF MY RUNNING ON HILLS AND ROADS FOR 30 MINS I CAN'T SEEM TO LOSE THE EXTRA WEIGHT.  I AM GOING TO WEAN OFF IT EVERY OTHER DAY 1/2 DOSE AND GIVE IT UP... MY STRESS LEVELS HAVE DECREASED WITH UNEMPLOYMENT AND FINANCIAL SCARES ,SO I THINK I CAN DO IT, WILL WATCH IT . I DON'T LIKE THE EXTRA WEIGHT AND SLUGGISH FEELING, ACHING MUSCLES ARE TIGHT MORE SO THAN SHOULD BE FROM RUNNINGI WIL RELY ON MEDITATION, YOGA AND DIET ,AVOIDING AGGRAVATION. :)
High Blood Pressure	rsalvato, 65-74 Male  on Treatment for 1 to 6 months (Patient) 	1	5	1	Male	65-74	5/29/2010 9:24:34 AM	this medication has not helped lower my blood pressure
Abnormal Heart Rhythm	45-54 Female  on Treatment for 1 to 6 months (Patient) 	3	3	2	Female	45-54	5/22/2010 1:23:45 AM	My dr. switched me from propranalol to metoprolol due to potential issues with asthma. In just over a month, I have gained 5 lbs., experience more gas/bloating, difficulty concentrating and sleeping, and reduced sexual function.  While it helps the palpitations (not nearly as well as propranalol), I don't think it's worth all the negative side effects.  I will be asking my dr. for something else.  (Propranalol is much better in all respects except greater sexual dysfunction, which is also not acceptable.)
High Blood Pressure	Beast, 45-54 Male  on Treatment for 1 to 6 months (Patient) 	4	4	2	Male	45-54	5/21/2010 6:27:33 PM	I was prescribe this medication about a year ago at 49 years old. At first i took it sparenly and then stopped. I stopped to try different herbs that was said to help BP such as, CoQ-10, Garlic, Grape Seed Extract, and Fish Oil. I noticed my bp looking better with the herbs, but it was still slightly high. So about 5 months ago i started to take this medication on a daily basis. Since then i have noticed Frequent urination, blurred vision, weight gain (almost 20 lbs), leg pain, tingling in my feet and toes, awful joint pain and the most scariest of all(CHEST PAIN). After reading about 125 reviews by other people, i truly believe, this medication is the root of most of my problems. I scheduled a stress test next week because of the chest pain. But now i think i know where the chest pain is coming from. HBP runs in my family, so i'm pretty sure i'll have to deal with it the rest of my life, but it's got to be a better way. I love working out, but since this medication, i have so many aches and pains, it has caused me to have to stop some of my routines. i don't know if losing weight with exercise and diet changes will help, but, i'm going to give it a try. Thanks for the reviews, it has really helped me with a lot of questions!
Abnormal Heart Rhythm	55-64 on Treatment for 2 to less than 5 years (Patient) 	4	5	4		55-64	5/20/2010 11:44:53 AM	I was diagnosed with mitral valve proplapse 28 yrs. ago.  I was taking Inderal as needed until 2 years ago.  Went to a different Cardiologist and she told me I didn't have MVP I had irregular heart beat which causes palipitations.  She put me on this drug and I take 25 mg. twice a day.  It works most of the time.  If I'm tired, stressed, drink alcohol or eat/drink anything with caffiene it doesnt work.  I'm not tired and have low blood pressure but have always had low blood pressure, no weight gain.  I work out 3 times per week and eat healthy most of the time.  Overall it works and stops the palipitations.  If I miss a dose I start having the palipitations.  
Abnormal Heart Rhythm	75 or over Male  on Treatment for 5 to less than 10 years (Patient) 	5	5	5	Male		5/20/2010 8:59:39 AM	Has worked well for AT
Angina	55-64 Male  on Treatment for 1 to 6 months (Patient) 	1	1	1	Male	55-64	5/16/2010 7:15:31 PM	DID NOT WORK   STILL HAVE CHEST PAIN
High Blood Pressure	65-74 Male  on Treatment for 1 to less than 2 years (Patient) 	3	5	3	Male	65-74	5/11/2010 7:37:19 PM	HEART RATE STILL GOES UP
High Blood Pressure	sh64, 45-54 Female  on Treatment for 1 to 6 months (Patient) 	5	5	5	Female	45-54	5/11/2010 5:03:20 AM	I was having a fast heart rate and my bp was high 154/90 pulse 115. Dr.put me on this med and now it is down to 118/80 pulse 88.NO SIDE AFFECTS.
High Blood Pressure	55-64 Female  on Treatment for 5 to less than 10 years (Patient) 	4	5	5	Female	55-64	5/7/2010 12:53:34 PM	I use this in addition to using diovan.Together my B/P went from 200/110 to an average of 115/60. i have been on them for 5 years.
Abnormal Heart Rhythm	kpeemck, 45-54 Male  on Treatment for 1 to 6 months (Patient) 	2	4	1	Male	45-54	4/27/2010 6:07:09 PM	rash &amp; skin blotches aon my stomach chest and my back. can be very itchy at times
High Blood Pressure	55-64 Female  (Patient) 	1	5	1	Female	55-64	4/26/2010 9:42:19 AM	I'M TAKING 100 MG.NIGHTLY. DO NOT LIKE THE MED.THE FIRST NIGHT I ITCHEDALL NIGHT, AND I COULD FELL MY HEART RACING AND HAD A COUGH I'VE BEEN ON TOPROL XP AN HAVE HAD NO SIDE AFFECT. I'M GOING BACK FOR TOPROL XP 
High Blood Pressure	peggy, 55-64 on Treatment for 2 to less than 5 years (Patient) 	5	5	5		55-64	4/22/2010 8:25:20 AM	this medication keeps my blood pressure in normal range.
High Blood Pressure	Betty, 65-74 Female  on Treatment for 6 months to less than 1 year (Patient) 	5	5	5	Female	65-74	4/20/2010 4:06:06 PM	Taking 100 mg per day. It worked to bring down the BP and eliminate the extra heart beats. But the side affect I had is serious rash on neck and face. Looked like someone had thrown hot water on me and high sensitivity to sun and heat.Swelling of face and neck. Dr cutting to 25 mg per day to regulate BP. Will see how that works for me. Has anyone experienced serious rash issues? 
Anxious	65-74 Female  (Patient) 	4	5	4	Female	65-74	4/20/2010 9:23:50 AM	
High Blood Pressure	25-34 Female  on Treatment for less than 1 month (Patient) 	1	3	1	Female	25-34	4/19/2010 12:58:46 AM	I don't like this drug at all!! I have been on it for just a couple of days and I don't know why but shortly after taking it i get super hot and start sweating.  i was given this drug in the hospital for high heart rate and blood pressure that wouldn't come down and I don't like the way that it makes me feel.  I still have the pain and I swear it feels like my heart is still beating fast and skipping beats so I will be calling my dr tomorrow because I don't like this med at all and think that there has to be something different out there that can help me with out all the uncomfortable side effects
High Blood Pressure	Marv , 45-54 Male  on Treatment for 2 to less than 5 years (Patient) 	4	4	4	Male	45-54	4/15/2010 9:00:17 PM	Do not miss ah dose or BP will rise but all &amp; all it works well for me so far !
High Blood Pressure	Snowflake, 65-74 Male  on Treatment for 1 to 6 months (Patient) 	4	5	3	Male	65-74	4/15/2010 1:49:47 PM	My High Blood Pressure has dropped to 118/65
Hypertrophic Cardiomyopathy	lovemyheart, 35-44 Female  on Treatment for less than 1 month (Patient) 	4	4	4	Female	35-44	4/8/2010 10:47:11 AM	I had refused to take this drug because of the reviews, went to Dr's again and I talked to him, he said my symtoms could get worse, I started on 3/15 and my heart is now calm, not running a mile a minute, It makes me (body) calm:).I'm very pleased and wished I had started it sooner. when I feel anxiety ( a dailey symptom) my heart stays regular beat and I'm able to recoup quickly. I have to take this drug for the rest of my life, again, I wish I had taken this med sooner, my life would've been more enjoyable. I did have nightdreams, nightsweats those seem to be subsiding... so far I haven't had any weight gain. It feels good to go places and not having to worry that your heart will beat out of your chest and pass out. Thanks Dr. I feel tons better.
Hypertrophic Cardiomyopathy	tartrate2, 65-74 Male  on Treatment for 5 to less than 10 years (Patient) 	4	5	5	Male	65-74	4/7/2010 9:56:42 AM	
Acute Syndrome of the Heart	Sceptic, 45-54 Female  on Treatment for less than 1 month (Patient) 	4	5	4	Female	45-54	4/4/2010 3:12:40 PM	Was afraid of taking this medication because of some of the reviews.After a second opinion I decided to take this medication and so far I am starting to feel a little better.I have only been taking it for a few days with no side affects.
Abnormal Heart Rhythm	dan, 45-54 Male  on Treatment for 1 to 6 months (Patient) 	5	5	3	Male	45-54	4/3/2010 9:58:57 PM	My side effects are tired all the time, constipation and some weight gain, trouble sleeping, but my heart has not skipped a beat.I was perscribed 50mg twice a day , i dropped to 25 mg twice a day, now I am going to 12.5mg twice a day. It is a strong drug.
High Blood Pressure	Ray B, 75 or over Male  on Treatment for 5 to less than 10 years	5	5	5	Male		3/30/2010 8:01:37 PM	Have been taking this medication for approx. eight years. 1/2 25mg 2xD No side effects. BP goes up only when I miss a dose.
High Blood Pressure	john, 75 or over Male  on Treatment for 1 to less than 2 years (Patient) 	2	3	1	Male		3/27/2010 2:05:50 PM	was taking 50 mg per day . iwas told to take 100 mg per day 2t per day  dos not lower blood pressure
High Blood Pressure	hatepills, 55-64 Female  on Treatment for 1 to 6 months (Patient) 	5	5	1	Female	55-64	3/25/2010 5:53:37 PM	been taking for around 3 mos. now....weight not gone despite diet...put on 25 lbs. rapidly, thought it was Holidays....hair thinning...legs &amp; ankles swell...tried to stop drug but BP soared...going back to Dr. for new med.
Diastolic Heart Failure	joni, 55-64 Male  (Patient) 	2	5	2	Male	55-64	3/25/2010 9:02:36 AM	2 many to list, I don't know if its the drug or my usual unbalanced serotonin, but am not thinking straight, tired, (suicidal?) not sleeping well, etc.
Heart Attack	metorprolol tartrate, 45-54 Male  on Treatment for 2 to less than 5 years (Patient) 	5	5	1	Male	45-54	3/24/2010 10:13:12 PM	heart rate went to 42 per minute.Get up and go got up and went. May have to have pacemaker now.
High Blood Pressure	Ray B, 75 or over Male  on Treatment for 5 to less than 10 years (Patient) 	5	5	5	Male		3/24/2010 3:34:05 PM	
Heart Attack	55-64 Male  on Treatment for 1 to 6 months (Patient) 	4	5	4	Male	55-64	3/21/2010 8:25:29 PM	i constantly feel tired with little or no energy
High Blood Pressure	ROB, 55-64 Male  on Treatment for 1 to 6 months (Patient) 	4	5	3	Male	55-64	3/20/2010 9:27:38 AM	Have been taking this for about 6 months and the headaches and lack of energy have been bad. Will talk to Dr next week about stopping this drug. Also taking 50mg of Losartan x2 daily with the Metoprolol, which replaced the horrible Lisinopril.
Abnormal Heart Rhythm	jillybean, 45-54 Female  on Treatment for 2 to less than 5 years (Patient) 	3	4	3	Female	45-54	3/15/2010 11:13:44 AM	Have been taking 100mg twice a day for 4 years, I still have abnormal heart beats and now my blood pressure is up for the weight I gained.  Can't seem to lose the weight.  I am eating 1200 calories a day and walking 60 minutes 6 days a week.
Heart Attack	45-54 Male  on Treatment for 10 years or more (Patient) 	4	4	4	Male	45-54	3/14/2010 8:07:35 PM	
High Blood Pressure	steelerfan, 45-54 Female  on Treatment for 1 to less than 2 years (Patient) 	2	4	4	Female	45-54	3/14/2010 2:38:11 PM	weight gain persistant cough dry mouth
High Blood Pressure	wein, 65-74 Female  on Treatment for 1 to 6 months (Patient) 	2	2	2	Female	65-74	3/9/2010 12:48:18 PM	Taking 25mg - 1\2 in morning - 1\2 in evening - 12 hours apart with food - not always convenient. Also heart beat can be felt almost at all times, especially when laying down. Have been taking 25mg, twice a day since end of Nov along with 150mg, twice a day of Irbesartan. Am phoning my doctor today as my blood pressure is 94 over 50 but my heart rate 68 or higher. 
High Blood Pressure	wstankiewicz, 45-54 Male  on Treatment for 1 to 6 months (Patient) 	5	5	4	Male	45-54	3/6/2010 4:27:17 PM	I started taking this med because my diastolic was no longer controlled by Plendil and HCTZ alone. I had a heart attack two years ago. Resting heart rate went from 80 to 56 which at first was scary. BP went from 135/95 to 115/78. Reccommend that you get the more expensive time release brand or cut the pill in half and take it twice a day. I took all 50 mg at once and had to sit for a couple of hours! Wierd drams sure, but at least I wake up.
Ventricular Rate Control in Atrial Fibrillation	 , 45-54 Male  on Treatment for less than 1 month (Patient) 	5	5	1	Male	45-54	3/4/2010 8:04:22 PM	I have been on the drug for 3 weeks, taking 2 - 50mg doses per day.  I am tired all the time, thirsty, can't multi-task and think as clearly as when I was not on the medicine.  I have gained about 4 pounds with no change in diet.  Have not had a heart event again so medicine is working but I need to work with my doctor to potentially reduce the dose or give me another medicine due to side effects.
High Blood Pressure	cazaia, 45-54 Female  on Treatment for less than 1 month (Patient) 	2	4	1	Female	45-54	3/3/2010 12:38:13 PM	I can't stop coughing, sometimes to the point of vomiting. I hate it. It is so annoying and my chest is sore and irritated.
Abnormal Heart Rhythm	niecey55, 55-64 Female  on Treatment for 1 to less than 2 years (Patient) 	5	5	5	Female	55-64	3/1/2010 6:09:37 PM	it work for me ihave been satisfied
A Continuous Squeezing Pain in the Chest	65-74 Female  on Treatment for 6 months to less than 1 year (Patient) 	3	4	3	Female	65-74	2/24/2010 8:13:00 PM	
High Blood Pressure	unhappy T, 35-44 Female  on Treatment for less than 1 month (Patient) 	1	5	1	Female	35-44	2/24/2010 2:07:29 PM	Prescribed this medicine because of diagnose of HBP; I am debating taking this medications because the first warning is do not stop taking suddenly; weaning process required..  who would give someone something like this to take...:(
Ventricular Rate Control in Atrial Fibrillation	sadmother, 45-54 Female  on Treatment for 6 months to less than 1 year (Caregiver) 	1	4	1	Female	45-54	2/19/2010 9:38:15 AM	this medication was not any help to my son of 24 years he has died because the medication didnt work.
High Blood Pressure	35-44 Male  on Treatment for 1 to less than 2 years (Patient) 	3	5	2	Male	35-44	2/18/2010 1:48:31 PM	
High Blood Pressure	55-64 on Treatment for 5 to less than 10 years (Patient) 	4	3	1		55-64	2/16/2010 1:33:58 AM	I have been on this medication for over 5 yrs. I am half bald, leg and hip joint pain headaches every day cannot sleep at night gained over 40 pounds. I am going to wean myself off of this med. Doctor won't listen to me. I am sad all the time.
High Blood Pressure	19-24 Female  (Patient) 	4	4	4	Female	19-24	2/8/2010 10:37:23 PM	
A Continuous Squeezing Pain in the Chest		1	1	1			2/2/2010 8:21:29 AM	
High Blood Pressure	MissMoni12010, 35-44 Female  on Treatment for 1 to 6 months (Patient) 	1	3	1	Female	35-44	1/25/2010 1:11:26 PM	Taking Metoprolol for high blood pressure taking this med(25mg-2x's a day) with lisinopril (5mg-1x aday) and they were not effective, so my dr. upped the dosage to twice as much and it just make me nauseated and have bad headaches...and it still was not effective.
High Blood Pressure	35-44 Male  on Treatment for 6 months to less than 1 year (Patient) 	5	5	5	Male	35-44	1/20/2010 11:12:05 PM	I had side effects with two prior medications, with this one I have no real issues.  I have had a few strange dreams. Overall the benefits for me have far outweighed any minor side effects.
High Blood Pressure	kathie, 45-54 Female  on Treatment for 1 to 6 months (Patient) 	1	5	1	Female	45-54	1/18/2010 6:05:45 PM	I was given this for slightly elelvated BP and heart rate (25 mg X day) - it has been nasty. I was already under treatment for fatigue and depression, and the level of both on this drug have definitely increased. I also have trouble sleeping, which doesn't exactly help the fatigue! Headache is also an issue and that feeling of being zoned out. I'm tapering off of it after 2 months of feeling worse than when I started (BP and heart rate not significantly changed either)
High Blood Pressure	hatepills, 55-64 Female  on Treatment for 1 to 6 months (Patient) 	4	5	3	Female	55-64	1/18/2010 3:05:27 PM	was taking lisinoprol which made me cough &amp; sweat BIG time--stopped all med then BP went up so started metoprolol 50 mg 2x a day...cough &amp; sweating gone and hope weight gain is from the Holidays!!!!!! BP is controlled again....no side effects so far.
Abnormal Heart Rhythm	25-34 Male  on Treatment for 5 to less than 10 years (Patient) 	3	5	4	Male	25-34	1/11/2010 10:54:08 PM	it seems to work for me but i also take 4 other bp meds so im not sure
High Blood Pressure	55-64 Male  on Treatment for 2 to less than 5 years (Patient) 	4	5	5	Male	55-64	1/8/2010 2:18:18 PM	no pain in the chest no shortness of breath
Anxious	19-24 Male  on Treatment for 1 to 6 months (Patient) 	1	1	1	Male	19-24	1/7/2010 2:23:46 AM	I experienced side effects similar to other posts. I could not sleep at night. Had to drink energy drinks to get through work...only to come home and crash on the sofa and then not sleep at night. A vicious cycle I could not break. Left me feeling worse than the reason my doctor prescribed it.
Other	TEXICAN, 65-74 Male  on Treatment for 1 to 6 months (Patient) 	4	4	3	Male	65-74	1/3/2010 9:39:43 PM	NONE OF THE SIDE EFFECTS LISTED, BUT SHORTLY AFTER BEGINNING THIS MED MY BLOOD SUGARE GOT VERY HIGH. CONTACTED DR AND HE SAID IT SHOULD NOT AFFECT MY B/S. IT'S STILL ELEVATED. HAS ANYONE HAD ANY BLOOD SUGAR PROBLEMS AFTER TAKING THIS MED??PLS ADVISETHANKS - TJB
High Blood Pressure	thankfulme, 45-54 Female  on Treatment for 6 months to less than 1 year (Patient) 	2	1	1	Female	45-54	12/30/2009 1:16:23 PM	I too have gained weight, night sweat, chest pain.  I am very tired and out of it all of the time.  I feel like I'm living a nightmare.  After reading all comments I will be visiting my doctor for a new pill.  I would not recommend this pill to anyone.  I've never been depressed before and I don't like it now.  The lack of sleep and nightmares are aweful. Here I come Dr!!!
High Blood Pressure	N/A, 55-64 Female  on Treatment for less than 1 month (Patient) 	1	1	1	Female	55-64	12/28/2009 12:30:47 AM	THIS MEDICATION MADE ME DEPRESSED, SEVERE HEADACHE, MADE MY B/P GO WAY OUT OF CONTROL,I HAD TREMORS,PROFUSE SWEATING,FATIGUE. AND WAS IN THE EMERGENCY ROOM EVERY WEEK FOR STROKE LEVEL BLOOD PRESSURES. I WAS ON THE MEDICATION FOR THREE WEEKS &amp; AFTER THE LAST TRIP TO ER I STOPPED TAKING IT ON MY OWN. I FEEL 90 PERCENT BETTER SINCE I STARTED TAKING EXFORGE AND MY B/P IS ALMOST NORMAL NOW.
Angina	senior, 65-74 Female  on Treatment for 10 years or more (Patient) 	5	5	3	Female	65-74	12/15/2009 10:47:28 AM	Controls angina well. May be making me lethargic and not sure if stomach burning and pain at night is caused by med. or something else.
High Blood Pressure	55-64 Female  on Treatment for 1 to less than 2 years (Patient) 	5	5	5	Female	55-64	12/7/2009 12:38:36 PM	
High Blood Pressure	Harvey, 25-34 Male  on Treatment for 6 months to less than 1 year (Patient) 	5	4	5	Male	25-34	12/7/2009 1:33:39 AM	My blood pressure significantly change with the use of this drug. My BP has been maintained at 130/90 from 160/110...
High Blood Pressure	Jimmy, 35-44 Male  on Treatment for 6 months to less than 1 year (Patient) 	2	2	1	Male	35-44	12/4/2009 10:05:18 PM	I started taking this as an overall &quot;get healthy&quot; routine I was implementing.  Soon after starting, I began to have cramps and insomnia.  This was tolerable untl the HORRIBLE fatigue set in.  I rapidly gained twenty pounds because I was so lethargic.  I began sleeping 10-15 hours which led me to think I was depressed.  I began sweating from the face and neck like a fire hydrant and had constant dry mouth.  I stopped taking it for a week (AMA) and I noticed right away I felt better.  My experience ended with severe (debilitating) muscle and joint pain.  This medication ruined my summer as I had no energy for recreation and was barely making it through work.  To make matters worse, my (now ex) doctor dismissed me when I complained about the severe side effects.  I think death by heart attack is better than the side effects of this medication.  Thankfully, my new doctor listened to me and got me off of this horrible drug.  If you are reading this in reference to beginning this medication, I can not be more emphatic -- DON'T!!! 
Abnormal Heart Rhythm	AMY, 35-44 on Treatment for 5 to less than 10 years (Patient) 	4	5	3		35-44	11/29/2009 1:06:28 AM	I HAVE BEEN TAKING 100MG TOPROL FOR 8 YEARS FOR HEART PALPS,, MINE ARE SO BAD I HAVE 911 ON SPEED DIAL,, I ALWAYS TTHOUGHT I WAS THE ONLY ONE THAT HAD THIS,, IT DRIVES ME CRAZY,,, amyfongerlf@yahoo.com
Abnormal Heart Rhythm	45-54 Male  on Treatment for 1 to less than 2 years (Patient) 	4	3	2	Male	45-54	11/28/2009 9:05:57 PM	on it for a year 1/2. started getting numb genitals and inability to ejaculate causing soarness and frustration. looking for something else.
High Blood Pressure	55-64 Male  on Treatment for less than 1 month (Patient) 	4	3	1	Male	55-64	11/22/2009 7:33:36 PM	Caused inability to have a normal sexual experience
High Blood Pressure	panrider, 45-54 Male  on Treatment for 1 to 6 months (Patient) 	4	5	3	Male	45-54	11/18/2009 11:07:31 AM	I take 100MG of Cozaar with this drug which doesn't work that well for HBP but no side effects. The Metoprolol definitely lowered my heart rate from the 90+ BPM to the 60 BPM area but I am starting to see side effects: Tingleling in the feet/fingers, very tired all the time and recently depressed for no reason. Stopped lifting weights and working out because I'm too unmotivated now. I do get confused and have memory loss at times. I have to try to stay focussed on things at hand more. I've only been on it for a little over 2 mths but may have to find something else. My BP used to get up to 170/102 but now stays around 130 to 160 /90 depending on what I'm doing. Good luck to you all.
High Blood Pressure	55-64 Male  on Treatment for 1 to 6 months (Patient) 	4	4	2	Male	55-64	11/3/2009 9:38:18 PM	I have lowered blood pressure, but have somenausea since taking the drug.
Anxious	25-34 Female  on Treatment for less than 1 month	1	1	1	Female	25-34	10/30/2009 7:37:49 PM	i just started it
Other	55-64 Male  on Treatment for less than 1 month (Patient) 	1	1	1	Male	55-64	10/30/2009 7:01:47 PM	I only took one days dose 2 pills and I have never been so fearful in my life as I was then.  I began to hallucinate also.  This is the worst med's I have ever taken.
Hypertrophic Cardiomyopathy	loppreser, 75 or over Male  on Treatment for 10 years or more (Patient) 	5	5	5	Male		10/28/2009 4:33:29 PM	
Hypertrophic Cardiomyopathy	65-74 Female  on Treatment for 2 to less than 5 years (Patient) 	2	1	2	Female	65-74	10/27/2009 11:32:51 AM	i am dizzy...feel weak most of the time..but i have tacacardia..not supposed to stop this medication
High Blood Pressure	manny l, 65-74 Male  on Treatment for 2 to less than 5 years (Patient) 	5	5	5	Male	65-74	10/26/2009 7:00:03 PM	
High Blood Pressure	John47302, 45-54 Male  on Treatment for 1 to 6 months (Patient) 	4	5	1	Male	45-54	10/25/2009 12:10:27 AM	Takes down my BP, But the side effectts  are terrible! Extremely severe sweating on my head/face. Frequent urination. My heart races if I forget a dose. Not sure if it's worth it.
High Blood Pressure	55-64 Male  on Treatment for 2 to less than 5 years (Patient) 	4	4	4	Male	55-64	10/23/2009 5:21:54 AM	
Other	metoprolol, 55-64 Female  on Treatment for 6 months to less than 1 year (Patient) 	4	4	4	Female	55-64	10/20/2009 1:49:48 PM	I  was admitted to the Hospital in Jan. 2009 with severe chest  pain , immobilizing body aches and diziness.I was diagnosed with severe anemia and severe aortic stenosis. I was placed on metoprolol. My chest pains have subsided significantly, have been on 9 months, but reciently in last month have had a return of chest pains but not as severe I believe due to recient weight gain and inactivity. This medication has been overall effective and relieves chest pain when taken regurarly.
Heart Attack	jazzman02, 65-74 Male  on Treatment for 2 to less than 5 years (Patient) 	3	5	3	Male	65-74	10/16/2009 1:31:35 PM	
Abnormal Heart Rhythm	55-64 Male  (Patient) 	4	5	4	Male	55-64	10/16/2009 12:33:31 AM	This medication put a stop to my irregularheartbeat.I take 1/2 tablet 2 times a day,total 25mg.I haven't had any problems with it.
